sentence_id,text,language,type,avg_links_len,avg_max_depth,avg_subordinate_chain_len,avg_verb_edges,lexical_density,n_tokens,subordinate_proposition_dist,verbal_head_per_sent
1948,How do you qualify for the Formula One World Championship?,english,content,2.7777777777777777,3.0,0,3.0,0.6,11,0.0,1.0
1949,What other culture's have Skinwalkers?,english,content,1.4,2.0,0,2.0,0.6666666666666666,7,0.0,1.0
1950,When was the Marlboro Man retired from Marlboro's ads?,english,content,2.5555555555555554,3.0,0,4.0,0.6,11,0.0,1.0
1951,What is the oldest MLB team?,english,content,2.4,2.0,0,0,0.5,7,0.0,1.0
1952,What have we recently learned about molecular biology?,english,content,2.2857142857142856,2.0,0,4.0,0.5,9,0.0,1.0
1953,When was the Beat Generation?,english,content,2.0,2.0,0,0,0.6,6,0.0,1.0
1954,How many shows are performed on Broadway each year?,english,content,1.625,3.0,0,4.0,0.6666666666666666,10,0.0,1.0
1955,What state has the most antelopes?,english,content,1.6,2.0,0,2.0,0.6666666666666666,7,0.0,1.0
1956,Who won the DreamHack Open Cluj-Napoca 2015?,english,content,2.142857142857143,3.0,0,2.0,0.625,9,0.0,1.0
1957,Where is the Super Sentai Series from?,english,content,2.0,3.0,0,0,0.5714285714285714,8,0.0,1.0
1958,What country are the Dutch from?,english,content,2.0,2.0,0,0,0.3333333333333333,7,0.0,1.0
1959,When did Doctor Who first premier?,english,content,2.8,2.0,0,3.0,0.8333333333333334,7,0.0,1.0
1960,How many First Nations are registered in Canada?,english,content,1.4285714285714286,3.0,0,3.0,0.75,9,0.0,1.0
1961,How many trains run through Chicago?,english,content,1.2,3.0,0,2.0,0.8333333333333334,7,0.0,1.0
1962,Who is the CEO of the WWE?,english,content,1.8333333333333333,3.0,0,0,0.2857142857142857,8,0.0,1.0
1963,How long did the Battle of Shuja'iyya last?,english,content,2.7142857142857144,3.0,0,2.0,0.625,9,0.0,1.0
1964,What happens when the president and VP of the USA die?,english,content,3.6,4.0,1.0,2.0,0.5454545454545454,12,50.0,2.0
1965,What was the graduating class size of UT 2018?,english,content,1.875,3.0,0,0.0,0.4444444444444444,10,0.0,2.0
1966,Who is the father of calculus?,english,content,1.8,2.0,0,0,0.3333333333333333,7,0.0,1.0
1967,How strong is the Sun's magnetic field?,english,content,2.0,3.0,0,0,0.625,9,0.0,1.0
1968,How much does a shipping car weigh?,english,content,2.3333333333333335,2.0,0,2.0,0.7142857142857143,8,0.0,1.0
1969,Which side of Niagara Falls is prettier?,english,content,2.1666666666666665,3.0,0,0,0.5714285714285714,8,0.0,1.0
1970,Where does the Melbourne Metro Tunnel begin?,english,content,3.0,2.0,0,2.0,0.7142857142857143,8,0.0,1.0
1971,When were flame retardants first invented/ When was Microsoft Windows first released?,english,content,3.3333333333333335,3.0,0,5.0,0.7692307692307693,14,0.0,2.0
1972,How large is Suffolk County in New York?,english,content,1.7142857142857142,3.0,0,0,0.75,9,0.0,1.0
1973,When was the Fermi paradox created?,english,content,2.6,2.0,0,3.0,0.6666666666666666,7,0.0,1.0
1974,How many tourists visit Marfa each year?,english,content,1.3333333333333333,3.0,0,3.0,0.8571428571428571,8,0.0,1.0
1975,What is the oldest building in Briarcliff Manor?,english,content,2.0,3.0,0,0,0.5,9,0.0,1.0
1976,"How many train stations are there in Syracuse, NY?",english,content,1.5,3.0,0,3.0,0.7777777777777778,11,0.0,1.0
1977,How far is it from Douglas to Castletown?,english,content,1.7142857142857142,2.0,1.0,0,0.5,9,100.0,1.0
1978,How long do we have to save the environment?,english,content,1.625,3.0,1.0,2.5,0.5555555555555556,10,50.0,2.0
1979,Where was Melissa Gaboriau Auf der Maur born?,english,content,3.7142857142857144,3.0,0,3.0,0.75,9,0.0,1.0
1980,How do you make electrospray?,english,content,1.75,1.0,0,3.0,0.6,6,0.0,1.0
1981,When was the song American Pie first recorded?,english,content,2.5714285714285716,4.0,1.0,3.0,0.75,9,100.0,1.0
1982,What is the life expectancy of a horse?,english,content,2.0,3.0,0,0,0.375,9,0.0,1.0
1983,When was the game Monopoly first released?,english,content,2.8333333333333335,2.0,0,4.0,0.7142857142857143,8,0.0,1.0
1984,What was first Marvel or DC?,english,content,1.6,3.0,0,0,0.5,7,0.0,1.0
1985,How did King Arthur die?,english,content,2.25,2.0,0,2.0,0.8,6,0.0,1.0
1986,When was the Japanese Super Sentai series GoGo Sentai Boukenger first introduced?,english,content,3.727272727272727,3.0,0,5.0,0.8333333333333334,13,0.0,1.0
1987,Who formed the New Zealand Company?,english,content,2.0,3.0,0,2.0,0.6666666666666666,7,0.0,1.0
1988,Where did England colonize in North America?,english,content,2.0,2.0,0,3.0,0.7142857142857143,8,0.0,1.0
1989,What is the oldest brass instrument?,english,content,2.4,2.0,0,0,0.5,7,0.0,1.0
1990,How many council areas are there in Scotland?,english,content,1.4285714285714286,3.0,0,3.0,0.75,9,0.0,1.0
1991,What language is spoken in Indonesia?,english,content,1.4,2.0,0,3.0,0.5,7,0.0,1.0
1992,When was the state of Oaxaca formed?,english,content,3.0,3.0,0,3.0,0.5714285714285714,8,0.0,1.0
1993,Where can black wildebeest be found?,english,content,2.6,2.0,0,3.0,0.6666666666666666,7,0.0,1.0
1994,What is the population of California in 2018?,english,content,1.8571428571428572,3.0,0,0,0.25,9,0.0,1.0
1995,What is a magnetic field?,english,content,2.0,2.0,0,0,0.4,6,0.0,1.0
1996,When did psychology start being practiced?,english,content,1.8,2.0,1.0,2.0,0.6666666666666666,7,50.0,2.0
1997,Where was Sir Harry Ricardo born?,english,content,3.0,2.0,0,3.0,0.8333333333333334,7,0.0,1.0
1998,What is the national dish of Brazil?,english,content,1.8333333333333333,3.0,0,0,0.42857142857142855,8,0.0,1.0
1999,What is polemology?,english,content,1.5,1.0,0,0,0.3333333333333333,4,0.0,1.0
2000,What is colic caused by?,english,content,2.5,2.0,0,3.0,0.4,6,0.0,1.0
2001,What is Tom Clancy's real name?,english,content,2.2,3.0,0,0,0.6666666666666666,7,0.0,1.0
2002,How many people use Chase bank?,english,content,1.2,3.0,0,2.0,1.0,7,0.0,1.0
2003,How large is St. Peter's Square?,english,content,2.1666666666666665,3.0,0,0,0.7142857142857143,8,0.0,1.0
2004,How many Spiderman's are present in Spiderman: Enter the Spiderverse?,english,content,1.5,4.0,1.0,1.0,0.6363636363636364,13,50.0,2.0
2005,When was the last time the Catholic Church got involved in American politics?,english,content,1.9166666666666667,5.0,1.0,2.0,0.6923076923076923,14,50.0,2.0
2006,How did Zeus beat the Titans?,english,content,1.8,2.0,0,3.0,0.6666666666666666,7,0.0,1.0
2007,What state is the oldest in the Union?,english,content,1.7142857142857142,3.0,0,0,0.375,9,0.0,1.0
2008,When did the Phanerozoic Eon begin?,english,content,2.6,2.0,0,2.0,0.6666666666666666,7,0.0,1.0
2009,When were Peter III and Catherine the Great married?,english,content,3.625,4.0,0,2.0,0.5555555555555556,10,0.0,1.0
2010,What percentage of the Pakistani population is Hindu?,english,content,2.5714285714285716,3.0,0,0,0.5,9,0.0,1.0
2011,Why does the UK want to leave the EU?,english,content,1.875,3.0,1.0,2.5,0.5555555555555556,10,50.0,2.0
2012,When was Resonance of Fate released?,english,content,3.0,3.0,0,3.0,0.6666666666666666,7,0.0,1.0
2013,What percentage of women experience baldness?,english,content,1.6,3.0,0,2.0,0.6666666666666666,7,0.0,1.0
2014,When did Doctor Who first air?,english,content,2.8,2.0,0,3.0,0.8333333333333334,7,0.0,1.0
2015,how big was the Imperial Japanese Navy?,english,content,2.1666666666666665,2.0,0,0,0.7142857142857143,8,0.0,1.0
2016,How many American women take Estramustine phosphate?,english,content,1.3333333333333333,3.0,0,2.0,1.0,8,0.0,1.0
2017,How many hours by car does it take to travel across Germany?,english,content,1.7272727272727273,3.0,1.0,2.5,0.5833333333333334,13,50.0,2.0
2018,What other animals have language?,english,content,1.25,2.0,0,2.0,0.8,6,0.0,1.0
2019,What is Anzac Avenue named for?,english,content,2.8,2.0,0,3.0,0.5,7,0.0,1.0
2020,Which are the Sandwich Islands?,english,content,2.5,1.0,0,0,0.4,6,0,0.0
2021,How many people work in clothing or textile factories in Bangladesh?,english,content,2.1,4.0,0,2.0,0.7272727272727273,12,0.0,1.0
2022,How long is the border between Germany and France?,english,content,1.5,4.0,0,0,0.5555555555555556,10,0.0,1.0
2023,Who attended the The Apalachin meeting?,english,content,2.2,2.0,0,2.0,0.5,7,0.0,1.0
2024,What is the average income in Louisiana?,english,content,1.8333333333333333,3.0,0,0,0.42857142857142855,8,0.0,1.0
2025,When did common law originate?,english,content,2.25,2.0,0,2.0,0.8,6,0.0,1.0
2026,When did the Socialist Party in the US disband?,english,content,3.5,3.0,0,2.0,0.5555555555555556,10,0.0,1.0
2027,What gun was used in the assassination of JFK?,english,content,1.625,3.0,0,3.0,0.4444444444444444,10,0.0,1.0
2028,How long was communism in power in Russia?,english,content,2.0,2.0,0,0,0.625,9,0.0,1.0
2029,What were the three largest economies in the world in 2018?,english,content,2.4,3.0,0,0,0.2727272727272727,12,0.0,1.0
2030,Who pays public housing?,english,content,1.3333333333333333,2.0,0,2.0,0.75,5,0.0,1.0
2031,How expensive is it to run a house on water heating?,english,content,2.0,2.0,1.0,4.0,0.5454545454545454,12,50.0,2.0
2032,What percentage of the American population is below poverty level?,english,content,2.7777777777777777,3.0,0,0,0.5,11,0.0,1.0
2033,What is the largest city in Nottinghamshire?,english,content,1.8333333333333333,3.0,0,0,0.42857142857142855,8,0.0,1.0
2034,What currency is used in Switzerland?,english,content,1.4,2.0,0,3.0,0.5,7,0.0,1.0
2035,Which country is most affected by water scarcity?,english,content,1.8571428571428572,2.0,0,4.0,0.625,9,0.0,1.0
2036,How long did Latvia stay part of the Soviet Union?,english,content,2.0,3.0,0,3.0,0.7,11,0.0,1.0
2037,How many species of Catopsbaatar have been identified?,english,content,1.8571428571428572,3.0,0,2.0,0.625,9,0.0,1.0
2038,When was the Berlin Observatory created?,english,content,2.6,2.0,0,3.0,0.6666666666666666,7,0.0,1.0
2039,How long was Takeo Fukuda prime minister of Japan?,english,content,1.875,3.0,0,0,0.7777777777777778,10,0.0,1.0
2040,What is stainless steel?,english,content,1.6666666666666667,2.0,0,0,0.5,5,0.0,1.0
2041,What is the smallest animal on Earth?,english,content,1.8333333333333333,3.0,0,0,0.42857142857142855,8,0.0,1.0
2042,What other movies has Rob Zombie directed?,english,content,2.1666666666666665,2.0,0,2.0,0.7142857142857143,8,0.0,1.0
2043,Where was Antigone first performed?,english,content,2.5,1.0,0,4.0,0.8,6,0.0,1.0
2044,When did Sudan become a republic?,english,content,1.8,2.0,0,3.0,0.6666666666666666,7,0.0,1.0
2045,How many officers are apart of The Metropolitan Police Department?,english,content,2.2222222222222223,3.0,0,0,0.7,11,0.0,1.0
2046,How is hardness determined?,english,content,2.0,1.0,0,3.0,0.75,5,0.0,1.0
2047,What's the pregnancy rate on the mini pill?,english,content,2.25,3.0,0,0,0.4444444444444444,10,0.0,1.0
2048,How many countries comprise the Middle East?,english,content,1.5,3.0,0,2.0,0.8571428571428571,8,0.0,1.0
2049,When did the story of David and Goliath take place?,english,content,3.111111111111111,4.0,0,3.0,0.6,11,0.0,1.0
2050,What do water rails eat?,english,content,2.25,2.0,0,2.0,0.6,6,0.0,1.0
2051,How many Austrian Jews fled during World War II?,english,content,1.5,3.0,0,2.0,0.7777777777777778,10,0.0,1.0
2052,Who developed the capacitor?,english,content,1.3333333333333333,2.0,0,2.0,0.5,5,0.0,1.0
2053,How many children did Moses have?,english,content,1.6,3.0,0,2.0,0.8333333333333334,7,0.0,1.0
2054,Where are the Muhajir originally from?,english,content,2.8,2.0,0,0,0.5,7,0.0,1.0
2055,How many people live in Emmanouil Pappas?,english,content,1.1666666666666667,3.0,0,2.0,0.8571428571428571,8,0.0,1.0
2056,Who designed Lightning?,english,content,1.0,1.0,0,2.0,0.6666666666666666,4,0.0,1.0
2057,Who was the oldest turtle in TMNT?,english,content,1.8333333333333333,3.0,0,0,0.42857142857142855,8,0.0,1.0
2058,What are proton pump inhibitors used to treat?,english,content,2.142857142857143,3.0,1.0,2.5,0.625,9,50.0,2.0
2059,Who is Kaiser Permanente's CEO?,english,content,2.0,3.0,0,0,0.5,7,0.0,1.0
2060,What types of Honda Civics are there?,english,content,2.0,3.0,0,2.0,0.5714285714285714,8,0.0,1.0
2061,How old was János Kádár when he died?,english,content,2.0,2.0,1.0,2.0,0.75,9,50.0,2.0
2062,How many casualties were there in the Battle of Warsaw?,english,content,1.5555555555555556,3.0,0,0,0.5,11,0.0,0.0
2063,How long does a freestyle wrestling match last?,english,content,2.5714285714285716,3.0,0,2.0,0.75,9,0.0,1.0
2064,how long can a helicopter fly?,english,content,2.0,2.0,0,2.0,0.6666666666666666,7,0.0,1.0
2065,What years did Akbar the Great live?,english,content,2.6666666666666665,3.0,0,2.0,0.5714285714285714,8,0.0,1.0
2066,Where do Butterball turkeys come from?,english,content,2.0,2.0,0,3.0,0.6666666666666666,7,0.0,1.0
2067,"How old is Bath, England?",english,content,2.0,1.0,0,0,0.8,7,0.0,1.0
2068,When was BOAC founded?,english,content,2.0,1.0,0,3.0,0.75,5,0.0,1.0
2069,What science fiction film first featured robots?,english,content,1.5,3.0,0,3.0,0.8571428571428571,8,0.0,1.0
2070,When was the first AFL Grand Final?,english,content,2.8333333333333335,2.0,0,0,0.7142857142857143,8,0.0,1.0
2071,Which country is richest in 2018?,english,content,1.4,2.0,0,0,0.3333333333333333,7,0.0,1.0
2072,Where do fiddle ferns grow?,english,content,2.25,2.0,0,2.0,0.8,6,0.0,1.0
2073,What's the main export of Connecticut?,english,content,1.8333333333333333,3.0,0,0,0.42857142857142855,8,0.0,1.0
2074,How is intellect measured?,english,content,2.0,1.0,0,3.0,0.75,5,0.0,1.0
2075,What other works has Jessica Fox been in?,english,content,2.4285714285714284,2.0,0,0,0.5,9,0,0.0
2076,Who is the biggest record holder for the New England Patriots?,english,content,2.9,3.0,0,0,0.5454545454545454,12,0.0,1.0
2077,Where is the Jandarma İstihbarat ve Terörle Mücadele headquartered?,english,content,3.5,3.0,0,3.0,0.6666666666666666,10,0.0,1.0
2078,How many countries speak Spanish?,english,content,1.0,3.0,0,2.0,1.0,6,0.0,1.0
2079,How good is our Water purification technology?,english,content,2.0,3.0,0,0,0.7142857142857143,8,0.0,1.0
2080,How many people actually have OCD?,english,content,1.2,3.0,0,3.0,1.0,7,0.0,1.0
2081,Where is the largest population of wild oysters?,english,content,2.0,3.0,0,0,0.625,9,0.0,1.0
2082,What are the names of Donald Duck's three nephews?,english,content,2.6666666666666665,4.0,0,0,0.4,11,0.0,1.0
2083,Who built the Erie Canal?,english,content,1.75,2.0,0,2.0,0.6,6,0.0,1.0
2084,What is the symbol for platinum?,english,content,1.6,3.0,0,0,0.3333333333333333,7,0.0,1.0
2085,When was Khaled Hosseini born?,english,content,2.5,2.0,0,3.0,0.8,6,0.0,1.0
2086,Where is the largest synagogue?,english,content,2.0,2.0,0,0,0.6,6,0.0,1.0
2087,How many Formula 1 racetracks are there in the US?,english,content,1.7777777777777777,3.0,0,3.0,0.6,11,0.0,1.0
2088,When was the visual novel Clannad first released?,english,content,2.857142857142857,3.0,0,4.0,0.75,9,0.0,1.0
2089,Where were the first public buses used?,english,content,3.0,2.0,0,3.0,0.7142857142857143,8,0.0,1.0
2090,How old is Laura Wright?,english,content,1.25,2.0,0,0,0.8,6,0.0,1.0
2091,How do torpedo work?,english,content,2.0,1.0,0,2.0,0.75,5,0.0,1.0
2092,What is Nick Adams doing now?,english,content,2.2,2.0,0,3.0,0.6666666666666666,7,0.0,1.0
2093,How old is Ronald Rand?,english,content,1.25,2.0,0,0,0.8,6,0.0,1.0
2094,How do you enter shooting competitions?,english,content,1.8,2.0,0,3.0,0.6666666666666666,7,0.0,1.0
2095,How much does oil shale sell for?,english,content,2.5,2.0,0,2.0,0.7142857142857143,8,0.0,1.0
2096,By what margin did Bill Clinton win in 1992?,english,content,2.0,2.0,0,3.0,0.4444444444444444,10,0.0,1.0
2097,What is the longest episode in American Horror Story?,english,content,2.5,2.0,0,0,0.5555555555555556,10,0.0,1.0
2098,What percentage of Japan's land is agricultural?,english,content,2.5714285714285716,4.0,0,0,0.5,9,0.0,1.0
2099,How many toes does a chicken have?,english,content,1.8333333333333333,3.0,0,2.0,0.7142857142857143,8,0.0,1.0
2100,When does a body get embalmed?,english,content,2.6,2.0,0,3.0,0.5,7,0.0,1.0
2101,How long did the The Italian,english,content,1.8,2.0,0,0,0.5,6,0,0.0
2102,Wars last?,english,content,1.0,1.0,0,0,1.0,3,0,0.0
2103,Who was emperor when Jesus died?,english,content,1.8,2.0,1.0,2.0,0.6666666666666666,7,50.0,2.0
2104,When did Maryland become a colony?,english,content,1.8,2.0,0,3.0,0.6666666666666666,7,0.0,1.0
2105,Who first introduced the concept of mathematical functions?,english,content,1.7142857142857142,3.0,0,3.0,0.625,9,0.0,1.0
2106,How do you become a scientist?,english,content,1.8,2.0,0,3.0,0.5,7,0.0,1.0
2107,What can you do with a philosophy degree?,english,content,2.2857142857142856,2.0,0,3.0,0.375,9,0.0,1.0
2108,How many characters have been killed off on Days of Our Lives?,english,content,1.7272727272727273,3.0,0,4.0,0.5,13,0.0,1.0
2109,How many parishes are there in Louisiana?,english,content,1.3333333333333333,3.0,0,3.0,0.7142857142857143,8,0.0,1.0
2110,How old was Albert in The Little Albert experiment?,english,content,2.5,3.0,0,0,0.6666666666666666,10,0.0,1.0
2111,Who wrote The Concept of Anxiety: A Simple Psychologically Orienting Deliberation on the Dogmatic Issue of Hereditary Sin?,english,content,2.3529411764705883,5.0,0,1.5,0.6111111111111112,20,0.0,2.0
2112,When did Lin Biao become a Marshal of the People's Republic of China?,english,content,2.230769230769231,4.0,0,3.0,0.5714285714285714,15,0.0,1.0
2113,When was the last time a man landed on the moon?,english,content,1.9,4.0,1.0,2.0,0.5454545454545454,12,50.0,2.0
2114,What agency controls water sanitation in Zambia?,english,content,1.6666666666666667,2.0,0,3.0,0.7142857142857143,8,0.0,1.0
2115,What is the most common symptom of PCS?,english,content,2.0,3.0,0,0,0.5,9,0.0,1.0
2116,When was Gibson founded?,english,content,2.0,1.0,0,3.0,0.75,5,0.0,1.0
2117,What year was the Detroit Lions team formed?,english,content,2.5714285714285716,3.0,0,3.0,0.625,9,0.0,1.0
2118,How many hours of sunlight does Alaska get?,english,content,1.8571428571428572,3.0,0,2.0,0.75,9,0.0,1.0
2119,How much do architects make in 2018?,english,content,1.6666666666666667,2.0,0,3.0,0.5714285714285714,8,0.0,1.0
2120,What kind of mushrooms live on live trees?,english,content,1.8571428571428572,3.0,0,2.0,0.625,9,0.0,1.0
2121,Who was the mangaka for Pokemon?,english,content,1.6,3.0,0,0,0.3333333333333333,7,0.0,1.0
2122,How many indigenous people's are in Mexico?,english,content,1.7142857142857142,3.0,0,0,0.625,9,0,0.0
2123,When did the Ottoman Empire form?,english,content,2.6,2.0,0,2.0,0.6666666666666666,7,0.0,1.0
2124,Where is Preston Albert Watson buried?,english,content,3.0,2.0,0,3.0,0.8333333333333334,7,0.0,1.0
2125,How long is the ABC Chinese–English Dictionary?,english,content,3.142857142857143,2.0,0,0,0.75,10,0.0,1.0
2126,Who was the first person to fly around the world?,english,content,1.8888888888888888,4.0,1.0,2.0,0.4,11,50.0,2.0
2127,Who is the current Prime Minister of Romania?,english,content,2.142857142857143,3.0,0,0,0.5,9,0.0,1.0
2128,How many students enrolled in MICA in 2018?,english,content,1.5714285714285714,3.0,0,3.0,0.625,9,0.0,1.0
2129,What is the most abundant crop in China?,english,content,2.0,3.0,0,0,0.5,9,0.0,1.0
2130,How many seasons has Empire been on the air?,english,content,2.875,3.0,0,0,0.5555555555555556,10,0.0,1.0
2131,What is the cold-pressed juice process?,english,content,3.0,3.0,0,1.0,0.5714285714285714,9,0.0,2.0
2132,How many radio stations are based in Boston?,english,content,1.4285714285714286,3.0,0,3.0,0.75,9,0.0,1.0
2133,How old is the Penn State Nittany Lions football team?,english,content,2.7777777777777777,3.0,0,0,0.8,11,0.0,1.0
2134,How many people live in Croatia?,english,content,1.2,3.0,0,2.0,0.8333333333333334,7,0.0,1.0
2135,What was the last conflict that the Loyal Regiment fought in?,english,content,2.6,4.0,1.0,2.0,0.45454545454545453,12,50.0,2.0
2136,What is the pointy Chinese hat called?,english,content,3.0,2.0,0,3.0,0.5714285714285714,8,0.0,1.0
2137,Which book is most translated in the world?,english,content,1.8571428571428572,2.0,0,4.0,0.5,9,0.0,1.0
2138,What is the oldest religion?,english,content,2.0,2.0,0,0,0.4,6,0.0,1.0
2139,How many people inhabit the Andes?,english,content,1.2,3.0,0,2.0,0.8333333333333334,7,0.0,1.0
2140,What is the longest word in German?,english,content,1.8333333333333333,3.0,0,0,0.42857142857142855,8,0.0,1.0
2141,When did skiing become an Olympic sport?,english,content,2.0,2.0,0,3.0,0.7142857142857143,8,0.0,1.0
2142,When was Hafiz the poet born?,english,content,2.8,2.0,0,4.0,0.6666666666666666,7,0.0,1.0
2143,When were submarines introduced in warfare?,english,content,1.8,2.0,0,4.0,0.6666666666666666,7,0.0,1.0
2144,How tall was the Baryonyx?,english,content,1.5,2.0,0,0,0.6,6,0.0,1.0
2145,Who was the first person to sail around the world?,english,content,1.8888888888888888,4.0,1.0,2.0,0.4,11,50.0,2.0
2146,Who the the current MVP of the National Hockey League?,english,content,2.7777777777777777,3.0,0,0,0.5,11,0,0.0
2147,Was the Justice Party formed to get Indian independence?,english,content,1.75,3.0,1.0,2.5,0.6666666666666666,10,50.0,2.0
2148,How much did Manchester as a team gross last year?,english,content,2.7777777777777777,3.0,0,3.0,0.7,11,0.0,1.0
2149,How old was William,english,content,1.3333333333333333,1.0,0,0,0.75,4,0.0,1.0
2150,Beck when he was cast as Dylan Keogh?,english,content,2.0,3.0,1.0,4.0,0.625,9,100.0,1.0
2151,What is the largest minority group in Europe?,english,content,2.142857142857143,3.0,0,0,0.5,9,0.0,1.0
2152,When was Cipro introduced?,english,content,2.0,1.0,0,3.0,0.75,5,0.0,1.0
2153,At what age is circumcision typically performed in the Jewish tradition?,english,content,2.3,2.0,0,5.0,0.5454545454545454,12,0.0,1.0
2154,What was the first genetically modified crop plant?,english,content,3.0,3.0,0,1.0,0.625,9,0.0,2.0
2155,What is the first armed conflict Yates Stirling Jr. served in with the Navy?,english,content,2.3076923076923075,4.0,1.0,3.0,0.5714285714285714,15,50.0,2.0
2156,Who first colonized the Falkland Islands?,english,content,1.8,2.0,0,3.0,0.6666666666666666,7,0.0,1.0
2157,When was Fate/stay night first released as an adult game for Windows?,english,content,2.6153846153846154,3.0,0,5.0,0.6428571428571429,15,0.0,1.0
2158,How many volumes are in the Fullmetal Alchemist?,english,content,2.4285714285714284,3.0,0,0,0.625,9,0,0.0
2159,What does Hispanic mean?,english,content,2.0,1.0,0,2.0,0.5,5,0.0,1.0
2160,Who rules Tibet?,english,content,1.0,1.0,0,2.0,0.6666666666666666,4,0.0,1.0
2161,Where did Zionism originate?,english,content,2.0,1.0,0,2.0,0.75,5,0.0,1.0
2162,Was Metroid Prime 2: Echoes released only on gamecube?,english,content,2.625,2.0,0,3.0,0.6666666666666666,11,0.0,1.0
2163,What was the average lifespan in Ancient Greece?,english,content,2.0,3.0,0,0,0.5,9,0.0,1.0
2164,When was Walt Disney Pictures' animated feature film Beauty and the Beast released in theaters?,english,content,3.4,4.0,0,4.0,0.6875,17,0.0,1.0
2165,How many countries does the Francophone nation encompass?,english,content,2.142857142857143,3.0,0,2.0,0.75,9,0.0,1.0
2166,Who discovered plasma cells?,english,content,1.3333333333333333,2.0,0,2.0,0.75,5,0.0,1.0
2167,When was the first embryo transfer performed?,english,content,3.0,2.0,0,3.0,0.7142857142857143,8,0.0,1.0
2168,What is a telescope?,english,content,1.6666666666666667,2.0,0,0,0.25,5,0.0,1.0
2169,What was the first university in the US?,english,content,2.0,3.0,0,0,0.375,9,0.0,1.0
2170,How much damage did the Havana hurricane do?,english,content,2.142857142857143,3.0,0,2.0,0.75,9,0.0,1.0
2171,What types of desert are there?,english,content,1.6,3.0,0,2.0,0.5,7,0.0,1.0
2172,Who dies at the end of The Order of the Phoenix?,english,content,1.9,4.0,0,2.0,0.36363636363636365,12,0.0,1.0
2173,What countries need better Water purification?,english,content,1.6,2.0,0,2.0,0.8333333333333334,7,0.0,1.0
2174,What's the longest highway in America?,english,content,1.8333333333333333,3.0,0,0,0.42857142857142855,8,0.0,1.0
2175,What's the half-life of uranium?,english,content,2.3333333333333335,3.0,0,0,0.42857142857142855,9,0.0,1.0
2176,When was Georgetown University founded?,english,content,2.25,2.0,0,3.0,0.8,6,0.0,1.0
2177,When was the Jandarma İstihbarat ve Terörle Mücadele formed?,english,content,3.5,3.0,0,3.0,0.6666666666666666,10,0.0,1.0
2178,How India was given its name?,english,content,1.8,2.0,0,4.0,0.6666666666666666,7,0.0,1.0
2179,How long is the coastline of Florida?,english,content,1.5,3.0,0,0,0.5714285714285714,8,0.0,1.0
2180,When did the first episode of the TV show UFO air?,english,content,3.9,4.0,1.0,2.0,0.6363636363636364,12,100.0,1.0
2181,When was the electrostatic machine invented?,english,content,2.6,2.0,0,3.0,0.6666666666666666,7,0.0,1.0
2182,When was the Mobutu regime?,english,content,2.0,2.0,0,0,0.6,6,0.0,1.0
2183,How many comic book issues does Lady Shiva appear in?,english,content,1.8888888888888888,3.0,0,3.0,0.8,11,0.0,1.0
2184,When did the first episode of the TV series Preacher originally air?,english,content,3.909090909090909,3.0,0,3.0,0.6666666666666666,13,0.0,1.0
2185,How big is the Norwegian Sea?,english,content,1.8,2.0,0,0,0.6666666666666666,7,0.0,1.0
2186,Who made the first rubber balloon?,english,content,2.2,2.0,0,2.0,0.6666666666666666,7,0.0,1.0
2187,How many Medici villas are there?,english,content,1.2,3.0,0,0,0.8333333333333334,7,0.0,0.0
2188,How many episodes does The Red Green Show have?,english,content,2.375,3.0,0,2.0,0.7777777777777778,10,0.0,1.0
2189,Who named the Wolff rearrangement?,english,content,1.75,2.0,0,2.0,0.6,6,0.0,1.0
2190,What is the official currency in Zambia?,english,content,1.8333333333333333,3.0,0,0,0.42857142857142855,8,0.0,1.0
