sentence_id,text,language,type,avg_links_len,avg_max_depth,avg_subordinate_chain_len,avg_verb_edges,lexical_density,n_tokens,subordinate_proposition_dist,verbal_head_per_sent
6085,Who first developed trigonometry?,english,content,1.3333333333333333,1.0,0,3.0,0.75,5,0.0,1.0
6086,When was Finland founded?,english,content,2.0,1.0,0,3.0,0.75,5,0.0,1.0
6087,What is Portugal's government style?,english,content,2.2,3.0,0,0,0.5,7,0.0,1.0
6088,What is the largest type of ant?,english,content,1.8333333333333333,3.0,0,0,0.42857142857142855,8,0.0,1.0
6089,What was the most powerful Chinese dynasty?,english,content,2.5,3.0,0,0,0.5714285714285714,8,0.0,1.0
6090,What is the tallest mountain in Argentina?,english,content,1.8333333333333333,3.0,0,0,0.42857142857142855,8,0.0,1.0
6091,Why is it called Buenos Aires?,english,content,1.6,2.0,0,4.0,0.6666666666666666,7,0.0,1.0
6092,How many men does it take to drive a tank?,english,content,1.5555555555555556,3.0,1.0,2.5,0.6,11,50.0,2.0
6093,Who was the first woman golfer in Ireland?,english,content,2.142857142857143,3.0,0,0,0.5,9,0.0,1.0
6094,How many members does The Council for Mutual Economic Assistance have?,english,content,3.3,3.0,0,2.0,0.7272727272727273,12,0.0,1.0
6095,What is the recommended amount of dietary protein for adult humans?,english,content,2.3,3.0,0,0.0,0.5454545454545454,12,0.0,2.0
6096,What is the survival rate for glioblastoma multiforme?,english,content,2.0,3.0,0,0,0.5,9,0.0,1.0
6097,Where was the first satellite station built?,english,content,2.1666666666666665,2.0,1.0,0.0,0.7142857142857143,8,50.0,2.0
6098,Where can you get Vitamin E from?,english,content,1.6666666666666667,2.0,0,3.0,0.5714285714285714,8,0.0,1.0
6099,How much marine salvage is there in the ocean?,english,content,1.625,3.0,0,3.0,0.6666666666666666,10,0.0,1.0
6100,Who were the main actors in the X-Files series?,english,content,2.888888888888889,4.0,0,0,0.5,12,0.0,1.0
6101,When was Emma first published?,english,content,2.5,1.0,0,4.0,0.8,6,0.0,1.0
6102,Who voiced Lumiere in Walt Disney Pictures' animated feature film Beauty and the Beast?,english,content,2.5714285714285716,4.0,0,3.0,0.6666666666666666,16,0.0,1.0
6103,What's the currency in Vietnam?,english,content,1.6,3.0,0,0,0.3333333333333333,7,0.0,1.0
6104,What was the capital of Chaldea?,english,content,1.6,3.0,0,0,0.3333333333333333,7,0.0,1.0
6105,How many people have PCS after a concussion?,english,content,1.5714285714285714,3.0,0,3.0,0.75,9,0.0,1.0
6106,Who is the main character of Heart of Darkness?,english,content,1.75,4.0,0,0,0.4444444444444444,10,0.0,1.0
6107,Who do Roman Catholics worship?,english,content,2.25,2.0,0,2.0,0.6,6,0.0,1.0
6108,How many people died during Operation Hush?,english,content,1.5,3.0,0,2.0,0.8571428571428571,8,0.0,1.0
6109,Who identified inclusive fitness theory?,english,content,1.75,2.0,0,2.0,0.8,6,0.0,1.0
6110,When did sound in film first show up?,english,content,2.857142857142857,3.0,0,4.0,0.625,9,0.0,1.0
6111,Who was the ruler of UK during the Classical period?,english,content,2.2222222222222223,3.0,0,0,0.4,11,0.0,1.0
6112,When was the first submarine developed that could carry humans?,english,content,1.8888888888888888,3.0,1.0,1.0,0.6,11,66.66666666666667,3.0
6113,When was the Ruddle's Building in Brisbane built?,english,content,3.125,3.0,0,3.0,0.5555555555555556,10,0.0,1.0
6114,Who lead the Pugachev's Rebellion?,english,content,1.75,2.0,0,2.0,0.6,6,0.0,1.0
6115,What was the first game on the Atari?,english,content,2.0,3.0,0,0,0.375,9,0.0,1.0
6116,What causes low metabolism?,english,content,1.3333333333333333,2.0,0,2.0,0.75,5,0.0,1.0
6117,Was Hitchens a Populist?,english,content,2.0,1.0,0,0,0.5,5,0,0.0
6118,What is the earliest known civilization?,english,content,2.4,2.0,0,0.0,0.5,7,0.0,2.0
6119,Why is voting day on a Tuesday?,english,content,3.0,2.0,0,0,0.5714285714285714,8,0,0.0
6120,How old is the oldest surviving biblical text?,english,content,2.5714285714285716,2.0,0,0.0,0.75,9,0.0,2.0
6121,How many plays did Sophocles write?,english,content,1.6,3.0,0,2.0,0.8333333333333334,7,0.0,1.0
6122,When were medical ethics created?,english,content,2.25,2.0,0,3.0,0.8,6,0.0,1.0
6123,Where is Salvija Square located?,english,content,2.25,2.0,0,3.0,0.8,6,0.0,1.0
6124,What is the tallest volcano in Hawaii?,english,content,1.8333333333333333,3.0,0,0,0.42857142857142855,8,0.0,1.0
6125,Who is Bill Belichick?,english,content,1.3333333333333333,2.0,0,0,0.5,5,0.0,1.0
6126,How many toys do Americans by each year?,english,content,1.5714285714285714,3.0,0,0,0.625,9,0.0,0.0
6127,How many hurricanes were there in the Pacific hurricane season of 2000?,english,content,2.0,3.0,0,0,0.5,13,0.0,0.0
6128,How large is Angola?,english,content,1.3333333333333333,1.0,0,0,0.75,5,0.0,1.0
6129,How often does Indonesia flood during the wet season?,english,content,2.125,2.0,0,3.0,0.6666666666666666,10,0.0,1.0
6130,Who leads the Canadian Forces?,english,content,1.75,2.0,0,2.0,0.6,6,0.0,1.0
6131,How many guests can the Sporthotel Pontresina accommodate?,english,content,2.142857142857143,3.0,0,2.0,0.75,9,0.0,1.0
6132,What is the oldest surviving example of the ancient Roman alphabet script?,english,content,3.0,3.0,0,0.0,0.5833333333333334,13,0.0,2.0
6133,When was the snare drum invented?,english,content,2.6,2.0,0,3.0,0.6666666666666666,7,0.0,1.0
6134,How many units are there currently of the SAS?,english,content,1.75,3.0,0,4.0,0.6666666666666666,10,0.0,1.0
6135,How many people subscribed to AOL in its first year?,english,content,2.0,3.0,0,3.0,0.7,11,0.0,1.0
6136,Who pioneered sport psychology?,english,content,1.3333333333333333,2.0,0,2.0,0.75,5,0.0,1.0
6137,When was the cellist first invented?,english,content,2.6,2.0,0,4.0,0.6666666666666666,7,0.0,1.0
6138,How effective is thermal power?,english,content,1.5,2.0,0,0,0.8,6,0.0,1.0
6139,How many inches of rain did Florida get in 2018?,english,content,1.7777777777777777,3.0,0,3.0,0.6,11,0.0,1.0
6140,How many people watched the Hard Justice event in 2008?,english,content,2.111111111111111,3.0,0,3.0,0.7,11,0.0,1.0
6141,How many stories are in One Thousand and One Nights?,english,content,3.0,3.0,0,0,0.4,11,0.0,1.0
6142,How long did The Cosby Show air?,english,content,2.3333333333333335,2.0,0,2.0,0.7142857142857143,8,0.0,1.0
6143,Who performed the first lobotomy?,english,content,1.75,2.0,0,2.0,0.6,6,0.0,1.0
6144,Who ruled the Kingdom of Jordan?,english,content,1.4,3.0,0,2.0,0.5,7,0.0,1.0
6145,Where do the most floods happen in the world?,english,content,2.375,2.0,0,3.0,0.5555555555555556,10,0.0,1.0
6146,What is the population density of NYC?,english,content,1.8333333333333333,3.0,0,0,0.42857142857142855,8,0.0,1.0
6147,When was Saint Petersburg first founded?,english,content,2.8,2.0,0,4.0,0.8333333333333334,7,0.0,1.0
6148,Where in Italy is Tuscany?,english,content,2.5,2.0,0,0,0.6,6,0.0,1.0
6149,How long has television been around for?,english,content,2.6666666666666665,2.0,0,0,0.5714285714285714,8,0.0,1.0
6150,Who led The Actions of 30 September – 4 October 1917?,english,content,1.7,4.0,0,2.0,0.36363636363636365,12,0.0,1.0
6151,what is a representative democracy?,english,content,2.0,2.0,0,0,0.4,6,0.0,1.0
6152,What is the largest glacier?,english,content,2.0,2.0,0,0,0.4,6,0.0,1.0
6153,What is the price of racing car?,english,content,1.8333333333333333,3.0,0,0,0.42857142857142855,8,0.0,1.0
6154,How many doctors are in Doctor Who?,english,content,1.5,3.0,0,0,0.7142857142857143,8,0,0.0
6155,How are units broken down in the Army?,english,content,2.0,2.0,0,5.0,0.5,9,0.0,1.0
6156,When was the nutrition facts label first required by law in the U.S.?,english,content,2.6666666666666665,3.0,0,6.0,0.6153846153846154,14,0.0,1.0
6157,What's the most malleable metal?,english,content,2.8,2.0,0,0,0.5,7,0.0,1.0
6158,Who first identified HIV?,english,content,1.3333333333333333,1.0,0,3.0,0.75,5,0.0,1.0
6159,How many superpowers does Deadpool have?,english,content,1.6,3.0,0,2.0,0.8333333333333334,7,0.0,1.0
6160,Who led the British fleet that first landed in Australia?,english,content,1.7777777777777777,4.0,1.0,2.5,0.6,11,50.0,2.0
6161,When is Monsta X touring?,english,content,2.25,2.0,0,2.0,0.8,6,0.0,1.0
6162,Who won the gold medal in female gymnastics in the 2000 Olympics?,english,content,2.6363636363636362,3.0,0,3.0,0.5,13,0.0,1.0
6163,Who were the first ASEAN member states?,english,content,2.8333333333333335,2.0,0,0,0.5714285714285714,8,0.0,1.0
6164,How many students does Manchester Essex Regional High School have?,english,content,2.888888888888889,3.0,0,2.0,0.9,11,0.0,1.0
6165,What is the big plateau rock in Australia called?,english,content,2.25,3.0,1.0,0.0,0.5555555555555556,10,50.0,2.0
6166,Where was Jacques de Molay born?,english,content,3.0,2.0,0,3.0,0.8333333333333334,7,0.0,1.0
6167,What is the percentage of Protestants in USA?,english,content,1.8571428571428572,3.0,0,0,0.375,9,0.0,1.0
6168,What is the current rate of deforestation in the world?,english,content,2.111111111111111,3.0,0,0,0.4,11,0.0,1.0
6169,How many people are native German speakers?,english,content,2.0,3.0,0,0,0.8571428571428571,8,0.0,1.0
6170,When was the Battle of Gettysburg?,english,content,1.6,3.0,0,0,0.5,7,0.0,1.0
6171,What is the most common type of bee?,english,content,2.0,3.0,0,0,0.5,9,0.0,1.0
6172,How much did Monty Python's Flying Circle gross?,english,content,2.625,3.0,0,1.0,0.7777777777777778,10,0.0,2.0
6173,When was Lincoln automotive founded?,english,content,2.25,2.0,0,3.0,0.8,6,0.0,1.0
6174,How long are Disney movies on average?,english,content,2.3333333333333335,2.0,0,0,0.7142857142857143,8,0.0,1.0
6175,Who developed the Attachment and Health psychological model?,english,content,2.857142857142857,4.0,0,2.0,0.625,9,0.0,1.0
6176,How long does a degree in evolutionary psychology take?,english,content,3.125,3.0,0,2.0,0.6666666666666666,10,0.0,1.0
6177,What can we do with oxidative phosphorylation?,english,content,2.0,2.0,0,3.0,0.42857142857142855,8,0.0,1.0
6178,Who is the heaviest human?,english,content,2.0,2.0,0,0,0.4,6,0.0,1.0
6179,How does weight-lifting increase muscle size?,english,content,2.5,2.0,0,3.0,0.8571428571428571,9,0.0,1.0
6180,How many households in Hong Kong have a domestic pet?,english,content,1.7777777777777777,3.0,0,2.0,0.8,11,0.0,1.0
6181,What are the main climate types?,english,content,2.4,2.0,0,0,0.5,7,0.0,1.0
6182,How many people use the Portland Streetcar?,english,content,1.5,3.0,0,2.0,0.8571428571428571,8,0.0,1.0
6183,How many marine reptiles existed?,english,content,1.25,3.0,0,1.0,1.0,6,0.0,1.0
6184,Who won The Battle of Kyongju?,english,content,1.4,3.0,0,2.0,0.5,7,0.0,1.0
6185,Where are dead buried in Daoist cultures?,english,content,2.0,2.0,0,4.0,0.7142857142857143,8,0.0,1.0
6186,How large is Flanders today?,english,content,1.75,1.0,0,0,0.8,6,0.0,1.0
6187,When did Yates Stirling Jr. become an admiral?,english,content,2.5714285714285716,2.0,0,3.0,0.75,9,0.0,1.0
6188,When was the Nobel Prize begun?,english,content,2.6,2.0,0,3.0,0.6666666666666666,7,0.0,1.0
6189,What's the melting point of Silicon?,english,content,2.1666666666666665,2.0,0,0,0.42857142857142855,8,0.0,1.0
6190,When was the first episode of American Horror Story: Roanoke?,english,content,2.2222222222222223,3.0,0,0,0.7,12,0.0,1.0
6191,Who was the first president of the new South Korea?,english,content,2.7777777777777777,3.0,1.0,0,0.5,11,100.0,1.0
6192,Who wrote the War of the Spider Queen series?,english,content,3.625,4.0,0,2.0,0.5555555555555556,10,0.0,1.0
6193,Where were embryonic stem cells first used in research?,english,content,2.5,2.0,0,5.0,0.7777777777777778,10,0.0,1.0
6194,When did the Dillinger Gang end?,english,content,2.6,2.0,0,2.0,0.6666666666666666,7,0.0,1.0
6195,What year did Trafalgar take place?,english,content,1.6,2.0,0,3.0,0.6666666666666666,7,0.0,1.0
6196,What is the strongest recorded earthquake?,english,content,2.4,2.0,0,0.0,0.5,7,0.0,2.0
6197,What is the largest sewing needle manufacturer?,english,content,2.6666666666666665,3.0,0,0,0.5714285714285714,8,0.0,1.0
6198,Why do blinds go on takeoff and landing?,english,content,1.7142857142857142,3.0,0,3.0,0.625,9,0.0,1.0
6199,Who won the 2017 Mexico City ePrix?,english,content,2.5,3.0,0,2.0,0.5714285714285714,8,0.0,1.0
6200,How did Dom Manuel II die?,english,content,3.0,2.0,0,2.0,0.6666666666666666,7,0.0,1.0
6201,How long does it take phytophthora ramorum to kill an oak tree?,english,content,1.9090909090909092,3.0,1.0,3.0,0.6666666666666666,13,50.0,2.0
6202,When was Universal Credit instated?,english,content,2.25,2.0,0,3.0,0.8,6,0.0,1.0
6203,Who is the mascot of the Florida State University football team?,english,content,3.0,3.0,0,0,0.5454545454545454,12,0.0,1.0
6204,Which country has the highest rate of unemployment?,english,content,1.5714285714285714,3.0,0,2.0,0.625,9,0.0,1.0
6205,Why Australia is not an island?,english,content,3.0,1.0,0,0,0.5,7,0.0,1.0
6206,When was Sun Yat-sen born?,english,content,3.8,2.0,0,3.0,0.8333333333333334,8,0.0,1.0
6207,Who was the last earl of Sandwich?,english,content,1.8333333333333333,3.0,0,0,0.42857142857142855,8,0.0,1.0
6208,How many people live in Massachusett?,english,content,1.2,3.0,0,2.0,0.8333333333333334,7,0.0,1.0
6209,Who was the first leader of the Student Federation of the University of Ottawa?,english,content,2.076923076923077,5.0,0,0,0.42857142857142855,15,0.0,1.0
6210,Who murdered Charles Walton on 14 February 1945?,english,content,1.7142857142857142,2.0,0,3.0,0.5,9,0.0,1.0
6211,Who was first leader of the 2nd Dragoon Regiment?,english,content,2.625,2.0,0,0,0.5555555555555556,10,0.0,1.0
6212,Which hero does The Chameleon fight?,english,content,2.0,2.0,0,2.0,0.5,7,0.0,1.0
6213,How many items are in the Hermitage museum collection?,english,content,2.875,3.0,0,0,0.6666666666666666,10,0.0,1.0
6214,How do you prevent traumatic brain injury?,english,content,2.0,2.0,0,3.0,0.7142857142857143,8,0.0,1.0
6215,How many Bedouin tribes are there?,english,content,1.2,3.0,0,0,0.6666666666666666,7,0.0,0.0
6216,When did St Teresa of Calcutta died?,english,content,3.3333333333333335,3.0,0,2.0,0.7142857142857143,8,0.0,1.0
6217,When was the first US transcontinental railroad completed?,english,content,3.4285714285714284,2.0,0,3.0,0.75,9,0.0,1.0
6218,When was the first televised NFL game?,english,content,2.8333333333333335,2.0,0,0.0,0.7142857142857143,8,0.0,2.0
6219,How long does it take to get an engineering degree at UT?,english,content,2.0,3.0,1.0,3.0,0.5833333333333334,13,50.0,2.0
6220,Where was the Republic of Formosa?,english,content,1.6,3.0,0,0,0.5,7,0.0,1.0
6221,Who was the first Nobel prize winner for economics?,english,content,2.875,3.0,1.0,0,0.5555555555555556,10,100.0,1.0
6222,How many members do Cricket teams have?,english,content,1.8333333333333333,3.0,0,2.0,0.8571428571428571,8,0.0,1.0
6223,Where is Slovakia?,english,content,1.5,1.0,0,0,0.6666666666666666,4,0.0,1.0
6224,When was the World Intellectual Property Organization formed?,english,content,3.2857142857142856,3.0,0,3.0,0.75,9,0.0,1.0
6225,When did Portugal's monarchy end?,english,content,2.6,3.0,0,2.0,0.6666666666666666,7,0.0,1.0
6226,Who is the strongest super villain in DC?,english,content,2.5714285714285716,2.0,0,0,0.5,9,0.0,1.0
6227,When was the first Super Sentai Series released?,english,content,2.4285714285714284,3.0,1.0,0.0,0.75,9,50.0,2.0
6228,When did the Crusades begin?,english,content,2.25,2.0,0,2.0,0.6,6,0.0,1.0
6229,When did The Young and the Restless first start airing?,english,content,3.2222222222222223,3.0,1.0,2.0,0.6,11,50.0,2.0
6230,How expensive is an X-ray?,english,content,2.4,2.0,0,0,0.6666666666666666,8,0.0,1.0
6231,How do starfishes eat?,english,content,2.0,1.0,0,2.0,0.75,5,0.0,1.0
6232,When did the German Empire fall?,english,content,2.6,2.0,0,2.0,0.6666666666666666,7,0.0,1.0
6233,How much does an engineering technologist typically make?,english,content,2.5714285714285716,2.0,0,3.0,0.75,9,0.0,1.0
6234,How long has there been a market in Campo dei Fiori in Rome?,english,content,1.9166666666666667,3.0,0,3.0,0.6153846153846154,14,0.0,1.0
6235,Which country has the highest Red Cross membership?,english,content,2.2857142857142856,3.0,0,2.0,0.75,9,0.0,1.0
6236,What is St. Peter the patron Saint of?,english,content,3.7142857142857144,2.0,0,0,0.5,9,0.0,1.0
6237,When did the Ottoman Empire begin and end?,english,content,2.2857142857142856,2.0,0,2.0,0.625,9,0.0,2.0
6238,What is the average wage burger king pays their employees?,english,content,1.7777777777777777,4.0,1.0,2.0,0.6,11,50.0,2.0
6239,What is the most expensive trumpet?,english,content,2.2,3.0,0,0,0.5,7,0.0,1.0
6240,Who owns the largest navy ship?,english,content,2.2,2.0,0,2.0,0.6666666666666666,7,0.0,1.0
6241,When did construction on Caribou Air Force Station begin?,english,content,4.375,4.0,0,2.0,0.7777777777777778,10,0.0,1.0
6242,How is globalization measured?,english,content,2.0,1.0,0,3.0,0.75,5,0.0,1.0
6243,When was I75 made?,english,content,2.0,1.0,0,3.0,0.75,5,0.0,1.0
6244,What are the fields of study focused on human behavior?,english,content,1.8888888888888888,4.0,1.0,1.0,0.5,11,50.0,2.0
6245,How many acres do you need to have a small farm?,english,content,1.9,4.0,1.0,2.5,0.6363636363636364,12,50.0,2.0
6246,When was the first case of HIV reported in the US?,english,content,2.3,4.0,1.0,2.0,0.5454545454545454,12,50.0,2.0
6247,Where were the West Memphis,english,content,2.0,2.0,0,0,0.6,5,0.0,1.0
6248,Three tried and convicted?,english,content,1.3333333333333333,2.0,0,1.5,0.5,5,0.0,2.0
6249,When was Griffon Corporation founded?,english,content,2.25,2.0,0,3.0,0.8,6,0.0,1.0
6250,When was the department store Marshall Field's first opened?,english,content,3.3333333333333335,3.0,0,4.0,0.7,11,0.0,1.0
6251,When did mososaurs live?,english,content,2.0,1.0,0,2.0,0.75,5,0.0,1.0
6252,Where is Transylvania?,english,content,1.5,1.0,0,0,0.6666666666666666,4,0.0,1.0
6253,When was Paradise Lost written?,english,content,2.25,2.0,0,3.0,0.8,6,0.0,1.0
6254,What fruits are pomelos related to?,english,content,2.2,2.0,0,0,0.5,7,0.0,1.0
6255,Where is the Heath Company HQ at?,english,content,2.0,3.0,0,0,0.5714285714285714,8,0.0,1.0
6256,What is the soccer team for UT?,english,content,1.8333333333333333,3.0,0,0,0.42857142857142855,8,0.0,1.0
6257,Where was Mohamed Mohamed el-Amir Awad el-Sayed Atta born?,english,content,4.5,2.0,0,3.0,0.8888888888888888,10,0.0,1.0
6258,Was Heavy Gear turned into a show?,english,content,1.8333333333333333,2.0,0,3.0,0.5714285714285714,8,0.0,1.0
6259,What is the difference between a college and a university?,english,content,1.8888888888888888,4.0,0,0,0.3,11,0.0,1.0
6260,How many children did Augustus have?,english,content,1.6,3.0,0,2.0,0.8333333333333334,7,0.0,1.0
6261,How many electoral votes does West Virginia have?,english,content,1.8571428571428572,3.0,0,2.0,0.875,9,0.0,1.0
6262,When was the cast invented?,english,content,2.25,2.0,0,3.0,0.6,6,0.0,1.0
6263,When was UT's Cockrell School of Engineering established?,english,content,3.142857142857143,3.0,0,3.0,0.75,9,0.0,1.0
6264,When was Westminster Cathedral built?,english,content,2.25,2.0,0,3.0,0.8,6,0.0,1.0
6265,What is the oldest university in the Netherlands?,english,content,2.0,3.0,0,0,0.375,9,0.0,1.0
6266,When did the South secede?,english,content,2.25,2.0,0,2.0,0.6,6,0.0,1.0
6267,When was the first Spider-Man movie released?,english,content,3.0,3.0,1.0,0.0,0.75,10,50.0,2.0
6268,Who founded Humanism?,english,content,1.0,1.0,0,2.0,0.6666666666666666,4,0.0,1.0
6269,How old is the Parliament of Australia building?,english,content,2.5714285714285716,4.0,0,0,0.625,9,0.0,1.0
6270,What is the largest professional organization of lawyers in the US?,english,content,2.3,3.0,0,0,0.45454545454545453,12,0.0,1.0
6271,When did the Santa Claus myth start?,english,content,3.0,3.0,0,2.0,0.7142857142857143,8,0.0,1.0
6272,What does SIGINT stand for?,english,content,2.5,2.0,0,2.0,0.4,6,0.0,1.0
6273,What is the air quality in Los Angeles?,english,content,1.7142857142857142,3.0,0,0,0.5,9,0.0,1.0
6274,What ratings did The Professionals garner?,english,content,2.0,2.0,0,2.0,0.5,7,0.0,1.0
6275,What as the rating of Xenoblade Chronicles,english,content,2.0,3.0,0,0,0.42857142857142855,7,0,0.0
6276,2? What generals were involved in The Battle of Muar?,english,content,2.0,3.0,0,4.0,0.4,12,0.0,1.0
6277,When was the New Zealand Company formed?,english,content,2.8333333333333335,3.0,0,3.0,0.7142857142857143,8,0.0,1.0
6278,What is the oldest structure in Istanbul?,english,content,1.8333333333333333,3.0,0,0,0.42857142857142855,8,0.0,1.0
6279,What country has the most tornadoes?,english,content,1.6,2.0,0,2.0,0.6666666666666666,7,0.0,1.0
6280,What is Kenya's largest export?,english,content,2.2,3.0,0,0,0.5,7,0.0,1.0
6281,What is the largest glacier on Mount Rainier?,english,content,2.0,3.0,0,0,0.5,9,0.0,1.0
6282,When did Jerry Alan Fodor graduate?,english,content,3.0,2.0,0,2.0,0.8333333333333334,7,0.0,1.0
6283,When was the French Fifth Republic established?,english,content,3.0,2.0,0,3.0,0.7142857142857143,8,0.0,1.0
6284,When was the hard drive first developed?,english,content,2.8333333333333335,2.0,0,4.0,0.7142857142857143,8,0.0,1.0
6285,How old was Beethoven when he composed his first song?,english,content,2.0,3.0,1.0,3.0,0.7,11,50.0,2.0
6286,Who would initiate divorce within the Cherokee Nation?,english,content,2.142857142857143,2.0,0,3.0,0.5,9,0.0,1.0
6287,How large is Israel?,english,content,1.3333333333333333,1.0,0,0,0.75,5,0.0,1.0
6288,Who was the main character in How I Met Your Mother?,english,content,2.1,4.0,1.0,4.0,0.45454545454545453,12,50.0,2.0
6289,How many eggs are consumed by Americans every year?,english,content,1.625,3.0,0,4.0,0.6666666666666666,10,0.0,1.0
6290,How many hours of television do Germans watch on average?,english,content,1.7777777777777777,3.0,0,3.0,0.7,11,0.0,1.0
6291,How long was the USS Lynx (AK-100)?,english,content,1.8571428571428572,3.0,0,0,0.625,12,0.0,1.0
6292,How long did the Spanish-American war last?,english,content,3.142857142857143,3.0,0,2.0,0.75,10,0.0,1.0
6293,How popular is Verbotene Liebe?,english,content,1.5,2.0,0,0,0.8,6,0.0,1.0
6294,What is quantum computation?,english,content,1.6666666666666667,2.0,0,0,0.5,5,0.0,1.0
6295,When did the Marlboro Man first appear in Marlboro ad campaigns?,english,content,2.6,3.0,0,4.0,0.7272727272727273,12,0.0,1.0
6296,Who was the lead male character in American Pie?,english,content,2.25,3.0,0,0,0.5555555555555556,10,0.0,1.0
6297,How tall is the African elephant?,english,content,1.8,2.0,0,0,0.6666666666666666,7,0.0,1.0
6298,How many people in America identify as liberals?,english,content,1.5714285714285714,3.0,0,2.0,0.75,9,0.0,1.0
6299,When did open conflict with Japan start?,english,content,3.0,3.0,0,2.0,0.7142857142857143,8,0.0,1.0
6300,What gods do Buddhist believe in?,english,content,2.2,2.0,0,2.0,0.5,7,0.0,1.0
6301,When did Andrew Lloyd Weber write Cats?,english,content,2.6666666666666665,2.0,0,3.0,0.8571428571428571,8,0.0,1.0
6302,How big can a heart get?,english,content,2.0,2.0,0,2.0,0.6666666666666666,7,0.0,1.0
6303,"When did Gabrielle Bonheur ""Coco"" Chanel take the name ""Coco""?",english,content,3.3333333333333335,2.0,0,4.0,0.8,15,0.0,1.0
6304,What is the formula for a circle's circumference?,english,content,2.25,4.0,0,0,0.3333333333333333,10,0.0,1.0
6305,Who was the last surviving member of the Romanov family?,english,content,2.7777777777777777,2.0,0,0.0,0.5,11,0.0,2.0
6306,When did the Number 470 Fire Bell become heritage-listed?,english,content,3.111111111111111,3.0,1.0,2.0,0.7,12,50.0,2.0
6307,What was the last open conflict on European soil?,english,content,2.25,3.0,0,0,0.5555555555555556,10,0.0,1.0
6308,When did The Old Assyrian Empire get founded?,english,content,3.142857142857143,2.0,0,3.0,0.625,9,0.0,1.0
6309,How long did King of the Hill air?,english,content,3.142857142857143,3.0,0,2.0,0.625,9,0.0,1.0
6310,Where was Claire Labine born?,english,content,2.5,2.0,0,3.0,0.8,6,0.0,1.0
6311,What works has Jack Abbott been in?,english,content,2.5,2.0,0,0,0.42857142857142855,8,0,0.0
6312,Who started socialism?,english,content,1.0,1.0,0,2.0,0.6666666666666666,4,0.0,1.0
6313,When was the last Viking invasion of England?,english,content,2.142857142857143,3.0,0,0,0.625,9,0.0,1.0
6314,Who discovered the first alcohol compound?,english,content,2.2,2.0,0,2.0,0.6666666666666666,7,0.0,1.0
6315,What are the main branches of economics?,english,content,1.8333333333333333,3.0,0,0,0.42857142857142855,8,0.0,1.0
6316,What company introduced Botox?,english,content,1.0,2.0,0,2.0,0.75,5,0.0,1.0
6317,Where was the first public school opened in the U.S.?,english,content,2.6666666666666665,2.0,0,4.0,0.6,11,0.0,1.0
6318,How contagious is Mumps?,english,content,1.3333333333333333,1.0,0,0,0.75,5,0.0,1.0
6319,When was the Heckscher–Ohlin model developed?,english,content,3.6666666666666665,2.0,0,3.0,0.7142857142857143,9,0.0,1.0
6320,Who won the 2008 FedEx Orange Bowl?,english,content,2.6666666666666665,2.0,0,2.0,0.5714285714285714,8,0.0,1.0
6321,How many people live in Uganda?,english,content,1.2,3.0,0,2.0,0.8333333333333334,7,0.0,1.0
6322,When did Bob Dylan win the Nobel Prize?,english,content,2.2857142857142856,2.0,0,3.0,0.75,9,0.0,1.0
6323,When did Kinshasa become the capital of the Congo?,english,content,1.875,3.0,0,3.0,0.5555555555555556,10,0.0,1.0
6324,How much land was damaged in the 2019 California wildfires?,english,content,2.2222222222222223,3.0,0,3.0,0.6,11,0.0,1.0
6325,When was Louis XIV king?,english,content,2.0,3.0,0,0,0.6,6,0.0,1.0
6326,How tall does barley grow?,english,content,1.75,2.0,0,2.0,0.8,6,0.0,1.0
6327,When did calypso music become popular in the U.S.?,english,content,2.0,3.0,0,3.0,0.6666666666666666,10,0.0,1.0
6328,What was Kim Stanley Robinson's first published book?,english,content,3.0,3.0,0,0.0,0.6666666666666666,10,0.0,2.0
