sentence_id,text,language,type,avg_links_len,avg_max_depth,avg_subordinate_chain_len,avg_verb_edges,lexical_density,n_tokens,subordinate_proposition_dist,verbal_head_per_sent
3894,Who discovered special relativity?,english,content,1.3333333333333333,2.0,0,2.0,0.75,5,0.0,1.0
3895,What is a metabolite,english,content,1.6666666666666667,2.0,0,0,0.25,4,0.0,1.0
3896,Where is Ateneo de Manila University located?,english,content,3.0,3.0,0,3.0,0.8571428571428571,8,0.0,1.0
3897,When was Ronald Rand born?,english,content,2.5,2.0,0,3.0,0.8,6,0.0,1.0
3898,When was the Merillon Avenue station built in Garden City?,english,content,2.5555555555555554,3.0,0,4.0,0.7,11,0.0,1.0
3899,Who can overrule the Supreme Court?,english,content,1.8,2.0,0,2.0,0.5,7,0.0,1.0
3900,What's the deepest cave?,english,content,2.0,2.0,0,0,0.4,6,0.0,1.0
3901,Where is the soybean grown commercially today?,english,content,2.0,2.0,0,5.0,0.7142857142857143,8,0.0,1.0
3902,What was the distance covered in the 2015 Vuelta a España race?,english,content,2.909090909090909,5.0,1.0,1.0,0.5,13,50.0,2.0
3903,How many novellas are currently on air?,english,content,2.0,3.0,0,0,0.7142857142857143,8,0.0,1.0
3904,What is the population of red wolves?,english,content,1.8333333333333333,3.0,0,0,0.42857142857142855,8,0.0,1.0
3905,How many turrets do battleships have?,english,content,1.6,3.0,0,2.0,0.8333333333333334,7,0.0,1.0
3906,When was the International Court of Justice formed?,english,content,3.142857142857143,3.0,0,3.0,0.625,9,0.0,1.0
3907,Where was Room 40 located?,english,content,2.5,2.0,0,3.0,0.6,6,0.0,1.0
3908,What is Long-term memory?,english,content,2.25,3.0,0,0,0.6,7,0.0,1.0
3909,Who is considered the father of logic?,english,content,1.5,3.0,0,3.0,0.42857142857142855,8,0.0,1.0
3910,How much wine does Provence produce?,english,content,1.6,3.0,0,2.0,0.8333333333333334,7,0.0,1.0
3911,Which countries have thermonuclear weapons?,english,content,1.25,2.0,0,2.0,0.8,6,0.0,1.0
3912,How large were mososaurs?,english,content,1.3333333333333333,1.0,0,0,0.75,5,0.0,1.0
3913,What major works did Sinclair publish?,english,content,1.8,2.0,0,2.0,0.6666666666666666,7,0.0,1.0
3914,How heavy is a 737?,english,content,1.5,2.0,0,0,0.4,6,0.0,1.0
3915,How many phonemes are in the English language?,english,content,2.4285714285714284,3.0,0,0,0.625,9,0.0,1.0
3916,How many people attended the 2008 Summer Olympics in Beijing?,english,content,2.2222222222222223,3.0,0,3.0,0.7,11,0.0,1.0
3917,When was Grand Theft Auto the video game first released?,english,content,2.5555555555555554,3.0,1.0,2.0,0.8,11,50.0,2.0
3918,When was the last smallpox outbreak?,english,content,2.4,2.0,0,0,0.6666666666666666,7,0.0,1.0
3919,What party does Carlos Saúl Menem Akil represent?,english,content,3.142857142857143,2.0,0,2.0,0.75,9,0.0,1.0
3920,How big can a tunicate get?,english,content,2.0,2.0,0,2.0,0.6666666666666666,7,0.0,1.0
3921,What is the most common developmental disability affecting American children?,english,content,2.111111111111111,4.0,1.0,1.0,0.7,11,50.0,2.0
3922,What is the most expensive champagne you can buy?,english,content,2.125,3.0,1.0,1.0,0.4444444444444444,10,50.0,2.0
3923,Who is the current president of Ukraine?,english,content,1.8333333333333333,3.0,0,0,0.42857142857142855,8,0.0,1.0
3924,How many countries use common law as a basis for their legal system?,english,content,2.0,3.0,0,3.0,0.6923076923076923,14,0.0,1.0
3925,How many mammary glands do human women have?,english,content,1.8571428571428572,3.0,0,2.0,0.875,9,0.0,1.0
3926,How much of Saudi Arabia is desert?,english,content,2.1666666666666665,3.0,0,0,0.7142857142857143,8,0.0,1.0
3927,What does a Psychometrist do?,english,content,2.25,2.0,0,2.0,0.4,6,0.0,1.0
3928,How many species of fish are there in the order Acipenseriformes?,english,content,1.9,3.0,0,3.0,0.6363636363636364,12,0.0,1.0
3929,How many times have the Philadelphia Eagles played in the Super Bowl?,english,content,2.272727272727273,3.0,0,3.0,0.6666666666666666,13,0.0,1.0
3930,What was the last race won by American Standardbred Dan Patch?,english,content,2.0,4.0,1.0,1.0,0.6363636363636364,12,50.0,2.0
3931,What is the population of Honolulu?,english,content,1.6,3.0,0,0,0.3333333333333333,7,0.0,1.0
3932,What is the largest renewable water source for Jordan?,english,content,2.5,3.0,0,0,0.5555555555555556,10,0.0,1.0
3933,How long is a stretch limo?,english,content,1.8,2.0,0,0,0.6666666666666666,7,0.0,1.0
3934,Who was the first prime minister of Singapore?,english,content,2.142857142857143,3.0,0,0,0.5,9,0.0,1.0
3935,How much did iron mans suit cost?,english,content,2.1666666666666665,3.0,0,2.0,0.8571428571428571,8,0.0,1.0
3936,When did Spain occupy the Philippines?,english,content,1.8,2.0,0,3.0,0.6666666666666666,7,0.0,1.0
3937,When did Romania sign it's Constitution?,english,content,2.0,3.0,0,3.0,0.5714285714285714,8,0.0,1.0
3938,What is the population of the Caraga Administrative Region?,english,content,2.5,3.0,0,0,0.4444444444444444,10,0.0,1.0
3939,What is the most common cause of gastroenteritis?,english,content,2.0,3.0,0,0,0.5,9,0.0,1.0
3940,What is the largest litter of puppies recorded?,english,content,2.0,3.0,1.0,0.0,0.5,9,50.0,2.0
3941,By what margin did António de Oliveira Salazar win the election for Prime Minister?,english,content,2.5384615384615383,3.0,0,3.0,0.6428571428571429,15,0.0,1.0
3942,Who is the main character of Ying Ye 3 Jia 1?,english,content,1.7,4.0,0,0,0.45454545454545453,12,0.0,1.0
3943,What's the national dish of China?,english,content,1.8333333333333333,3.0,0,0,0.42857142857142855,8,0.0,1.0
3944,how did Lou Lombardo die?,english,content,2.5,2.0,0,2.0,0.8,6,0.0,1.0
3945,What does the Secretary of Health do?,english,content,3.0,3.0,0,2.0,0.42857142857142855,8,0.0,1.0
3946,When was fluorine first introduced in tap water?,english,content,2.2857142857142856,2.0,0,5.0,0.75,9,0.0,1.0
3947,What can we learn from molecular biology?,english,content,2.0,2.0,0,3.0,0.42857142857142855,8,0.0,1.0
3948,How old was Julie Andrews when she played Mary Poppins?,english,content,1.9,3.0,1.0,3.0,0.7272727272727273,12,50.0,2.0
3949,How did Zhou Enlai die?,english,content,2.5,2.0,0,2.0,0.8,6,0.0,1.0
3950,When was the book Ceremony published?,english,content,2.6,2.0,0,3.0,0.6666666666666666,7,0.0,1.0
3951,How old was Heinz Steinitz when he died?,english,content,2.0,2.0,1.0,2.0,0.75,9,50.0,2.0
3952,When was cloning first discovered?,english,content,2.5,1.0,0,4.0,0.8,6,0.0,1.0
3953,What is the biggest export from Kansas?,english,content,1.8333333333333333,3.0,0,0,0.42857142857142855,8,0.0,1.0
3954,How many episodes did Haven have?,english,content,1.6,3.0,0,2.0,0.8333333333333334,7,0.0,1.0
3955,What's a form of dating for recent biomatter?,english,content,2.125,2.0,0,0,0.4444444444444444,10,0.0,1.0
3956,When was the first volume of The Kingkiller Chronicle published?,english,content,3.111111111111111,4.0,1.0,1.0,0.6,11,50.0,2.0
3957,What is the most common disease affecting chimpanzees?,english,content,1.8571428571428572,3.0,1.0,1.0,0.625,9,50.0,2.0
3958,What is Topology?,english,content,1.5,1.0,0,0,0.3333333333333333,4,0.0,1.0
3959,Who coined the term genome?,english,content,1.75,2.0,0,2.0,0.6,6,0.0,1.0
3960,When did the Afghan civil war end?,english,content,3.0,2.0,0,2.0,0.7142857142857143,8,0.0,1.0
3961,Who first used the term anthropology?,english,content,1.8,2.0,0,4.0,0.6666666666666666,7,0.0,1.0
3962,When was Stockholm founded?,english,content,2.0,1.0,0,3.0,0.75,5,0.0,1.0
3963,When were Lays potato chips first introduced?,english,content,2.8333333333333335,2.0,0,4.0,0.8571428571428571,8,0.0,1.0
3964,What team won the first Super Bowl?,english,content,2.0,2.0,0,2.0,0.7142857142857143,8,0.0,1.0
3965,How many players are on the Ohio State Buckeyes football team?,english,content,3.3,3.0,0,0,0.7272727272727273,12,0.0,1.0
3966,Who won Vuelta a Espana in 2012?,english,content,1.8333333333333333,3.0,0,3.0,0.5714285714285714,8,0.0,1.0
3967,how did Solomon die?,english,content,2.0,1.0,0,2.0,0.75,5,0.0,1.0
3968,How many species of Lentivirus are there?,english,content,1.5,3.0,0,2.0,0.7142857142857143,8,0.0,1.0
3969,What caused the Dust Bowl?,english,content,1.75,2.0,0,2.0,0.6,6,0.0,1.0
3970,Where is the story of A Nightmare on Elm Street set?,english,content,3.3,5.0,0,0,0.5454545454545454,12,0.0,1.0
3971,When did Canada's Worst Handyman final episode air?,english,content,3.5,3.0,0,2.0,0.7777777777777778,10,0.0,1.0
3972,What are the different sizes of flute?,english,content,1.8333333333333333,3.0,0,0,0.42857142857142855,8,0.0,1.0
3973,How did the city of San Francisco get its name?,english,content,2.7777777777777777,3.0,0,3.0,0.6,11,0.0,1.0
3974,When was the first volume of Monster?,english,content,1.8333333333333333,3.0,0,0,0.5714285714285714,8,0.0,1.0
3975,When was the first lobotomy performed?,english,content,2.6,2.0,0,3.0,0.6666666666666666,7,0.0,1.0
3976,What metals are used to make the modern flute?,english,content,1.625,3.0,1.0,2.5,0.5555555555555556,10,50.0,2.0
3977,When were the first Winter Olympics?,english,content,2.4,2.0,0,0,0.6666666666666666,7,0.0,1.0
3978,How many served in the Rough Riders?,english,content,2.0,2.0,0,2.0,0.7142857142857143,8,0.0,1.0
3979,What is the origin of the symbol Hg for mercury?,english,content,2.0,4.0,0,0,0.4,11,0.0,1.0
3980,When did the Portuguese language develop?,english,content,2.6,2.0,0,2.0,0.6666666666666666,7,0.0,1.0
3981,How long was Ziming the military general under Sun Quan?,english,content,1.7777777777777777,3.0,0,0,0.7,11,0.0,1.0
3982,What does a high emotional IQ mean?,english,content,3.0,2.0,0,2.0,0.5714285714285714,8,0.0,1.0
3983,What is the largest county in Scotland?,english,content,1.8333333333333333,3.0,0,0,0.42857142857142855,8,0.0,1.0
3984,When did Madrid become capital of Spain?,english,content,1.6666666666666667,3.0,0,3.0,0.7142857142857143,8,0.0,1.0
3985,"How many wins did Abe ""The Newsboy"" Hollandersky have?",english,content,3.25,3.0,0,2.0,0.7777777777777778,12,0.0,1.0
3986,What is the unit of measurement for light brightness?,english,content,2.0,3.0,0,0,0.4444444444444444,10,0.0,1.0
3987,How long did the Ptolemaic dynasty last?,english,content,2.3333333333333335,2.0,0,2.0,0.7142857142857143,8,0.0,1.0
3988,When was the Circuit de Barcelona-Catalunya built?,english,content,3.4285714285714284,3.0,0,3.0,0.75,10,0.0,1.0
3989,How large is the British Army?,english,content,1.8,2.0,0,0,0.6666666666666666,7,0.0,1.0
3990,How many miles of forest does India have?,english,content,1.8571428571428572,3.0,0,2.0,0.75,9,0.0,1.0
3991,How is Fibromyalgia caused?,english,content,2.0,1.0,0,3.0,0.75,5,0.0,1.0
3992,What does Yên Bái mean?,english,content,2.5,2.0,0,2.0,0.6,6,0.0,1.0
3993,What is the biggest telephone company?,english,content,2.4,2.0,0,0,0.5,7,0.0,1.0
3994,On what plantation was Julius Caesar Chappelle a slave?,english,content,2.75,2.0,0,0,0.5555555555555556,10,0.0,1.0
3995,Which US state has no speed limit?,english,content,1.6666666666666667,2.0,0,2.0,0.7142857142857143,8,0.0,1.0
3996,Where is the Klickitat tribe?,english,content,2.0,2.0,0,0,0.6,6,0.0,1.0
3997,What is the minimum wage in Nebraska in 2018?,english,content,2.0,3.0,0,0,0.3333333333333333,10,0.0,1.0
3998,When were the Golden Dollar minted?,english,content,2.6,2.0,0,3.0,0.6666666666666666,7,0.0,1.0
3999,What percentage of the American population identifies as Asian?,english,content,2.375,3.0,0,2.0,0.5555555555555556,10,0.0,1.0
4000,Who created the first broadcast relay station?,english,content,2.6666666666666665,2.0,0,2.0,0.7142857142857143,8,0.0,1.0
4001,What was the first US legislation related to human trafficking?,english,content,2.111111111111111,4.0,0,0,0.6,11,0.0,1.0
4002,Who coined the term epistemology?,english,content,1.75,2.0,0,2.0,0.6,6,0.0,1.0
4003,What is the trunk circumference of the Angel Oak in South Carolina?,english,content,2.1818181818181817,4.0,0,0,0.5,13,0.0,1.0
4004,What is the angle of the Leaning Tower of Pisa?,english,content,2.0,4.0,0,0.0,0.4,11,0.0,2.0
4005,When was the Collingwood Football Club formed?,english,content,3.0,2.0,0,3.0,0.7142857142857143,8,0.0,1.0
4006,When was Planetarian: The Reverie of a Little Planet first published?,english,content,3.2,4.0,0,2.0,0.6363636363636364,13,0.0,2.0
4007,When was the Vatican established?,english,content,2.25,2.0,0,3.0,0.6,6,0.0,1.0
4008,What's the third largest flightless bird?,english,content,3.1666666666666665,2.0,0,0,0.5714285714285714,8,0.0,1.0
4009,How many people live in Thailand?,english,content,1.2,3.0,0,2.0,0.8333333333333334,7,0.0,1.0
4010,What are the types of clouds?,english,content,1.6,3.0,0,0,0.3333333333333333,7,0.0,1.0
4011,What was the first company to drill for oil in Venezuela?,english,content,1.9,4.0,1.0,3.0,0.45454545454545453,12,50.0,2.0
4012,How much do translators make?,english,content,1.75,2.0,0,2.0,0.8,6,0.0,1.0
4013,When did the Star Trek Customizable Card Game go out of print?,english,content,3.090909090909091,3.0,0,3.0,0.6666666666666666,13,0.0,1.0
4014,When did Nickelodeon network start?,english,content,2.25,2.0,0,2.0,0.8,6,0.0,1.0
4015,What is the origin of the name of the chalcogen group?,english,content,2.1,4.0,0,0,0.36363636363636365,12,0.0,1.0
4016,When was the Montana Vigilantes formed?,english,content,2.6,2.0,0,3.0,0.6666666666666666,7,0.0,1.0
4017,Was Civilization the first game designed by Soren Johnon?,english,content,1.875,3.0,1.0,1.0,0.6666666666666666,10,50.0,2.0
4018,What was the original publisher of The Great God Pan?,english,content,2.5555555555555554,3.0,0,0,0.5,11,0.0,1.0
4019,What did Che Guevara believe in?,english,content,3.0,2.0,0,2.0,0.5,7,0.0,1.0
4020,What was the first patented invention?,english,content,2.4,2.0,0,0.0,0.5,7,0.0,2.0
4021,What organ is responsible for organ production?,english,content,1.6666666666666667,2.0,0,0,0.5714285714285714,8,0.0,1.0
4022,What was the first publisher of Kindred by Octavia E. Butler?,english,content,1.9,3.0,0,0,0.5454545454545454,12,0.0,1.0
4023,What's the fine for a fake 911 call?,english,content,2.5,3.0,0,0,0.3333333333333333,10,0.0,1.0
4024,What was the first website address?,english,content,2.4,2.0,0,0,0.5,7,0.0,1.0
4025,What was Daisy Ridley's first movie role?,english,content,2.7142857142857144,3.0,0,0,0.625,9,0.0,1.0
4026,When were the Federalist papers published?,english,content,2.6,2.0,0,3.0,0.6666666666666666,7,0.0,1.0
4027,When was the first iPhone released?,english,content,2.6,2.0,0,3.0,0.6666666666666666,7,0.0,1.0
4028,What is the Peace Candle made out of?,english,content,3.7142857142857144,2.0,0,3.0,0.375,9,0.0,1.0
4029,How many catholic churches currently exist in New York?,english,content,1.625,3.0,0,3.0,0.8888888888888888,10,0.0,1.0
4030,What actor currently plays Doctor Who?,english,content,1.2,2.0,0,3.0,0.8333333333333334,7,0.0,1.0
4031,How many dialects of Korean are there?,english,content,1.5,3.0,0,2.0,0.7142857142857143,8,0.0,1.0
4032,When was Jean Michel Rollin Roth Le Gentil born?,english,content,3.75,3.0,0,4.0,0.7777777777777778,10,0,1.0
4033,How long has psychology been around for?,english,content,2.6666666666666665,2.0,0,0,0.5714285714285714,8,0.0,1.0
4034,What creates the strongest magnetic field?,english,content,2.2,2.0,0,2.0,0.6666666666666666,7,0.0,1.0
4035,Who won the last basketball championship?,english,content,2.2,2.0,0,2.0,0.6666666666666666,7,0.0,1.0
4036,What is there to do in Thailand?,english,content,1.5,3.0,1.0,2.5,0.42857142857142855,8,50.0,2.0
4037,When was the second first identified as a unit of time?,english,content,2.2,3.0,0,5.0,0.5454545454545454,12,0.0,1.0
4038,When was Colin Steele McRae born?,english,content,3.0,2.0,0,3.0,0.8333333333333334,7,0.0,1.0
4039,How hard can the average human hit?,english,content,2.3333333333333335,2.0,0,2.0,0.7142857142857143,8,0.0,1.0
4040,When did the American Republican party begin?,english,content,3.0,2.0,0,2.0,0.7142857142857143,8,0.0,1.0
4041,What is the origin of the word Judo?,english,content,1.7142857142857142,3.0,0,0,0.375,9,0.0,1.0
4042,How many species of kelp are there?,english,content,1.5,3.0,0,2.0,0.7142857142857143,8,0.0,1.0
4043,Who is the number 1 car company in the world?,english,content,2.4444444444444446,3.0,0,0,0.4,11,0.0,1.0
4044,How many species of mammal exist in nature?,english,content,1.5714285714285714,3.0,0,2.0,0.75,9,0.0,1.0
4045,How many charter schools are there in the U.S.?,english,content,1.625,3.0,0,3.0,0.6666666666666666,10,0.0,1.0
4046,When was David Mirkin born?,english,content,2.5,2.0,0,3.0,0.8,6,0.0,1.0
4047,What countries make up the Middle East?,english,content,1.6666666666666667,2.0,0,3.0,0.5714285714285714,8,0.0,1.0
4048,What is the largest protected area in Australia?,english,content,2.142857142857143,3.0,0,0.0,0.5,9,0.0,2.0
4049,What was WWI German cloud gas made of?,english,content,3.5714285714285716,2.0,0,3.0,0.625,9,0.0,1.0
4050,How many libraries are there in Berlin?,english,content,1.3333333333333333,3.0,0,3.0,0.7142857142857143,8,0.0,1.0
4051,How long are the Sierras Chicas?,english,content,1.8,2.0,0,0,0.6666666666666666,7,0.0,1.0
4052,When was the Caldecott Medal first established?,english,content,2.8333333333333335,2.0,0,4.0,0.7142857142857143,8,0.0,1.0
4053,What is the most abundant neurotransmitter in the human brain?,english,content,2.3333333333333335,3.0,0,0,0.5,11,0.0,1.0
4054,When was Kulothunga Chola III born?,english,content,3.0,2.0,0,3.0,0.6666666666666666,7,0.0,1.0
4055,When were the Turkish Armed Forces established?,english,content,3.0,2.0,0,3.0,0.7142857142857143,8,0.0,1.0
4056,What is the divorce rate among Muslims?,english,content,1.8333333333333333,3.0,0,0,0.42857142857142855,8,0.0,1.0
4057,Why do Lucha Libre wrestlers wear masks?,english,content,2.3333333333333335,3.0,0,3.0,0.8571428571428571,8,0.0,1.0
4058,What is the oldest artifact from Norse religion?,english,content,2.0,3.0,0,0,0.5,9,0.0,1.0
4059,How much rain did Hurricane Harvey dump on Houston?,english,content,1.75,3.0,0,3.0,0.7777777777777778,10,0.0,1.0
4060,How much do you pay someone who knows cryptography?,english,content,1.5,3.0,1.0,2.5,0.5555555555555556,10,50.0,2.0
4061,When was Rita Simons born?,english,content,2.5,2.0,0,3.0,0.8,6,0.0,1.0
4062,What TV show made the most money of all time?,english,content,1.7777777777777777,3.0,0,2.0,0.6,11,0.0,1.0
4063,What is the population of Austria in 2018?,english,content,1.8571428571428572,3.0,0,0,0.25,9,0.0,1.0
4064,What is the character limit for a cell in Microsoft Excel?,english,content,2.0,4.0,0,0,0.45454545454545453,12,0.0,1.0
4065,What years did Michelangelo live?,english,content,1.75,2.0,0,2.0,0.6,6,0.0,1.0
4066,Who identified the principle of supply and demand?,english,content,1.4285714285714286,4.0,0,2.0,0.5,9,0.0,1.0
4067,When did the Samba first develop?,english,content,2.6,2.0,0,3.0,0.6666666666666666,7,0.0,1.0
4068,How many high-yield thermonuclear weapon design tests were performed at Bikini Atoll?,english,content,2.4166666666666665,3.0,0,3.0,0.8461538461538461,15,0.0,1.0
4069,How many people live in Tanzania?,english,content,1.2,3.0,0,2.0,0.8333333333333334,7,0.0,1.0
4070,What was the longest war during the Middle Ages?,english,content,2.25,3.0,0,0,0.4444444444444444,10,0.0,1.0
4071,What is the success rate for embryo transfer?,english,content,2.0,3.0,0,0,0.5,9,0.0,1.0
4072,What is the cheapest drug?,english,content,2.0,2.0,0,0,0.4,6,0.0,1.0
4073,How powerful is a Mustang's engine?,english,content,1.8333333333333333,3.0,0,0,0.5714285714285714,8,0.0,1.0
4074,Where is Burkina Faso?,english,content,1.6666666666666667,2.0,0,0,0.75,5,0.0,1.0
4075,Who invented stainless steel?,english,content,1.3333333333333333,2.0,0,2.0,0.75,5,0.0,1.0
4076,How many bullet trains are currently in use?,english,content,2.0,3.0,0,0,0.75,9,0.0,1.0
4077,What country is Anatolia in?,english,content,1.75,1.0,0,0,0.4,6,0.0,1.0
4078,Where was Kou Voravong born?,english,content,2.5,2.0,0,3.0,0.8,6,0.0,1.0
4079,What states were affected by the Northeast blackout of 2003?,english,content,1.8888888888888888,3.0,0,3.0,0.4,11,0.0,1.0
4080,Who is the youngest player in MLB?,english,content,2.1666666666666665,2.0,0,0,0.42857142857142855,8,0.0,1.0
4081,When was the Valencia Street Circuit built in Spain?,english,content,2.625,2.0,0,4.0,0.6666666666666666,10,0.0,1.0
4082,Which branch is English part of from the indo-european language family?,english,content,3.0,3.0,0,0,0.5833333333333334,13,0.0,1.0
4083,How long was the UK an empire for?,english,content,2.857142857142857,2.0,0,0,0.5,9,0.0,1.0
4084,What is cider made with?,english,content,2.5,2.0,0,3.0,0.4,6,0.0,1.0
4085,When did Amsterdam become the capital of the Netherlands?,english,content,1.875,3.0,0,3.0,0.5555555555555556,10,0.0,1.0
4086,What was the first Super Bowl won by the New England Patriots?,english,content,2.4545454545454546,5.0,1.0,1.0,0.5833333333333334,13,50.0,2.0
4087,How many kids does David Beckham have?,english,content,2.0,3.0,0,2.0,0.8571428571428571,8,0.0,1.0
4088,What city is located in Columbia County?,english,content,1.6666666666666667,2.0,0,3.0,0.5714285714285714,8,0.0,1.0
4089,What is the tallest waterfall in Yellowstone National Park?,english,content,2.25,3.0,0,0,0.5555555555555556,10,0.0,1.0
4090,How long does it take to produce jiumu?,english,content,1.5714285714285714,2.0,1.0,2.5,0.625,9,50.0,2.0
4091,How long did Keith Windschuttle serve on the board of ABC?,english,content,2.0,3.0,0,3.0,0.6363636363636364,12,0.0,1.0
4092,What does a Marxist believe?,english,content,2.25,2.0,0,2.0,0.4,6,0.0,1.0
4093,When was Niger founded?,english,content,2.0,1.0,0,3.0,0.75,5,0.0,1.0
4094,How much protein is in human blood?,english,content,2.0,3.0,0,0,0.7142857142857143,8,0.0,1.0
4095,What are the best jewelry brands?,english,content,2.4,2.0,0,0,0.5,7,0.0,1.0
4096,What is the capital of Sudan?,english,content,1.6,3.0,0,0,0.3333333333333333,7,0.0,1.0
4097,Who represented Vallejos and Domingo in the case of Vallejos and Domingo v. Commissioner of Registration?,english,content,1.8666666666666667,5.0,1.0,1.5,0.5625,17,50.0,2.0
4098,Who was the last ruler of the Mongol Empire?,english,content,2.25,3.0,0,0,0.4444444444444444,10,0.0,1.0
4099,How cold is it in Ontario?,english,content,1.8,2.0,1.0,0,0.5,7,100.0,1.0
4100,How old is Garry Marshall?,english,content,1.25,2.0,0,0,0.8,6,0.0,1.0
4101,Why isn't sex work better regulated?,english,content,3.1666666666666665,2.0,0,5.0,0.7142857142857143,8,0.0,1.0
4102,What is the highest title in the English peerage?,english,content,2.25,3.0,0,0,0.4444444444444444,10,0.0,1.0
4103,When did St.,english,content,1.5,1.0,0,0,0.6666666666666666,3,0,0.0
4104,Patrick drive the snakes out?,english,content,1.75,2.0,0,3.0,0.6,6,0.0,1.0
4105,Which ship is smaller than a Destroyer in Star Wars?,english,content,1.7777777777777777,3.0,0,0,0.5,11,0.0,1.0
4106,How many battlecruisers does the British Navy have?,english,content,2.142857142857143,3.0,0,2.0,0.75,9,0.0,1.0
4107,Who is the best speedrunner?,english,content,2.0,2.0,0,0,0.4,6,0.0,1.0
4108,When did Takeo Fukuda become prime minister of Japan?,english,content,2.0,3.0,0,3.0,0.7777777777777778,10,0.0,1.0
4109,How much of the world's tulips come from The Netherlands?,english,content,2.6,4.0,0,2.0,0.5454545454545454,12,0.0,1.0
4110,How many levels are there in Wolfenstein: The New Order?,english,content,1.6666666666666667,3.0,0,3.0,0.7,12,0.0,1.0
4111,What was Don Bluth's second film to direct?,english,content,2.0,3.0,1.0,1.0,0.625,9,50.0,2.0
4112,When was the municipality of Sogod established?,english,content,3.0,3.0,0,3.0,0.5714285714285714,8,0.0,1.0
4113,How many cops work in London?,english,content,1.2,3.0,0,2.0,0.8333333333333334,7,0.0,1.0
4114,When did gymnastics become an Olympic sport?,english,content,2.0,2.0,0,3.0,0.7142857142857143,8,0.0,1.0
4115,For how many seasons did Payton Place run?,english,content,2.0,3.0,0,2.0,0.75,9,0.0,1.0
4116,What is the national dish of the US?,english,content,2.0,3.0,0,0,0.375,9,0.0,1.0
4117,Who won the Battle of Polygon Wood?,english,content,1.6666666666666667,3.0,0,2.0,0.5714285714285714,8,0.0,1.0
4118,Where was Nahum Tate's adaptation of King Lear first performed?,english,content,3.5,3.0,0,4.0,0.7272727272727273,12,0.0,1.0
4119,How many neurotransmitters are there in the human brain?,english,content,1.875,3.0,0,3.0,0.6666666666666666,10,0.0,1.0
4120,What is Mathematical physics used for?,english,content,2.8,2.0,0,3.0,0.5,7,0.0,1.0
4121,Who is head of the Nehemiah Corporation of America?,english,content,2.0,3.0,0,0,0.4444444444444444,10,0.0,1.0
4122,Who was the first president of Ethiopia?,english,content,1.8333333333333333,3.0,0,0,0.42857142857142855,8,0.0,1.0
4123,What's the travel time between Tokyo and Kyoto on the bullet train?,english,content,2.3333333333333335,4.0,0,0,0.46153846153846156,14,0.0,1.0
4124,What is the heaviest gas?,english,content,2.0,2.0,0,0,0.4,6,0.0,1.0
4125,How large is Wichita Falls?,english,content,1.5,2.0,0,0,0.8,6,0.0,1.0
4126,What was the cost of the damages from the tornado at Joplin?,english,content,2.090909090909091,4.0,0,0,0.3333333333333333,13,0.0,1.0
4127,Who developed the first rocket engine?,english,content,2.2,2.0,0,2.0,0.6666666666666666,7,0.0,1.0
4128,When was the Star Trek Customizable Card Game first introduced?,english,content,3.5555555555555554,3.0,0,4.0,0.8,11,0.0,1.0
4129,When did Dreamfall Chapters come out?,english,content,2.0,2.0,0,3.0,0.6666666666666666,7,0.0,1.0
4130,When did white people settle in the Mississippi area?,english,content,2.375,2.0,0,3.0,0.6666666666666666,10,0.0,1.0
4131,What is the most venomous snake in the world?,english,content,2.125,3.0,0,0,0.4444444444444444,10,0.0,1.0
4132,What ethnicity is Egyptian considered?,english,content,1.75,2.0,0,3.0,0.6,6,0.0,1.0
