sentence_id,text,language,type,avg_links_len,avg_max_depth,avg_subordinate_chain_len,avg_verb_edges,lexical_density,n_tokens,subordinate_proposition_dist,verbal_head_per_sent
4959,榎本 三恵子の出身はどこ 教育バウチャーを初めて導入した国はどこ チェスの起源はいつ 神戸で初めて誕生したバス会社は何 細胞診断 長嶋茂雄の生涯通算打率は？,japanese,content,2.8205128205128207,5.0,1.0,3.5,0.55,41,100.0,2.0
4960,国家神道に万能の神はいる？,japanese,content,2.0,3.0,0,2.0,0.625,9,0.0,1.0
4961,ティーガーIはいくつ生産された？,japanese,content,1.75,2.0,0,2.0,0.4444444444444444,10,0.0,1.0
4962,イタリア王国の初代の王は誰 日本初の水力発電所は何 都市の過密化の最大要因は何？,japanese,content,2.6666666666666665,4.0,0,0,0.56,26,0,0.0
4963,ニコラウス・コペルニクスの宗教は何だった？,japanese,content,1.5,3.0,0,0,0.3333333333333333,10,0.0,1.0
4964,イスラム過激派テロ組織アルカイダのリーダーは誰でしたか？,japanese,content,1.9230769230769231,4.0,0,3.0,0.5714285714285714,15,0.0,1.0
4965,偏向報道という言葉が誕生したのはいつ 人間の祖先が言語を使い始めたのはいつ 欧州連合域内排出量取引制度はいつ制定された？ 五胡十六国時代は西暦何年から何年まですか？,japanese,content,4.215686274509804,5.0,1.25,2.2,0.4807692307692308,54,83.33333333333333,6.0
4966,北条 政子の父親の名前は？,japanese,content,1.3333333333333333,3.0,0,0,0.5714285714285714,8,0,0.0
4967,日立製作所の2017年のエグゼクティブ・マネジャーは誰？,japanese,content,2.090909090909091,3.0,0,0,0.5,13,0,0.0
4968,第二次世界大戦時、ドイツにユダヤ人収容所はいくつありましたか？,japanese,content,3.0555555555555554,2.0,0,5.0,0.631578947368421,21,0.0,1.0
4969,電球が発明されたのはいつ 以仁王を打ち取ったのは誰？,japanese,content,2.8125,4.0,2.0,4.0,0.29411764705882354,18,100.0,2.0
4970,カール・フォン・クラウゼヴィッツが戦争論を完成させたのはいつ 貴族院が存在する国家は何か国ある？,japanese,content,2.8461538461538463,4.0,1.0,3.3333333333333335,0.4444444444444444,28,66.66666666666667,3.0
4971,火を人間に与えたギリシャ神話の神は誰ですか？,japanese,content,1.8461538461538463,4.0,1.0,2.0,0.42857142857142855,15,50.0,2.0
4972,カントリー・ハウスの建設を始めたのは誰？,japanese,content,1.9,4.0,1.0,3.0,0.36363636363636365,12,100.0,1.0
4973,渡来人はいつ日本にきた？,japanese,content,2.1666666666666665,2.0,0,3.0,0.42857142857142855,8,0.0,1.0
4974,人口はどのように数えられますか？,japanese,content,2.0,2.0,1.0,3.0,0.3333333333333333,10,50.0,2.0
4975,密陽女子中学生集団性暴行事件はいつ起きた？,japanese,content,3.090909090909091,2.0,0,2.0,0.75,13,0.0,1.0
4976,上皮成長因子受容体を発見したのは誰 スレイマン１世は何歳で亡くなった？,japanese,content,2.761904761904762,3.0,1.0,3.0,0.5,23,50.0,2.0
4977,越後長岡藩はいつ結成された？,japanese,content,1.75,2.0,0,2.0,0.4444444444444444,10,0.0,1.0
4978,亀田 史郎の長男の名前は？,japanese,content,1.3333333333333333,3.0,0,0,0.5714285714285714,8,0,0.0
4979,ロシア正教会ではサンタクロースは何といわれますか？,japanese,content,2.25,2.0,0,4.0,0.38461538461538464,14,0.0,1.0
4980,ザルツブルク市街の歴史地区はいつ世界遺産に登録された？,japanese,content,1.9230769230769231,3.0,0,2.0,0.5,15,0.0,1.0
4981,仏教では感情を持つことに否定的？,japanese,content,2.111111111111111,4.0,1.0,1.0,0.5,11,100.0,1.0
4982,マリの首都はどこ？,japanese,content,1.5,3.0,0,0,0.4,6,0,0.0
4983,大谷翔平のＭＬＢ一年目の本塁打数は？,japanese,content,2.2,2.0,0,0,0.6363636363636364,12,0,0.0
4984,ドイツ銀行の創業はいつですか？,japanese,content,1.4285714285714286,3.0,0,0,0.375,9,0.0,1.0
4985,中世盛期になぜ人口が急増した？ 春日井市図書館に洋書はある？,japanese,content,2.2941176470588234,4.0,1.0,2.5,0.6666666666666666,20,50.0,2.0
4986,サー・ジョシュア・ロウリーが初めて参加した戦闘は何 韓 信は何歳で死去した？,japanese,content,2.238095238095238,4.0,1.0,2.5,0.45454545454545453,23,50.0,2.0
4987,バラエティ番組「ザ・トゥー・ロニーズ」の初代監督は誰 シュテムヴェーデの初代町長は誰 日本にクラシック音楽が伝わってきたのはいつ？,japanese,content,2.9642857142857144,4.0,1.0,0.0,0.5172413793103449,32,100.0,2.0
4988,横光利一は直木賞を受賞した？,japanese,content,1.75,2.0,0,2.0,0.5555555555555556,10,0.0,1.0
4989,ハウジングファーストの概念を提唱したのは誰？,japanese,content,2.2,4.0,1.0,3.0,0.36363636363636365,12,100.0,1.0
4990,フランスで最古の政党は何？,japanese,content,2.1666666666666665,3.0,0,0,0.42857142857142855,8,0,0.0
4991,フラウケ・ペトリーが経営した企業は何 アルバート・エドワード・ホーズリーの出身はどこ 代数幾何学はいつ誕生した？,japanese,content,2.64,4.0,1.0,2.5,0.4230769230769231,27,50.0,2.0
4992,第1世代移動通信システムが導入されたのはいつ？,japanese,content,3.0,3.0,1.0,3.0,0.42857142857142855,15,100.0,1.0
4993,シアノアクリレートを発明したのは誰 フランシウムは何から発見された？,japanese,content,2.4705882352941178,3.0,1.0,3.0,0.3333333333333333,19,50.0,2.0
4994,マルコ・ポーロとは誰ですか？,japanese,content,1.7142857142857142,2.0,0,0,0.25,9,0.0,1.0
4995,種子植物はいつから発生しだした 社会学の先駆者は誰？,japanese,content,2.142857142857143,4.0,1.0,2.0,0.4,16,100.0,1.0
4996,『バルナバによる福音書』のイタリア語の写本はどこで見つかった？,japanese,content,1.8571428571428572,6.0,1.0,1.0,0.5333333333333333,18,50.0,2.0
4997,パシフィック電鉄はなぜ衰退した？,japanese,content,1.5,2.0,0,2.0,0.5714285714285714,8,0.0,1.0
4998,ベンラファキシンが初めて商品化されたのはいつ イギリスで貴族になると、どのような優遇がありますか？,japanese,content,2.8333333333333335,4.0,1.0,4.0,0.4,27,66.66666666666667,3.0
4999,テレビが一般家庭に普及しだしたのはいつから 東ティモールの首都はどこ？,japanese,content,2.764705882352941,3.0,1.0,4.0,0.3888888888888889,19,100.0,1.0
5000,カントリー音楽の発祥の地はどこですか？,japanese,content,1.4444444444444444,4.0,0,0,0.4,11,0.0,1.0
5001,欧州議会に加盟している国は何か国ですか？,japanese,content,1.7692307692307692,4.0,1.0,1.0,0.42857142857142855,15,66.66666666666667,3.0
5002,ラーン川の全長は？,japanese,content,1.25,2.0,0,0,0.6,6,0,0.0
5003,オオタ自動車工業の創立はいつですか？,japanese,content,1.6666666666666667,3.0,0,0,0.5,11,0.0,1.0
5004,ビューグルの平均的な大きさは？,japanese,content,2.142857142857143,2.0,1.0,0,0.375,9,100.0,1.0
5005,カウンティ級駆逐艦が初めに用いられた戦争は何？,japanese,content,1.8181818181818181,4.0,1.0,2.0,0.5833333333333334,13,100.0,1.0
5006,ビートルズのブラックバードを作曲したのは誰？,japanese,content,2.3,4.0,1.0,3.0,0.36363636363636365,12,100.0,1.0
5007,ルシル・ボールの死因は何？,japanese,content,1.5,3.0,0,0,0.42857142857142855,8,0,0.0
5008,バンジャマン・ペッシュは何歳でバレエを始めた？,japanese,content,2.1,2.0,0,3.0,0.45454545454545453,12,0.0,1.0
5009,名張牛汁の起源はいつ 巴 マミの職業は？,japanese,content,1.8,3.0,0,0,0.5454545454545454,12,0,0.0
5010,ソチミルコの主要農産物は何？,japanese,content,1.8333333333333333,3.0,0,0,0.5714285714285714,8,0,0.0
5011,ファンタジー小説の始祖はだれですか？,japanese,content,1.4285714285714286,3.0,0,0,0.5,9,0,0.0
5012,テーベはいつ存在した？,japanese,content,1.6,2.0,0,2.0,0.3333333333333333,7,0.0,1.0
5013,ウィリアム・ピットの所属した政党は？,japanese,content,1.625,3.0,1.0,1.0,0.4444444444444444,10,100.0,1.0
5014,ネーデルラントにユダヤ人メンバーはいた？,japanese,content,2.0,2.0,0,2.0,0.625,9,0.0,1.0
5015,樹状高分子とはなんですか？,japanese,content,1.7142857142857142,2.0,0,0,0.375,9,0.0,1.0
5016,小栗虫太郎のデビュー作は何？,japanese,content,1.5,3.0,0,0,0.5714285714285714,8,0,0.0
5017,中華思想はいつ発生した ボルスタアンカーの素材は何 バート・ザクサの主要産業は何？,japanese,content,2.8947368421052633,4.0,1.0,1.0,0.45,21,100.0,1.0
5018,キャドワラの出身階級は何？,japanese,content,1.6,3.0,0,0,0.5,7,0,0.0
5019,『エースコンバット6 解放への戦火』で出てくる戦闘機は架空のもの？,japanese,content,2.0,5.0,1.0,1.0,0.5882352941176471,20,100.0,2.0
5020,スパイダーマンの考案者はだれ？,japanese,content,1.4,3.0,0,0,0.5,7,0.0,0.0
5021,朝日ダムはいつ完成した ミルコ・クロコップの所属した政党は何 ハードコア・レスリングに対する規制はある？,japanese,content,3.08,5.0,1.0,1.25,0.5,27,75.0,4.0
5022,勝山城の敷地面積は？,japanese,content,1.4,2.0,0,0,0.6666666666666666,7,0,0.0
5023,カスパー・ハウザーを発見したのは誰？,japanese,content,2.3333333333333335,3.0,1.0,3.0,0.3,11,100.0,1.0
5024,原子力発電はいつ始まった？,japanese,content,1.5,2.0,0,2.0,0.5714285714285714,8,0.0,1.0
5025,野球の守備は何名いますか？,japanese,content,1.625,3.0,0,3.0,0.4444444444444444,10,0.0,1.0
5026,コネチカット州に最初に到達したヨーロッパ人の国籍は何 浅越しのぶの出身高校は？,japanese,content,1.7894736842105263,6.0,1.0,2.0,0.55,21,100.0,2.0
5027,勝田清孝の職業は何だった？ GLaDOSはどのように戦いますか？,japanese,content,2.7333333333333334,3.0,1.0,5.0,0.375,18,66.66666666666667,3.0
5028,漫画『NARUTO -ナルト-』の物語の舞台となる時代はいつ ジョージ・ビードルの出身はどこ 『おとなの駄菓子屋』が始まったのはいつ 地球温暖化がうたわれ始めたのはいつから K・エリック・ドレクスラーK・エリック・ドレクスラーはいつ生まれた？,japanese,content,4.105263157894737,8.0,1.5,3.4,0.43103448275862066,63,83.33333333333333,6.0
5029,フォードGTマーク4は何年に開発されましたか？,japanese,content,2.3846153846153846,2.0,0,3.0,0.42857142857142855,15,0.0,1.0
5030,ジュゼッペ・ヴェルディはアフリカに行ったことがある？,japanese,content,1.7,2.0,1.0,1.5,0.5454545454545454,12,50.0,2.0
5031,証券会社が初めて誕生したのはいつ ビュート・ハウスの面積は？,japanese,content,2.4,3.0,1.0,4.0,0.4375,17,100.0,1.0
5032,遺伝子工学の先駆者は誰 マンハイム - バーゼル線 の全長は？,japanese,content,2.2142857142857144,3.0,0,0,0.6,16,0,0.0
5033,『ロミオVSジュリエット』の主人公の名前は？,japanese,content,1.75,3.0,0,0,0.6666666666666666,12,0,0.0
5034,フランスで最古の教会は何？,japanese,content,2.1666666666666665,3.0,0,0,0.42857142857142855,8,0,0.0
5035,一番長寿だったイングランド王は誰？,japanese,content,1.7142857142857142,3.0,1.0,0,0.5,9,100.0,1.0
5036,板垣恵介はいつ生まれた？,japanese,content,1.5,2.0,0,2.0,0.4,6,0.0,1.0
5037,フィンランドの国土面積は？,japanese,content,1.5,2.0,0,0,0.6,6,0,0.0
5038,バート・ラッペナウの主要産業は何 みらいは何トンの船ですか？,japanese,content,2.2,3.0,0,0,0.375,17,0.0,1.0
5039,人形浄瑠璃は何名で一体の人形を動かしますか？,japanese,content,2.3333333333333335,3.0,0,4.0,0.46153846153846156,14,0.0,1.0
5040,ジミー・ウェールズとラリー・サンガーがウィキペディアを開設決めたきっかけは何？,japanese,content,1.8666666666666667,5.0,2.0,1.5,0.5,17,100.0,2.0
5041,近藤 貞雄の現役時代の守備位置は？,japanese,content,1.5,3.0,0,0,0.6666666666666666,10,0,0.0
5042,日本でセンター試験はいつ始まった？,japanese,content,2.0,2.0,0,3.0,0.5,9,0.0,1.0
5043,世界最大の弩級戦艦は何 ロードアイランド州の州都は？ 法律に育児休業を最初に導入した国はどこ フランスで最古の聖堂は何 パラグアイ共和国の首都はどこ？,japanese,content,3.4,4.0,1.0,3.0,0.5365853658536586,43,100.0,1.0
5044,大公は世襲制？,japanese,content,1.5,2.0,0,0,0.6666666666666666,4,0,0.0
5045,三・一運動は何日間続きましたか？ 腎臓の主な機能はなんですか？,japanese,content,2.2222222222222223,3.0,1.0,3.0,0.3157894736842105,21,50.0,2.0
5046,四国と本州が陸続きになったのはいつ ニュートンの林檎の木はどこにある？,japanese,content,2.761904761904762,4.0,1.0,4.0,0.4090909090909091,23,50.0,2.0
5047,世界最大の移動式クレーンは何？,japanese,content,1.7142857142857142,3.0,0,0,0.625,9,0,0.0
5048,レントゲン写真を撮るごとに被爆する？,japanese,content,1.2857142857142858,4.0,1.0,1.0,0.625,9,50.0,2.0
5049,映画『ランボー』第一作で主演を務めたのは誰 ブルガリア共和国のバラはなぜ有名になりましたか？,japanese,content,2.64,3.0,1.0,4.0,0.5,29,50.0,2.0
5050,『摂州合邦辻』の主人公の職業は？,japanese,content,1.75,3.0,0,0,0.6666666666666666,12,0,0.0
5051,為替取引が始まったのはいつ 日本で防災に関する研究が始まったのはいつ ドミニカ共和国に野球が伝わったのはいつ ユナニ医学を教える大学はある？,japanese,content,3.864864864864865,5.0,1.0,3.1666666666666665,0.47368421052631576,39,83.33333333333333,6.0
5052,ニコライ・ミハイロヴィチは何年に亡くなりましたか？,japanese,content,1.9,2.0,0,3.0,0.36363636363636365,12,0.0,1.0
5053,日本でラジオの国営放送が始まったのはいつ？,japanese,content,2.3636363636363638,4.0,1.0,4.0,0.4166666666666667,13,100.0,1.0
5054,グレートブリテン島に最初に到達したのは誰？,japanese,content,2.3636363636363638,3.0,1.0,4.0,0.4166666666666667,13,100.0,1.0
5055,パキスタンの公用語はなんですか？,japanese,content,1.5714285714285714,3.0,0,0,0.375,9,0.0,1.0
5056,日本でハロウィンが定着したのはいつですか？,japanese,content,2.3636363636363638,3.0,1.0,4.0,0.25,13,50.0,2.0
5057,染色体説はいつ誕生した 日本に産婦人科ができたのはいつ？,japanese,content,2.588235294117647,4.0,1.0,3.0,0.4444444444444444,19,100.0,2.0
5058,ブニェヴァツ人の共通言語は何 『機動戦士ガンダムSEED』の放送はいつ始まった？,japanese,content,2.625,3.0,0,3.0,0.5882352941176471,20,0.0,1.0
5059,柳田理科雄の出身はどこ アントン・ブルックナーの交響曲第4番変ホ長調『ロマンティック』を初めて演奏した楽団は何？,japanese,content,3.269230769230769,6.0,1.0,2.0,0.5925925925925926,30,100.0,1.0
5060,ブッツバッハの面積は？,japanese,content,1.25,2.0,0,0,0.6,6,0,0.0
5061,グレーター・ロンドンの総面積は ゲイリー・バーロウはいつ生まれた？,japanese,content,1.9230769230769231,3.0,0,3.0,0.5,15,0.0,1.0
5062,結城 無二三の息子の宗教は何？,japanese,content,1.5,4.0,0,0,0.4444444444444444,10,0,0.0
5063,ありは最高で何匹が一つの社会を形成する？,japanese,content,3.1538461538461537,3.0,0,4.0,0.42857142857142855,15,0.0,1.0
5064,ジョージ・ヘンリー・トーマスの出身はどこ 携帯電話の起源はいつ 魔法という言葉はいつ日本で使われるようになりましたか？,japanese,content,3.1666666666666665,4.0,1.0,2.3333333333333335,0.41935483870967744,32,66.66666666666667,3.0
5065,慕容 恪はいつ生まれた？,japanese,content,1.4,2.0,0,2.0,0.5,7,0.0,1.0
5066,バグワン・シュリ・ラジニーシはどこで死期を過ごした？,japanese,content,2.3636363636363638,2.0,0,3.0,0.4166666666666667,13,0.0,1.0
5067,ソビエト連邦が崩落したのはいつ？,japanese,content,2.375,3.0,1.0,3.0,0.3333333333333333,10,100.0,1.0
5068,サイリスタはスマートフォンに使われる？,japanese,content,1.8333333333333333,2.0,0,2.0,0.5714285714285714,8,0.0,1.0
5069,ニュージャージー州の州都はどこですか？,japanese,content,1.4285714285714286,3.0,0,0,0.375,9,0.0,1.0
5070,ネルソン・アンジェロ・タムスマ・ピケ・ソウト・マイオールはどこで生まれた？,japanese,content,4.266666666666667,2.0,0,2.0,0.4375,17,0.0,1.0
5071,福島第一原発の除染作業員で被爆した人はいる？,japanese,content,1.8571428571428572,5.0,1.0,1.0,0.6,16,50.0,2.0
5072,阪神タイガースの前身のチームは何 ジョージ・オーウェルの支持したアメリカの政党は何？,japanese,content,2.473684210526316,4.0,1.0,1.0,0.45,21,100.0,1.0
5073,ボイジャー1号を打ち上げた国は？,japanese,content,1.4285714285714286,3.0,1.0,1.0,0.5,9,100.0,1.0
5074,1500年のポルトガル人の来航の目的はなんでしたか？,japanese,content,1.6153846153846154,5.0,0,0,0.35714285714285715,15,0.0,1.0
5075,涙の道でなくなったチェロキー族の最も多くの死因は？,japanese,content,2.0714285714285716,4.0,1.0,0.0,0.5333333333333333,16,100.0,2.0
5076,ヘーゲルはどこの大学で教鞭をとった？,japanese,content,2.3333333333333335,3.0,0,3.0,0.4,11,0.0,1.0
5077,スターリンは何年共産党書記長を務めた？,japanese,content,2.7,2.0,0,3.0,0.6363636363636364,12,0.0,1.0
5078,世界で 放棄試合が初めて適用されたスポーツは何？,japanese,content,2.1666666666666665,4.0,1.0,3.0,0.46153846153846156,14,100.0,1.0
5079,装甲を初めて戦争に用いた国はどこ 自動改札が初めて日本で導入されたのはいつ？ 『とある魔術の禁書目録』のジャンルは何？,japanese,content,3.032258064516129,5.0,1.0,4.5,0.4375,36,100.0,2.0
5080,ハンゲームの創始者は誰？ 橋口隆志のデビュー作は何 斎藤 一の出身はどこ 2018年現在、一番価値が高い鉱物は何？,japanese,content,3.7857142857142856,4.0,0,0,0.5517241379310345,32,0,0.0
5081,ピエール・ヴィダル＝ナケはいくつの学士号を持つ？,japanese,content,2.3333333333333335,3.0,0,2.0,0.5384615384615384,14,0.0,1.0
5082,税所 篤の父親の職業は何 マルコム・X の出身はどこ 武田信玄の出身はどこ ジャック・クレーマーの利き手は？,japanese,content,2.8846153846153846,4.0,0,0,0.48148148148148145,28,0,0.0
5083,飯尾連龍には何人妻がいた？,japanese,content,1.875,2.0,0,2.0,0.4444444444444444,10,0.0,1.0
5084,ジョージ・シアーズ・グリーンはいつ生まれた？,japanese,content,2.0,2.0,0,2.0,0.4444444444444444,10,0.0,1.0
5085,O・J・シンプソンの利き手は？,japanese,content,2.0,2.0,0,0,0.5,9,0,0.0
5086,灯油を人間が使用し始めたのはいつ ベネトン・フォーミュラ が結成したのはいつ 黒又川第一ダムは多目的ダム？,japanese,content,3.1724137931034484,4.0,3.0,3.3333333333333335,0.43333333333333335,31,100.0,3.0
5087,マドリードの紋章はどのようなデザインですか？,japanese,content,1.7777777777777777,3.0,1.0,0,0.4,11,50.0,2.0
5088,長谷川裕一のデビュー作は何 第12回スーパーボウルで一番得点を決めた選手は誰 ドイツが最初に開発した戦車は何？,japanese,content,2.6666666666666665,5.0,1.0,3.0,0.5161290322580645,32,100.0,2.0
5089,シールはもともと何で作られた？,japanese,content,2.5,2.0,0,4.0,0.4444444444444444,10,0.0,1.0
5090,キッスはの曲で一番売れた曲は何？ 五胡十六国時代は、何年から何年までですか？,japanese,content,3.0416666666666665,5.0,1.0,2.0,0.4,28,50.0,2.0
5091,ニュージーランドに地下鉄はある？,japanese,content,2.0,2.0,0,2.0,0.6666666666666666,7,0.0,1.0
5092,ブリストル・テンプル・ミーズ駅が建設されたのはいつ 第二次世界大戦時日本軍は暗号を使った？,japanese,content,3.48,3.0,1.0,3.0,0.5,27,50.0,2.0
5093,ヴィーナの起源はいつ インドネシアはいつ建国した？,japanese,content,1.9,3.0,0,3.0,0.36363636363636365,12,0.0,1.0
5094,戸田 忠太夫の父親は誰 ハワイに最初に人類がたどり着いたのはいつ イタリア戦線で戦闘機は用いられた？,japanese,content,3.16,3.0,1.0,5.0,0.46153846153846156,27,50.0,2.0
5095,大相撲には何段階、位がありますか？,japanese,content,2.4444444444444446,2.0,0,4.0,0.4,12,0.0,1.0
5096,サウスエンド＝オン＝シーはの最大宗教は何？,japanese,content,2.3636363636363638,3.0,0,0,0.5,13,0,0.0
5097,シーキングザパールのオーナーは誰？,japanese,content,1.4,3.0,0,0,0.5,7,0,0.0
5098,パストラルの語源は何？,japanese,content,1.5,3.0,0,0,0.4,6,0,0.0
5099,イタイイタイ病が初めて確認されたのはいつ まぶしさにより失明することはある？,japanese,content,2.45,3.0,1.0,1.75,0.42857142857142855,22,75.0,4.0
5100,ニミッツ級航空母艦はいくつ生産された？,japanese,content,1.9,2.0,0,2.0,0.5454545454545454,12,0.0,1.0
5101,ＳＵＢＡＲＵの創始者は誰？,japanese,content,1.6,3.0,0,0,0.5,7,0,0.0
5102,日本で 人工降雪機の生産が始まったのはいつ 日本の中古車の一番の買い手はどこの国 美容外科学の発祥はどこ？,japanese,content,2.96875,5.0,1.0,2.0,0.5151515151515151,34,100.0,2.0
5103,日本海軍ができたのはいつですか？,japanese,content,1.8888888888888888,3.0,1.0,3.0,0.3,11,50.0,2.0
5104,コレラ菌の大きさは？,japanese,content,1.4,2.0,0,0,0.5,7,0,0.0
5105,狩野正信の出身はどこ レディ・ビー・グッドを開発したのは誰 マヤ文明に占星術はあった？,japanese,content,3.2,3.0,1.0,3.5,0.46153846153846156,27,50.0,2.0
5106,インド料理のナンは何種類ありますか？,japanese,content,1.5555555555555556,3.0,0,3.0,0.5,11,0.0,1.0
5107,チャールズ・サムナーの人種は何？,japanese,content,1.5,3.0,0,0,0.42857142857142855,8,0,0.0
5108,お茶の発祥はどこ？,japanese,content,1.5,3.0,0,0,0.4,6,0,0.0
5109,ビスカヤ県の主要農産物は何？,japanese,content,1.7142857142857142,3.0,0,0,0.625,9,0,0.0
5110,大坂竹本座はいつ完成した？,japanese,content,1.6,2.0,0,2.0,0.3333333333333333,7,0.0,1.0
5111,キャロル・シェルビーの身長は？,japanese,content,1.4,2.0,0,0,0.5,7,0,0.0
5112,ハンガリー王国の初代国王はだれ アメリカ合衆国が建国されたのはいつ ドレッドノートの初代船長は誰？,japanese,content,2.72,4.0,1.0,5.0,0.5384615384615384,27,100.0,1.0
5113,ジョン・ベル・フッドの最終階位は何？,japanese,content,2.0,3.0,0,0,0.5,11,0,0.0
5114,朝比奈 隆の母親の名は？,japanese,content,1.4285714285714286,3.0,0,0,0.625,9,0,0.0
5115,後期中等教育における専門教育で体育を初めて導入した学校は何 『ちちんぷいぷい』の初代ディレクターは誰 有形文化財に登録された建物の維持費は誰が負担しますか？,japanese,content,2.9302325581395348,6.0,1.0,2.25,0.5,47,75.0,4.0
5116,松野 明美はいつ長距離走を始めた？,japanese,content,2.125,2.0,0,3.0,0.6666666666666666,10,0.0,1.0
5117,読売ジャイアンツの株主は？,japanese,content,1.25,2.0,0,0,0.6,6,0,0.0
5118,漫画『リアルアカウント』の主人公の職業は何？,japanese,content,1.8888888888888888,4.0,0,0,0.6,13,0,0.0
5119,ケビン・モーリス・ガーネットはどこで生まれた？,japanese,content,2.111111111111111,2.0,0,2.0,0.4,11,0.0,1.0
5120,株式の発祥はどこ 『戦女神VERITA』の総販売数はいくつ エミリー・ワイルディング・デイヴィソンは何歳で死去した？,japanese,content,3.375,3.0,0,4.0,0.52,28,0.0,1.0
5121,『空手バカ一代』の主人公の実在のモデルは誰 航空母艦エンタープライズは最大いくつの戦闘機を搭乗できる？,japanese,content,2.6538461538461537,4.0,0,3.0,0.5925925925925926,30,0.0,1.0
5122,スペインで最も面積が広いのはどこ 共通漁業政策はいつ制定された？,japanese,content,2.588235294117647,3.0,0,4.0,0.4444444444444444,19,0.0,1.0
5123,ジークフリート線の建設を指示したのは誰 真空ブレーキを初めて搭載した列車は何？ Blueholeはいつ設立した？,japanese,content,2.7037037037037037,4.0,1.0,3.3333333333333335,0.39285714285714285,29,66.66666666666667,3.0
5124,何故西暦が世界の標準になった 国際リニアコライダーの計画の本部はどこにありますか？,japanese,content,2.75,6.0,1.0,3.0,0.42857142857142855,22,50.0,2.0
5125,"日本で最初に略綬を付けたのは誰 リチャード・""",japanese,content,2.3333333333333335,3.0,1.0,5.0,0.38461538461538464,14,100.0,1.0
5126,"ディック""・ターピンはいつ生まれた？",japanese,content,1.7142857142857142,2.0,0,2.0,0.5,9,0.0,1.0
5127,ウクライナの国技は何？,japanese,content,1.5,3.0,0,0,0.4,6,0,0.0
5128,北陸線列車雪崩直撃事故時、列車に乗員は何人いた？,japanese,content,2.3333333333333335,2.0,0,3.0,0.7,12,0.0,1.0
5129,バスク人はスペインで差別されていた？,japanese,content,2.1,2.0,1.0,1.5,0.45454545454545453,12,50.0,2.0
