sentence_id,text,language,type,avg_links_len,avg_max_depth,avg_subordinate_chain_len,avg_verb_edges,lexical_density,n_tokens,subordinate_proposition_dist,verbal_head_per_sent
7536,ポドゴリツァの2018年の人口は？,japanese,content,1.8333333333333333,2.0,0,0,0.42857142857142855,8,0,0.0
7537,フィリピンに日本軍が入ったのはいつ 『革命機ヴァルヴレイヴ』の主人公はだれですか？,japanese,content,2.6315789473684212,3.0,1.0,4.0,0.45,23,100.0,1.0
7538,日本で初めてビール生産を始めたのは誰 オーストリアの公用語は何？,japanese,content,2.5,3.0,1.0,5.0,0.47058823529411764,18,100.0,1.0
7539,『桜井一枝&井上雅雄のるんるん土曜リクエスト』で最初に放送された楽曲は何？,japanese,content,2.6,5.0,1.0,1.0,0.5238095238095238,24,100.0,2.0
7540,PlayStationを開発した会社は何？,japanese,content,1.5,4.0,1.0,1.0,0.42857142857142855,8,100.0,1.0
7541,ヘーパイストスの父親は誰？,japanese,content,1.5,3.0,0,0,0.4,6,0,0.0
7542,一進会の創始者は誰？,japanese,content,1.5,3.0,0,0,0.5714285714285714,8,0,0.0
7543,ライン＝マイン地方の主要産業は何 松茸を食べる文化は日本で発祥した？,japanese,content,2.111111111111111,4.0,1.0,2.0,0.5263157894736842,20,50.0,2.0
7544,フランスのシンガーソングライター、ルノーの宗教的思想は何？,japanese,content,1.9090909090909092,5.0,0,0,0.5833333333333334,14,0,0.0
7545,ルール地方で最初に建てられた工場は何？,japanese,content,1.8,4.0,1.0,2.0,0.45454545454545453,12,100.0,1.0
7546,ヴァールブルク の主要産業は何 レミントン・アームズはいつ設立した？,japanese,content,2.0714285714285716,3.0,0,3.0,0.4666666666666667,16,0.0,1.0
7547,萬代橋の全長は？,japanese,content,1.25,2.0,0,0,0.6,6,0,0.0
7548,東武鉄道の創始者は誰？,japanese,content,1.5,3.0,0,0,0.5714285714285714,8,0,0.0
7549,帯方郡の広さはどれだけあった？,japanese,content,1.7777777777777777,3.0,0,2.0,0.4,11,0.0,1.0
7550,諸子百家の意味はなんですか？,japanese,content,1.5,3.0,0,0,0.3333333333333333,10,0.0,1.0
7551,ベーコン・アイスクリームの色は何 PYGが最初に発表した曲は何 メアリー・マーガレット・オライリーの大学の専攻は何？,japanese,content,3.1481481481481484,4.0,1.0,2.0,0.42857142857142855,29,100.0,1.0
7552,チワン族の公用語はなんですか？,japanese,content,1.5,3.0,0,0,0.4444444444444444,10,0.0,1.0
7553,リパンティトランの戦いで、テクシャン反乱軍の軍勢の数は？,japanese,content,2.090909090909091,3.0,1.0,0,0.5833333333333334,14,100.0,1.0
7554,チャイルドシートは何歳まで使用しなければいけませんか？,japanese,content,2.1666666666666665,3.0,1.0,2.5,0.3076923076923077,14,50.0,2.0
7555,バスケットボールの発祥はどこ？,japanese,content,1.5,3.0,0,0,0.4,6,0,0.0
7556,ロバート・ケイツビーは捕まった？,japanese,content,1.4,2.0,0,1.0,0.5,7,0.0,1.0
7557,ナーズム・ヒクメットはいつ生まれた？,japanese,content,1.5,2.0,0,2.0,0.42857142857142855,8,0.0,1.0
7558,1月蜂起で何人の死者が出た？,japanese,content,1.9,3.0,0,2.0,0.45454545454545453,12,0.0,1.0
7559,コロンビア革命軍の創始者は誰？ ANSIの本部はどこにある？,japanese,content,2.6,3.0,0,4.0,0.5,17,0.0,1.0
7560,北マケドニア共和国の公用語は何？,japanese,content,1.75,3.0,0,0,0.6666666666666666,10,0,0.0
7561,日本で女子サッカーのプロリーグが初めて設立されたのはいつ？,japanese,content,2.7857142857142856,4.0,1.0,5.0,0.4,16,100.0,1.0
7562,バッファロー・ビルズのチームカラーは何 ピアチェンツァの最大宗教は何 第20回スーパーボウルの勝者は？,japanese,content,2.1818181818181817,6.0,0,0,0.5652173913043478,24,0,0.0
7563,地中海貿易のはじまりはいつ？,japanese,content,1.5,3.0,0,0,0.5714285714285714,8,0,0.0
7564,指揮者が使用する指揮棒の原材料はなんですか？,japanese,content,1.7692307692307692,4.0,1.0,1.0,0.5,15,50.0,2.0
7565,ドイツ最後の皇帝は誰ですか？,japanese,content,1.4285714285714286,3.0,0,0,0.375,9,0.0,1.0
7566,航空母艦フューリアスはいつ完成した サレカット・イスラムの当初のリーダーは誰でしたか？,japanese,content,2.55,4.0,1.0,2.5,0.42857142857142855,22,50.0,2.0
7567,不飽和脂肪酸を発見したのは誰？,japanese,content,2.4,3.0,1.0,3.0,0.45454545454545453,12,100.0,1.0
7568,リパンティトランの戦いでメキシコ軍を率いたのは誰 『あどりぶランド』が放送されていた時間帯は？ .44レミントン・マグナムが最初に用いられた戦争は何？,japanese,content,2.7222222222222223,6.0,1.3333333333333333,2.25,0.43243243243243246,42,100.0,4.0
7569,カザンの面積は？,japanese,content,1.3333333333333333,2.0,0,0,0.5,5,0,0.0
7570,『新約聖書』が書かれた言語は何？,japanese,content,1.875,4.0,1.0,1.0,0.4444444444444444,12,100.0,1.0
7571,月の直径は？,japanese,content,1.3333333333333333,2.0,0,0,0.5,5,0,0.0
7572,水中に最も多い元素は何 大砲を開発したのは誰？,japanese,content,2.2142857142857144,5.0,1.0,4.0,0.4,16,100.0,1.0
7573,シェール・シャーとはどのような人物ですか？,japanese,content,1.9,2.0,1.0,0,0.36363636363636365,12,50.0,2.0
7574,アンラジェの大多数の階級は何 ジャクソンビル・ジャガーズの株主は？,japanese,content,2.1538461538461537,3.0,0,0,0.5,15,0,0.0
7575,カンザスシティの主要産業は何？,japanese,content,1.5,3.0,0,0,0.5714285714285714,8,0,0.0
7576,ナヘラの戦いで勝ったのはどちら イボガインに依存性はある？,japanese,content,2.357142857142857,4.0,1.0,3.0,0.4666666666666667,16,50.0,2.0
7577,クリミア半島での共通言語は何？ 教育とは何ですか？,japanese,content,2.1538461538461537,3.0,0,0,0.35714285714285715,16,0.0,1.0
7578,アンドラ公国の最大宗教は何 エドワード・ウェスターマークに兄弟姉妹はいた？,japanese,content,2.2666666666666666,3.0,0,3.0,0.5625,17,0.0,1.0
7579,シリンダーヘッドに使われる主な素材は何？,japanese,content,1.5,4.0,1.0,1.0,0.5555555555555556,10,100.0,1.0
7580,代数的整数論はいつ発生した？ NHKは何年にテレビ放映を開始しましたか？,japanese,content,2.1818181818181817,5.0,1.0,3.0,0.391304347826087,24,50.0,2.0
7581,サラ・ジェニングスはどこで生まれた？,japanese,content,1.7142857142857142,2.0,0,2.0,0.375,9,0.0,1.0
7582,明治維新はいつ起きた？,japanese,content,1.4,2.0,0,2.0,0.5,7,0.0,1.0
7583,マーベルコミックスの創始者は誰？,japanese,content,1.5,3.0,0,0,0.5714285714285714,8,0,0.0
7584,畠山 重忠はいつ生まれた？,japanese,content,1.5,2.0,0,2.0,0.5714285714285714,8,0.0,1.0
7585,カール4世が皇帝に即位したのは何歳の時 日本の公的な文書で使われる文字のフォントは何？,japanese,content,2.7037037037037037,5.0,1.0,3.0,0.42857142857142855,29,100.0,2.0
7586,エニグマを開発したのは誰 牧歌街道とはどこからどこまでを指しますか？,japanese,content,2.9,3.0,1.0,3.5,0.2857142857142857,22,50.0,2.0
7587,硫化鉄鉱は何の材料として使われましたか？,japanese,content,2.3846153846153846,3.0,0,3.0,0.2857142857142857,15,0.0,1.0
7588,“ピング”セオドア・スターク・ウィルキンソンはどこで死去した？,japanese,content,2.4545454545454546,2.0,0,2.0,0.4166666666666667,15,0.0,1.0
7589,高等学校必履修科目未履修問題が判明してから、大学受験の方式は変更された？,japanese,content,2.65,3.0,1.0,2.5,0.5714285714285714,23,50.0,2.0
7590,リン・アンダーソンの処女作は何？,japanese,content,1.5714285714285714,3.0,0,0,0.5,9,0,0.0
7591,地球に落ちた今までで最大の隕石は何？,japanese,content,2.0,4.0,1.0,1.0,0.4166666666666667,13,100.0,1.0
7592,昭和金融恐慌の発端は何 マーシャと熊の放送はいつ始まった？,japanese,content,2.0,4.0,0,3.0,0.5,17,0.0,1.0
7593,アメリカでユダヤ人の実業家が多いのはなぜ？,japanese,content,2.1818181818181817,4.0,0,0,0.5833333333333334,13,0,0.0
7594,R・J・ヴァン・デ・グラフはどこの所属で研究をしていた？,japanese,content,3.210526315789474,3.0,1.0,2.0,0.45,21,50.0,2.0
7595,名古屋鉄道で最古の駅は何 宏池会はいつ誕生した？,japanese,content,2.5,3.0,0,4.0,0.4666666666666667,16,0.0,1.0
7596,肯定的措置が初めて就職の場に持ち込まれたのはいつ カール・ラーションの最大の作品は何？,japanese,content,2.9130434782608696,4.0,1.0,5.0,0.4166666666666667,25,100.0,1.0
7597,アルゴリズムとはなんですか？,japanese,content,1.8,2.0,0,0,0.16666666666666666,7,0.0,1.0
7598,デフロックを開発したのは誰 四国と本州を結ぶ橋はいつ建設が完了した？,japanese,content,2.5,5.0,1.0,2.3333333333333335,0.38095238095238093,22,66.66666666666667,3.0
7599,アメリカ植民地協会はいつ設立された？,japanese,content,1.8888888888888888,2.0,0,2.0,0.5,11,0.0,1.0
7600,みずきひとしのデビュー作は何 SGウォーバーグの出身はどこ 日本最大のスキー場は何 バンドのウイングスが初めて発表した曲は何 バス代行が最初にされたのはいつ 日本で最後に確認された四大公害病の一つは何？,japanese,content,3.4745762711864407,6.0,1.0,3.6666666666666665,0.45,61,100.0,3.0
7601,ジャック・デリダはどこの大学で学部時代を過ごした？,japanese,content,2.25,3.0,0,3.0,0.46153846153846156,14,0.0,1.0
7602,日本最古の町屋はどこにある 浅草寺にはいくつ仏像がある？,japanese,content,2.4,4.0,1.0,2.0,0.5,17,50.0,2.0
7603,ペルシア文学の巨匠は誰？ 百年戦争は何段階に分けられる MGM-31 パーシングは何年に初めて製造されましたか？,japanese,content,3.8275862068965516,4.0,1.0,0.5,0.4,32,50.0,2.0
7604,ニヨン-サン＝セルゲ-モレ鉄道の創始者は誰？,japanese,content,3.0,3.0,0,0,0.5384615384615384,14,0,0.0
7605,駆逐艦フォークナーはいつ完成した？,japanese,content,1.5714285714285714,2.0,0,2.0,0.5,9,0.0,1.0
7606,ジェンティルドンナの父親の名前は？,japanese,content,1.4,3.0,0,0,0.5,7,0,0.0
7607,『ガンダムシリーズ』には何種類のモビルスーツが登場しますか？,japanese,content,2.3846153846153846,3.0,0,3.0,0.42857142857142855,17,0.0,1.0
7608,グライフェンシュタインの初代町長は誰？,japanese,content,1.5,3.0,0,0,0.5714285714285714,8,0,0.0
7609,ドリコムの創始者は誰 １円玉の素材は何？,japanese,content,2.4166666666666665,3.0,0,0,0.46153846153846156,14,0,0.0
7610,最古の相撲漫画は何？,japanese,content,1.6,3.0,0,0,0.5,7,0,0.0
7611,白ワインの生産は世界でいつ始まった 「空気清浄器」を初めて開発したのはどの会社ですか？ 『月刊ドラゴンエイジ』の出版社は？,japanese,content,3.0689655172413794,5.0,1.0,3.5,0.5,36,100.0,3.0
7612,2019年5月までで、アメリカ合衆国で一番高い建物は何？,japanese,content,2.357142857142857,4.0,0,0,0.5333333333333333,17,0,0.0
7613,ウルトラマンの考案者は誰？,japanese,content,1.6,3.0,0,0,0.5,7,0,0.0
7614,ヘルツェブロック＝クラールホルツ の2018年度の人口は？,japanese,content,1.8888888888888888,2.0,0,0,0.5,11,0,0.0
7615,無機化学の先駆者は誰 鎖国令を出したのは誰？,japanese,content,2.066666666666667,4.0,1.0,4.0,0.5,17,100.0,1.0
7616,ウェットスーツを初めて販売した会社は何 マルティニ・ヘンリー銃をの重さは？,japanese,content,2.2777777777777777,4.0,1.0,2.0,0.47368421052631576,20,100.0,1.0
7617,富田 木歩は文学賞を受賞したことがある？,japanese,content,1.8333333333333333,2.0,1.0,1.5,0.6153846153846154,14,50.0,2.0
7618,死んだ妊婦に胎児を抱かせる習慣はいつまで続いた？,japanese,content,1.7857142857142858,5.0,1.0,1.3333333333333333,0.4666666666666667,16,66.66666666666667,3.0
7619,ファンタジー小説の先駆者はだれ？ 理論物理学とはどのような学問ですか？,japanese,content,2.3529411764705883,3.0,1.0,0,0.5,20,50.0,2.0
7620,レッドクラウド戦争のターニングポイントは何 大谷砂留の大きさは？,japanese,content,1.8181818181818181,3.0,0,0,0.5,13,0,0.0
7621,マレーシア航空17便撃墜事件で飛行機はどこに墜落した？,japanese,content,2.5,2.0,0,3.0,0.5333333333333333,16,0.0,1.0
7622,ツールド・フランスが最初に開催されたのはいつ？,japanese,content,2.6666666666666665,3.0,1.0,4.0,0.3076923076923077,14,100.0,1.0
7623,マイナンバー・カードで住民票をコンビニで発行できる？,japanese,content,2.1,2.0,0,3.0,0.5454545454545454,12,0.0,1.0
7624,バスケットボール選手の平均身長は何センチメートルですか？,japanese,content,1.7,3.0,0,0,0.5454545454545454,12,0.0,1.0
7625,一階述語論理とはなんですか？,japanese,content,1.875,2.0,0,0,0.3333333333333333,10,0.0,1.0
7626,四季童子の性別は？,japanese,content,1.25,2.0,0,0,0.6,6,0,0.0
7627,発馬機を初めて導入した競馬場は何？,japanese,content,1.7,4.0,1.0,2.0,0.5454545454545454,12,100.0,1.0
7628,日本最古の自動車教習所は何？,japanese,content,2.0,3.0,0,0,0.6666666666666666,10,0,0.0
7629,人類が初めてイングランドに到達したのはいつ ミマール・スィナンの死因は何 コンクラーヴェはいつ始まった？,japanese,content,3.1363636363636362,3.0,1.0,5.0,0.391304347826087,24,50.0,2.0
7630,麻雀の発祥はどこ 『ギャルバサラ -戦国時代は圏外です-』の主演は誰 富士フイルムの本社はどこにある？,japanese,content,3.3846153846153846,4.0,1.0,4.0,0.48148148148148145,30,50.0,2.0
7631,フョードル・ドストエフスキーはロシア正教会の信者？,japanese,content,2.0,2.0,0,0,0.6666666666666666,10,0,0.0
7632,唐はいつ興った？,japanese,content,1.5,2.0,0,2.0,0.4,6,0.0,1.0
7633,チンギスハンはいつ生まれた？,japanese,content,1.5,2.0,0,2.0,0.4,6,0.0,1.0
7634,ステファノ・マガディーノの最終学歴は何 カリフォルニア大学ロサンゼルス校 が設置されたのはいつ 行政管区とはなんですか？,japanese,content,3.0384615384615383,3.0,1.0,3.0,0.4074074074074074,28,50.0,2.0
7635,トゴン・テムル・ハーンはいつ生まれた？,japanese,content,2.0,2.0,0,2.0,0.4444444444444444,10,0.0,1.0
7636,キャバレーの発祥はどこ 袁 世凱はいつ生まれた？,japanese,content,2.3,3.0,0,4.0,0.45454545454545453,12,0.0,1.0
7637,リチャード・ケレンス・サザランドはいつ生まれた パラドックスという言葉の語源は？,japanese,content,2.4,3.0,1.0,0.5,0.5,17,100.0,2.0
7638,ハリケーン・ヒューゴの最大風速は何 “ジョッコー”ジョゼフ・ジェームズ・クラークの第一言語は何？,japanese,content,3.1578947368421053,3.0,0,0,0.5,23,0,0.0
7639,トクサン自動車工業はいつ設立した？,japanese,content,1.75,2.0,0,2.0,0.5555555555555556,10,0.0,1.0
7640,広島はどこにありますか？,japanese,content,1.8333333333333333,2.0,0,3.0,0.2857142857142857,8,0.0,1.0
7641,世界に海軍、海上自衛隊がない国はある？,japanese,content,2.6,4.0,0,2.0,0.7272727272727273,13,0.0,1.0
7642,大院君政権は何年続いた？,japanese,content,1.5714285714285714,2.0,0,2.0,0.625,9,0.0,1.0
7643,由良川の長さは？,japanese,content,1.5,2.0,0,0,0.4,6,0,0.0
7644,ターズィエは年間何日間行われますか？,japanese,content,2.125,2.0,0,4.0,0.4444444444444444,10,0.0,1.0
7645,カウペンスの戦いは陸上戦？,japanese,content,1.6,3.0,0,0,0.6666666666666666,7,0,0.0
7646,単座戦闘機ハリケーンを最初に操縦したパイロットは？,japanese,content,1.9090909090909092,3.0,1.0,2.0,0.5833333333333334,13,100.0,1.0
7647,生物学の始祖はだれですか？,japanese,content,1.4285714285714286,3.0,0,0,0.5,9,0,0.0
7648,ジョゼフ・マリー・ド・メーストル伯爵はいつ生まれた アダム・トロイ・ダンの主な守備位置は？,japanese,content,3.2857142857142856,3.0,1.0,1.0,0.5454545454545454,23,100.0,1.0
7649,駅馬車はいつ誕生した？,japanese,content,1.5,2.0,0,2.0,0.42857142857142855,8,0.0,1.0
7650,大政奉還はどこで行われた？,japanese,content,1.7142857142857142,2.0,0,2.0,0.375,9,0.0,1.0
7651,ロッキードが最初に開発した製品は何？,japanese,content,1.8888888888888888,4.0,1.0,2.0,0.4,11,100.0,1.0
7652,キューバにベーシックインカム政策は施行されている？,japanese,content,2.0,2.0,1.0,1.5,0.5454545454545454,12,50.0,2.0
7653,日本国籍を取得するためには、どのような資格が必要ですか？,japanese,content,2.3333333333333335,3.0,1.0,3.0,0.375,18,100.0,2.0
7654,ジョン・シングルトン・モスビーの出身はどこ 初めて発売された書画カメラの製品名は何？,japanese,content,2.15,5.0,1.0,2.0,0.47619047619047616,22,100.0,1.0
7655,宮城県仙台市の路面電車は何年まで運行されていましたか？,japanese,content,2.4444444444444446,4.0,1.0,2.0,0.47368421052631576,20,50.0,2.0
7656,オリンピックはどこで始まりましたか？,japanese,content,2.0,2.0,0,3.0,0.25,9,0.0,1.0
7657,人肉検索は警察の事件捜査にも使われる？,japanese,content,2.2,3.0,0,2.0,0.5454545454545454,12,0.0,1.0
7658,日本で最初のキリシタン大名は誰？,japanese,content,1.5714285714285714,4.0,0,0,0.5,9,0,0.0
7659,カルト・オブ・ザ・デッド・カウはいつ設立した,japanese,content,3.3846153846153846,2.0,0,2.0,0.42857142857142855,14,0.0,1.0
7660,コノトプの戦いはどのように開戦した 暗号の起源はいつ 御木曳の起源はいつ モジュラー表現論の名称の由来は？,japanese,content,2.3703703703703702,6.0,2.0,2.0,0.4642857142857143,29,100.0,2.0
7661,松下幸之助は何歳で事業を起こした？,japanese,content,2.111111111111111,2.0,0,3.0,0.5,11,0.0,1.0
7662,テーブル・フットボールの起源はいつ 愛知県初の鉄道は何？,japanese,content,2.4615384615384617,3.0,0,0,0.5,15,0,0.0
7663,カール・シュルツが所属した新聞社は何？,japanese,content,1.7,4.0,1.0,1.0,0.45454545454545453,12,100.0,1.0
7664,ミスター・サタンは何センチメートルですか？,japanese,content,1.75,2.0,0,0,0.4444444444444444,10,0.0,1.0
7665,台湾独立運動の父は誰 ノースフライトの馬主は誰？,japanese,content,1.9090909090909092,3.0,0,0,0.5,13,0,0.0
7666,『戦場にかける橋』で主演を務めたのは誰 スペイン・マヨルカ島の面積は何㎢ですか？,japanese,content,2.4285714285714284,5.0,1.0,2.5,0.4090909090909091,25,100.0,2.0
7667,衛星トリトンの大きさは？,japanese,content,1.4,2.0,0,0,0.5,7,0,0.0
7668,奴婢は農民より下の階級？,japanese,content,2.2857142857142856,2.0,0,0,0.625,9,0,0.0
7669,サジェストペディア を提唱したのは誰 北朝鮮最初の最高指導者はだれ 第一回甲子園ボウルのチャンピオンは？,japanese,content,3.2083333333333335,3.0,1.0,3.0,0.52,26,100.0,1.0
7670,シェハリオンの実験の計測結果は正確だった？,japanese,content,1.5555555555555556,4.0,0,0,0.5,11,0,0.0
7671,エウロパの名前の由来は何？,japanese,content,1.5,4.0,0,0,0.42857142857142855,8,0,0.0
7672,阪急阪神ホールディングスはいつ百貨店事業を始めましたか？,japanese,content,2.230769230769231,2.0,0,3.0,0.5714285714285714,15,0.0,1.0
7673,ノックスビル方面作戦による死者の数は？,japanese,content,1.75,3.0,1.0,0.0,0.6666666666666666,10,100.0,1.0
7674,卑弥呼はいつ誕生した オクトーバーフェストで踊りは踊られる？,japanese,content,2.5,3.0,1.0,2.0,0.5384615384615384,14,50.0,2.0
7675,琉球神道で一番権力の強い神は何？,japanese,content,2.2222222222222223,4.0,0,0,0.6,11,0,0.0
7676,アメリカで最も長い線路は何？,japanese,content,1.5,4.0,0,0,0.5714285714285714,8,0,0.0
7677,フランス人初の漫画家は誰 ロボットアニメ『鉄腕アトム』の著者は誰ですか？,japanese,content,2.2941176470588234,4.0,0,0,0.5555555555555556,21,0.0,1.0
7678,幽霊はどの文化にも存在する概念？,japanese,content,2.125,3.0,1.0,2.0,0.4444444444444444,10,100.0,1.0
7679,日本で国勢調査が行われる頻度は？,japanese,content,1.75,3.0,1.0,2.0,0.5555555555555556,10,100.0,1.0
7680,シュヴェービッシュ・グミュントの初代市長は誰？,japanese,content,1.5714285714285714,3.0,0,0,0.5,9,0,0.0
7681,ロングイェールビーンの最盛期はいつ？,japanese,content,1.5714285714285714,3.0,0,0,0.625,9,0,0.0
7682,パールシーとはどこにありますか？,japanese,content,2.0,2.0,0,3.0,0.25,9,0.0,1.0
7683,日本最古の野球漫画は何 新約聖書はいつ完成した？,japanese,content,2.0714285714285716,3.0,0,3.0,0.5333333333333333,16,0.0,1.0
7684,小菅神社はいつ建設された？,japanese,content,1.75,2.0,0,2.0,0.4444444444444444,10,0.0,1.0
7685,ライフガードは職業？,japanese,content,1.5,2.0,0,0,0.6666666666666666,4,0,0.0
7686,オーロラ号の漂流で餓死者は出た？,japanese,content,1.6666666666666667,3.0,0,2.0,0.6,11,0.0,1.0
7687,日本における朝鮮人に対する差別の歴史はいつまでさかのぼる？,japanese,content,2.0,5.0,1.0,0.6666666666666666,0.5333333333333333,16,66.66666666666667,3.0
7688,ワラキア公国を建国したのは誰 最大の和太鼓の大きさは？,japanese,content,2.2666666666666666,3.0,1.0,3.0,0.375,17,100.0,1.0
7689,ルイス・シーモア・バゼット・リーキーはどこの大学出身？,japanese,content,2.909090909090909,2.0,0,0,0.5,13,0,0.0
7690,チャールズ・ピート・コンラッド・ジュニアは計何日間宇宙に滞在した？,japanese,content,2.7142857142857144,2.0,0,3.0,0.5333333333333333,16,0.0,1.0
7691,Linuxの創始者は誰？,japanese,content,1.6,3.0,0,0,0.5,7,0,0.0
7692,スティーヴン・コルベアは何年にデビューしましたか？,japanese,content,2.090909090909091,2.0,0,3.0,0.3333333333333333,13,0.0,1.0
7693,日本最大の大学図書館は何 公衆電話の設置はいつから始まった ジンバブエ共和国の公用語は何 テラドライブはいつ開発された？,japanese,content,3.0606060606060606,5.0,1.0,3.0,0.5294117647058824,35,50.0,2.0
7694,小林幸子がボスキャラと呼ばれるのはなぜですか？,japanese,content,2.0,3.0,1.0,4.0,0.46153846153846156,14,100.0,1.0
7695,ロンダ・バーンはどこの国籍の人ですか？,japanese,content,1.9,3.0,0,0,0.36363636363636365,12,0.0,1.0
7696,世界で大学の無償化が行われている国はどこですか？,japanese,content,2.0,5.0,1.0,1.5,0.4375,17,66.66666666666667,3.0
7697,コルト製造会社は何年創立されましたか？,japanese,content,2.272727272727273,2.0,0,3.0,0.4166666666666667,13,0.0,1.0
7698,アイスホッケーの起源はいつ 長州藩の初代藩主は誰 サルモネラは空気感染する？,japanese,content,2.8823529411764706,3.0,0,5.0,0.5555555555555556,19,0.0,1.0
7699,ミケランジェロの作成した最大の作品は何？,japanese,content,1.8888888888888888,4.0,1.0,1.0,0.4,11,100.0,1.0
7700,ドナウヴェルトの初代市長は誰？,japanese,content,1.6,3.0,0,0,0.5,7,0,0.0
7701,機動戦士ガンダムSEED ASTRAYの脚本は誰が書いた？,japanese,content,2.0,3.0,0,2.0,0.5833333333333334,13,0.0,1.0
7702,エカチェリーナ2世級戦艦が初めて参加した戦闘は何 ウォルター・ブルース・ウィリスはどこの国で活躍した？,japanese,content,2.5652173913043477,4.0,1.0,2.5,0.4583333333333333,25,50.0,2.0
7703,日本で共産党が誕生したのはいつ イギリス領ヴァージン諸島の共通語は何？,japanese,content,2.6315789473684212,4.0,1.0,4.0,0.5,21,100.0,1.0
7704,アンハルト州の州都はどこ？,japanese,content,1.4,3.0,0,0,0.5,7,0,0.0
7705,タルトゥ大学はいつ設立した 構成主義的発達論のフレームワークを作ったのは誰？,japanese,content,2.8947368421052633,5.0,1.0,2.5,0.45,21,100.0,2.0
7706,チェスの発祥はどこ シュロート療法とはどのような療法ですか？,japanese,content,2.357142857142857,3.0,1.0,0,0.4,16,50.0,2.0
7707,『シルマリルの物語』の出版社はどこ アット・ザ・ゲイツのリーダーは誰 電子メールは誰が開発しましたか？,japanese,content,2.923076923076923,4.0,0,5.0,0.4074074074074074,30,0.0,1.0
7708,秋田県仙北市の初代市長は誰？,japanese,content,1.5714285714285714,3.0,0,0,0.625,9,0,0.0
7709,コトゥジッツの戦いの戦闘はどこで行われましたか？,japanese,content,2.0,4.0,0,3.0,0.3076923076923077,14,0.0,1.0
7710,日本の海水浴場でライフセーバーの設置は義務付けられている？,japanese,content,1.9285714285714286,3.0,1.0,0.0,0.6,16,100.0,2.0
7711,ジェノヴァの海戦の被害者は何名ですか？,japanese,content,1.6,4.0,0,0,0.45454545454545453,12,0.0,1.0
7712,タンザニアの首都はどこですか？,japanese,content,1.5,3.0,0,0,0.2857142857142857,8,0.0,1.0
7713,ドイツ連邦共和国ニーダーザクセン州で一番高い山は何？,japanese,content,1.6363636363636365,5.0,0,0,0.75,13,0,0.0
