sentence_id,text,language,type,avg_links_len,avg_max_depth,avg_subordinate_chain_len,avg_verb_edges,lexical_density,n_tokens,subordinate_proposition_dist,verbal_head_per_sent
2408,三角貿易時代一番裕福だった国はどこ？,japanese,content,1.6666666666666667,4.0,0,0,0.6,11,0,0.0
2409,ウェスタロスの名の由来はなんですか？,japanese,content,1.5,4.0,0,0,0.3333333333333333,10,0.0,1.0
2410,バーリントンの初代市長は CDが初めて販売されたのはいつ？,japanese,content,2.642857142857143,4.0,1.0,5.0,0.4,16,100.0,1.0
2411,水は氷ると体積が増えるのは何故？,japanese,content,1.8888888888888888,4.0,2.0,3.0,0.4,11,100.0,2.0
2412,ゲオルギオスは新約聖書に登場する？,japanese,content,1.8333333333333333,2.0,0,2.0,0.5714285714285714,8,0.0,1.0
2413,ボヘミアニズムとはなんですか？,japanese,content,1.6666666666666667,2.0,0,0,0.2857142857142857,8,0.0,1.0
2414,ノルウェー国鉄が設立されたのはいつ 木製で最大規模の火山は何？,japanese,content,2.888888888888889,3.0,1.0,3.0,0.42105263157894735,20,100.0,1.0
2415,アメリカのメイン州の州都はどこ イスラエルが建国したのはいつ エバーグレーズの面積は ゼインズビルの主要産業は何？,japanese,content,3.230769230769231,4.0,1.0,4.0,0.4444444444444444,28,100.0,1.0
2416,ギャグマンガの起源はいつ 日本初のファンタジー漫画は何？,japanese,content,2.1,3.0,0,0,0.45454545454545453,12,0,0.0
2417,世界における脱毛の起源はいつ 見つかった中で最大のマンモス 推定の大きさは？,japanese,content,1.9,7.0,1.0,1.0,0.47619047619047616,22,100.0,2.0
2418,キミ＝マティアス・ライコネンは何歳で自動車競技を始めた？,japanese,content,2.5,2.0,0,3.0,0.4666666666666667,16,0.0,1.0
2419,三岐鉄道はいつ設立した オタワ族の人口が一番多い地域はどこ 現在デンマークに国教はある？,japanese,content,2.909090909090909,6.0,1.0,3.0,0.5652173913043478,24,50.0,2.0
2420,ナショナル・フットボール・カンファレンスには何チーム所属していますか？,japanese,content,2.357142857142857,2.0,1.0,2.0,0.4,16,50.0,2.0
2421,アントン・ブルックナーが最初に作った曲は何 『エゼキエル書』に登場する「神の戦車」はどのような戦車でしたか？,japanese,content,2.814814814814815,4.0,1.0,2.3333333333333335,0.4642857142857143,33,75.0,4.0
2422,フランスの首都はどこ 1970年の日本万国博覧会の年に大阪城公園に埋められたタイムカプセルは、いつ埋めた人に返された？,japanese,content,2.84375,6.0,1.0,2.0,0.5151515151515151,35,66.66666666666667,3.0
2423,山井大介は完全試合を達成したことはある？,japanese,content,1.8181818181818181,2.0,1.0,1.5,0.5833333333333334,13,50.0,2.0
2424,ポルトガル領ブラジル植民地の時代に統治していたのは、何人ですか カイザー・ヴィルヘルム記念教会に偶像はない？,japanese,content,3.3076923076923075,4.0,1.0,2.0,0.5555555555555556,29,100.0,3.0
2425,一円玉の素材は何 ノルウェーで一番高い山は何？,japanese,content,2.090909090909091,4.0,0,0,0.5,13,0,0.0
2426,ニュージャージー州で最大の都市は何？,japanese,content,2.0,3.0,0,0,0.5,9,0,0.0
2427,スピリチュアルケアを提唱し始めたのは誰？,japanese,content,3.0,3.0,2.0,2.0,0.3333333333333333,10,100.0,2.0
2428,フェニアン団を指揮したのは誰 水生に水は存在する？,japanese,content,2.4285714285714284,3.0,1.0,3.0,0.4,16,50.0,2.0
2429,バスク祖国と自由はいつ設立された ガンマ線バーストは肉眼で確認できる？,japanese,content,2.5294117647058822,3.0,1.0,2.0,0.5,19,50.0,2.0
2430,漫画『クロノアイズ』のジャンルは何 内臓性腹痛の主な原因は何？,japanese,content,2.4285714285714284,3.0,0,0,0.6,18,0,0.0
2431,現存する世界最古の龍窯は何？,japanese,content,1.8333333333333333,3.0,1.0,0.0,0.5714285714285714,8,100.0,1.0
2432,ライモント・ファン・バルネフェルトは何歳でダーツを始めた？,japanese,content,2.3333333333333335,2.0,0,3.0,0.46153846153846156,14,0.0,1.0
2433,イギリスはなぜユーロを導入しなかった？,japanese,content,2.25,2.0,0,3.0,0.4444444444444444,10,0.0,1.0
2434,デニス・キース・ロッドマンが最初に所属したチームは何？,japanese,content,2.2857142857142856,4.0,1.0,2.0,0.4666666666666667,16,100.0,1.0
2435,ソネットエンタテインメント株式会社はいつ設立した 日本で農耕が始まったのはいつ？,japanese,content,2.4705882352941178,4.0,1.0,3.0,0.4444444444444444,19,100.0,2.0
2436,トルヴォサウルスの化石を初めて発見したのは誰 インドでカースト制度が発生したのはいつ頃 デンバー・アンド・リオグランデ・ウェスタン鉄道の本社はどこにある？,japanese,content,4.0,4.0,1.0,4.333333333333333,0.43243243243243246,38,66.66666666666667,3.0
2437,『スパイダーマン』のブラックキャットの職業は？,japanese,content,1.8333333333333333,3.0,0,0,0.5714285714285714,10,0,0.0
2438,慶元まさ美の出身地はどこですか？,japanese,content,1.5555555555555556,3.0,0,0,0.5,11,0.0,1.0
2439,公務員の労働基本権はいつ制定された 奈良期とはいつをさしますか？,japanese,content,2.473684210526316,3.0,1.0,2.5,0.4,21,50.0,2.0
2440,アンドラ公国の首都はどこですか？,japanese,content,1.4285714285714286,3.0,0,0,0.375,9,0.0,1.0
2441,イングランドで最大の都市は何 『マガディーラ 勇者転生』でダンスシーンはある？,japanese,content,3.7142857142857144,3.0,0,4.0,0.6,18,0.0,1.0
2442,日本で環境問題を取り扱う省庁は何？,japanese,content,1.75,4.0,1.0,2.0,0.5555555555555556,10,100.0,1.0
2443,大英図書館の面積は？,japanese,content,1.25,2.0,0,0,0.6,6,0,0.0
2444,九世野村万蔵はいつ生まれた？,japanese,content,1.7142857142857142,2.0,0,2.0,0.5,9,0.0,1.0
2445,リップシュタットを建設したのは誰？ CBS放送で初めて放送されたラジオ番組は何？,japanese,content,2.210526315789474,7.0,1.0,2.5,0.4,22,100.0,2.0
2446,3Dバイオプリンティングの技術が開発されたのはいつ フットボール・クラブ・バルセロナ、サッカー部門の初代監督は誰？,japanese,content,2.9166666666666665,4.0,1.0,3.0,0.44,27,100.0,1.0
2447,ウガンダ共和国の面積は？,japanese,content,1.4,2.0,0,0,0.6666666666666666,7,0,0.0
2448,キャバレーとサロンの違いは何 中国の陶磁器が日本に来たのはいつごろ？,japanese,content,2.4705882352941178,4.0,1.0,4.0,0.4444444444444444,19,100.0,1.0
2449,磁気を発見したのは誰 サン・ファン・バウティスタ号はいつ完成した？,japanese,content,3.111111111111111,3.0,1.0,3.0,0.3684210526315789,20,50.0,2.0
2450,『戦場にかける橋』の原作が出版されたのはいつ シャーマン ファイアフライはいつ完成した ダニエル・ジョセフ・リチャルドは結婚した？,japanese,content,3.103448275862069,6.0,1.0,2.0,0.4,33,75.0,4.0
2451,ウィリアム・アイザック・トマスはいつう荒れ田？,japanese,content,2.142857142857143,2.0,0,0,0.625,9,0,0.0
2452,グスターヴ・ホルストが生まれたのはいつ？,japanese,content,2.0,3.0,1.0,3.0,0.3333333333333333,10,100.0,1.0
2453,人類が初めて火を起こしたのはいつ？,japanese,content,2.4444444444444446,3.0,1.0,5.0,0.4,11,100.0,1.0
2454,チェックポイント・チャーリーが崩壊したのはいつ 貿易調整支援とはどのような支援ですか？,japanese,content,2.9047619047619047,3.0,1.0,3.0,0.4090909090909091,23,66.66666666666667,3.0
2455,ハリー・マクニッシュの出身はどこ？,japanese,content,1.5,3.0,0,0,0.42857142857142855,8,0,0.0
2456,ビデオ判定を初めて採用したスポーツ競技は何？,japanese,content,1.7,4.0,1.0,2.0,0.5454545454545454,12,100.0,1.0
2457,エマニュエル・トッドはどこの大学出身？,japanese,content,2.0,2.0,0,0,0.5,9,0,0.0
2458,職業登山家の先駆者は誰？,japanese,content,1.5714285714285714,3.0,0,0,0.625,9,0,0.0
2459,チェルヴォナ・ウクライナは何トンの軽巡洋艦ですか？,japanese,content,2.090909090909091,2.0,0,0,0.5,13,0.0,1.0
2460,日本初の免税店は何 アメリカ合衆国ニューメキシコ州で最大の都市は何？,japanese,content,2.4705882352941178,3.0,0,0,0.6111111111111112,19,0,0.0
2461,『ダブルアーツ』の主人公は誰 ラグビーユニオンはラグビーから派生した？,japanese,content,2.2142857142857144,3.0,0,3.0,0.5333333333333333,18,0.0,1.0
2462,ベドルジハ・スメタナは国家主義者？,japanese,content,1.8333333333333333,2.0,0,0,0.7142857142857143,8,0,0.0
2463,トラフグで毒が入っている部位はどこ？ 『赤蝦夷風説考』は文庫本化された？,japanese,content,2.8947368421052633,4.0,1.0,2.3333333333333335,0.55,24,66.66666666666667,3.0
2464,ナサニエル・アーチボルトはドラフト何巡目で指名された？,japanese,content,2.1666666666666665,2.0,0,2.0,0.46153846153846156,14,0.0,1.0
2465,パワーステアリングはいつ開発された？,japanese,content,1.8333333333333333,2.0,0,2.0,0.2857142857142857,8,0.0,1.0
2466,ポーランド・リトアニア・ドイツ騎士団戦争の勝者は？,japanese,content,3.2,2.0,0,0,0.6363636363636364,12,0,0.0
2467,フィルターバブルという現象が問題提起され始めたのはいつ ジョン・ローレンス・シーゲンソーラーが初めて出版した本は何？,japanese,content,3.037037037037037,7.0,2.0,2.0,0.4642857142857143,29,100.0,4.0
2468,進化心理学はどこで発症した 大陸海軍はいくつの戦艦を有した？,japanese,content,2.588235294117647,4.0,1.0,2.0,0.4444444444444444,19,50.0,2.0
2469,ヘルツェブロック＝クラールホルツ の面積は？,japanese,content,1.6666666666666667,2.0,0,0,0.7142857142857143,8,0,0.0
2470,ムーアを舞台とした『嵐が丘』と書いた作家は誰ですか？,japanese,content,2.0,4.0,1.0,1.5,0.4,17,66.66666666666667,3.0
2471,戦闘機を初めて開発した国はどこ 落語はいつ生まれた コーラ・パールに子どもはいる？,japanese,content,2.7142857142857144,4.0,1.0,2.3333333333333335,0.5,23,66.66666666666667,3.0
2472,日本語をキーボードで入力する際、かなうちとアルファベット打ちでは理論上どちらの方がタイピングスピードが速くなる？,japanese,content,2.8333333333333335,4.0,1.0,3.5,0.64,27,50.0,2.0
2473,日本において、試用期間に給料は発生する？,japanese,content,2.4,3.0,1.0,1.5,0.5454545454545454,13,50.0,2.0
2474,緑のうんちが出たときは病気？,japanese,content,1.5,5.0,1.0,1.0,0.5555555555555556,10,100.0,1.0
2475,上杉謙信の墓はどこにある？,japanese,content,1.7142857142857142,3.0,0,2.0,0.5,9,0.0,1.0
2476,キナの発祥はどこ サー・エドモンド・バートンは何歳で首相になった？,japanese,content,3.0,3.0,0,4.0,0.4444444444444444,19,0.0,1.0
2477,トリプルHの伸長は？,japanese,content,1.25,2.0,0,0,0.6,6,0,0.0
2478,アルキル置換ビアリールホスフィン配位子を発見したのは誰 コソボはどこの地域にある？,japanese,content,2.8421052631578947,3.0,1.0,3.0,0.5,21,50.0,2.0
2479,自動車用シートベルトが初めて用いられたのはいつですか？,japanese,content,2.357142857142857,3.0,1.0,4.0,0.4666666666666667,16,50.0,2.0
2480,サラブレッドとはどのような馬ですか？,japanese,content,2.0,2.0,1.0,0,0.3333333333333333,10,50.0,2.0
2481,2012年のロンドン・オリンピックの選手宿舎はどのようにリサイクル利用されていますか？,japanese,content,2.25,4.0,1.0,1.6666666666666667,0.42857142857142855,22,75.0,4.0
2482,国鉄119系電車の大きさは？,japanese,content,1.7142857142857142,2.0,0,0,0.5,9,0,0.0
2483,そうりゅう型潜水艦は戦闘でしようされたことはある？,japanese,content,2.076923076923077,2.0,1.0,1.5,0.5714285714285714,15,50.0,2.0
2484,ゲオルギオスの出身はどこ？,japanese,content,1.5,3.0,0,0,0.4,6,0,0.0
2485,ポロツク公国での最大宗教は何だった？,japanese,content,1.6666666666666667,3.0,0,0,0.4,11,0.0,1.0
2486,スタックマシンが開発されたのはいつ 金栗 四三のマラソンの最速記録は？,japanese,content,2.764705882352941,3.0,1.0,3.0,0.4444444444444444,19,100.0,1.0
2487,電気椅子を死刑に初めて用いた国はどこ エイブラハム・リンカーンを殺したのは誰ですか？,japanese,content,2.142857142857143,5.0,1.0,3.5,0.4090909090909091,23,66.66666666666667,3.0
2488,ジャック・デリダの出身はどこ 『新世紀エヴァンゲリオン』の監督は誰？,japanese,content,2.7142857142857144,3.0,0,0,0.5333333333333333,18,0,0.0
2489,ベリャーエフ・サークルの結成当初のメンバー数は？,japanese,content,1.8888888888888888,2.0,0,0,0.6,11,0,0.0
2490,ガンダムシリーズの原作者はだれ ヴァンダル族の最盛期の面積は？,japanese,content,2.0,3.0,0,0,0.6,16,0,0.0
2491,糖尿病性神経障害は完治する？,japanese,content,1.6666666666666667,2.0,0,1.0,0.7142857142857143,8,0.0,1.0
2492,オゾン層の破壊はなぜ引き起こされる コロラド州にはいくつ市町村がある？,japanese,content,2.1666666666666665,5.0,1.0,2.0,0.631578947368421,20,50.0,2.0
2493,日本にはいつから電車が走っている？,japanese,content,2.2222222222222223,2.0,1.0,2.0,0.4,11,50.0,2.0
2494,マルシア・ハイデ・サラベリー・ペレイラ・ダ・シウヴァは何年にバレリーナとしてデビューしましたか？,japanese,content,3.9565217391304346,3.0,0,4.0,0.375,25,0.0,1.0
2495,ウィスコンシン州の最大宗教は何？,japanese,content,1.5,3.0,0,0,0.5714285714285714,8,0,0.0
2496,南海鉄道はいつ設立した？,japanese,content,1.5,2.0,0,2.0,0.42857142857142855,8,0.0,1.0
2497,行動生態学の先駆者は誰？,japanese,content,1.5714285714285714,3.0,0,0,0.625,9,0,0.0
2498,『ユリシーズ』のジャンルは何？,japanese,content,2.0,3.0,0,0,0.4,8,0,0.0
2499,『ザ・ホワイトハウス』の主人公を演じる俳優は誰ですか？,japanese,content,1.7692307692307692,5.0,1.0,1.0,0.5,17,50.0,2.0
2500,ハンガリー王国の公用語は何だった リンパの働きはなんですか？,japanese,content,2.2,3.0,1.0,0,0.375,17,50.0,2.0
2501,中国人民解放軍華北野戦軍はいつ結成した 綿繰り機が初めて日本に導入されたのはいつ 杉田 祐一はいつ生まれた？,japanese,content,2.9285714285714284,4.0,1.0,3.6666666666666665,0.4827586206896552,30,66.66666666666667,3.0
2502,ジェイムズ・ジョイスのデビュー作は何？,japanese,content,1.5714285714285714,3.0,0,0,0.5,9,0,0.0
2503,ロドニー・ハリソンの出身高校はどこ？,japanese,content,1.5714285714285714,3.0,0,0,0.5,9,0,0.0
2504,三菱自動車はいつ設立された？,japanese,content,1.75,2.0,0,2.0,0.4444444444444444,10,0.0,1.0
2505,火山学の先駆者は誰 ステファノ・マガディーノは何歳で死去した？,japanese,content,2.3333333333333335,3.0,0,3.0,0.4375,17,0.0,1.0
2506,コロラド州最初の知事はだれ ウィルクスバリは海に面している？,japanese,content,2.230769230769231,3.0,1.0,2.5,0.6428571428571429,15,50.0,2.0
2507,東京臨海高速鉄道70-000形電車が初めて運用されたのはいつ モリー・マグワイアズはなぜ結成された？,japanese,content,3.3846153846153846,3.0,1.0,4.0,0.4444444444444444,28,50.0,2.0
2508,古代マケドニア王国は何年に成立しましたか？,japanese,content,2.090909090909091,2.0,0,3.0,0.4166666666666667,13,0.0,1.0
2509,北川 民次は何歳で日本に帰国した？,japanese,content,2.090909090909091,2.0,0,3.0,0.5,13,0.0,1.0
2510,チャールズ・ディケンズの出身はどこ オグロメジロザメが日本で確認されたんことはある？,japanese,content,2.2777777777777777,3.0,1.0,2.5,0.42105263157894735,20,50.0,2.0
2511,スタテンアイランドトンネルは何らかの形で利用されていますか？,japanese,content,2.5,3.0,1.0,2.0,0.4117647058823529,18,50.0,2.0
2512,モーリツ・モシュコフスキはいつ生まれた アルコールの沸点は何度？,japanese,content,2.1666666666666665,4.0,1.0,1.0,0.46153846153846156,14,100.0,1.0
2513,アレクセイ・フォン・ヤウレンスキーの父の出身は？,japanese,content,1.8888888888888888,3.0,0,0,0.5,11,0,0.0
2514,特別支援学校は通常、何年制？ 冉 閔は何歳で死んだ？,japanese,content,3.533333333333333,2.0,0,5.0,0.625,19,0.0,1.0
2515,オーストリアの首都はどこですか？,japanese,content,1.5,3.0,0,0,0.2857142857142857,8,0.0,1.0
2516,ウサーマ・ビン・ムハンマド・ビン・アワド・ビン・ラーディンはどのように亡くなりましたか？,japanese,content,4.7,2.0,1.0,3.0,0.42857142857142855,22,50.0,2.0
2517,ギュルハネ勅令の内容は何？,japanese,content,1.4,3.0,0,0,0.5,7,0,0.0
2518,阪急90形電車はいつできましたか？,japanese,content,2.3,2.0,0,0,0.36363636363636365,12,0,0.0
2519,地下鉄サリン事件における被害者数は何人？,japanese,content,2.0,4.0,1.0,0.0,0.75,13,100.0,1.0
2520,ウィリアム・アイザック・トマスの出身はどこ モジュライ空間を発見したのは誰 インヴィンシブル級航空母艦はいつ完成した フォルクスワーゲン・ザ・ビートルはなぜ生産終了した？,japanese,content,3.611111111111111,3.0,1.0,2.75,0.4864864864864865,38,75.0,4.0
2521,カムコーダの販売はいつ始まった 合理的選択理論はいつ誕生した？,japanese,content,2.5,3.0,1.0,2.0,0.47058823529411764,18,50.0,2.0
2522,古生代シルル紀niha 駆逐艦オバノンの大きさは？,japanese,content,2.7,2.0,0,0,0.7272727272727273,12,0,0.0
2523,地中海は一年中温暖？,japanese,content,2.1666666666666665,2.0,0,0,0.7142857142857143,8,0,0.0
2524,オスマン帝国の首都はどこでしたか？,japanese,content,1.625,3.0,0,0,0.3333333333333333,10,0.0,1.0
2525,気動車が初めて開発されたのはいつ 軟水と硬水の違いはなんですか？,japanese,content,2.3157894736842106,4.0,1.0,4.0,0.4,21,50.0,2.0
2526,旧横須賀鎮守府庁舎の跡地には現在何がある？,japanese,content,2.3333333333333335,3.0,0,3.0,0.6153846153846154,14,0.0,1.0
2527,バレエの発祥はどこ 絵画遠近法が発見されたのはいつですか？,japanese,content,2.9411764705882355,3.0,1.0,3.0,0.3333333333333333,19,50.0,2.0
2528,りすぼん丸の最大搭乗員数は？,japanese,content,2.0,2.0,0,0,0.75,9,0,0.0
2529,ユリウス暦の起源はいつ 南米大陸で一番大きい都市はどこですか？,japanese,content,2.2,3.0,0,0,0.5,17,0.0,1.0
2530,ジャック・ヒギンズのデビュー作はなんですか？,japanese,content,1.5555555555555556,3.0,0,0,0.4,11,0.0,1.0
2531,ジャック・ロマン・ジョルジュ・ブレルの最終的な国籍は何？,japanese,content,2.769230769230769,3.0,1.0,0,0.42857142857142855,15,100.0,1.0
2532,ドイツ帝国最高法院はいつまでありましたか？,japanese,content,1.8888888888888888,2.0,0,2.0,0.5,11,0.0,1.0
2533,ジョーン・フォンテインの両親はなぜ日本にいた？,japanese,content,1.9,3.0,0,3.0,0.5454545454545454,12,0.0,1.0
2534,戸次 鑑連の出身階級は？,japanese,content,1.4,2.0,0,0,0.6666666666666666,7,0,0.0
2535,ゲフィチニブの副作用は何？,japanese,content,1.6,3.0,0,0,0.5,7,0,0.0
2536,スペイン・バスク州の州都はどこですか？,japanese,content,1.6666666666666667,3.0,0,0,0.4,11,0.0,1.0
2537,オルガノイドは実際に医療の現場で導入された？,japanese,content,2.5454545454545454,3.0,0,3.0,0.4166666666666667,13,0.0,1.0
2538,スーパーボウルで一番試合時間が長かった時間は？,japanese,content,2.0,3.0,0,0,0.6363636363636364,12,0,0.0
2539,『悪魔のロベール』が完成したのはいつ ミュンヘン会談に出席したチェコスロバキア側の代表は誰ですか？,japanese,content,2.608695652173913,5.0,1.0,2.5,0.375,27,66.66666666666667,3.0
2540,アルバート・ジョンストン将軍はどこで生まれましたか？,japanese,content,1.8888888888888888,2.0,0,2.0,0.4,11,0.0,1.0
2541,オスマン帝国が興隆した最大要因は何 世界最大のディストリクトはどこ 赤外線銀河を発見したのは誰？ NC工作機械はいつ開発された 月の地表の温度は何度 インディアナポリス・モーター・スピードウェイの面積は何平方キロメートルですか？ 『ポケットモンスター』のピカチューの声優はだれですか？,japanese,content,3.1343283582089554,8.0,1.0,2.3333333333333335,0.4852941176470588,73,100.0,4.0
2542,アンセル・アダムスの出身はどこ？,japanese,content,1.5,3.0,0,0,0.42857142857142855,8,0,0.0
2543,毛皮のコートで一番単価が高い動物のファーは何ですか？,japanese,content,2.142857142857143,5.0,0,0,0.4666666666666667,16,0.0,1.0
2544,日本には競馬場はいくつありますか？,japanese,content,2.2,2.0,0,4.0,0.45454545454545453,12,0.0,1.0
2545,ジャガイモシストセンチュウに対する防虫剤はある？,japanese,content,1.6666666666666667,4.0,1.0,0.5,0.7142857142857143,8,50.0,2.0
2546,VRAMを開発したのは誰 違星 北斗はいつ生まれた？,japanese,content,2.5384615384615383,3.0,1.0,3.5,0.5,15,50.0,2.0
2547,川越城の高さは？,japanese,content,1.5,2.0,0,0,0.4,6,0,0.0
2548,江原道高城郡兵長銃乱射事件で使われた銃は何？ 『ポケモン・ゴー』は何年に日本で発売されましたか？,japanese,content,3.2666666666666666,5.0,1.0,3.5,0.4838709677419355,34,50.0,2.0
2549,ウトロ地区の面積は？,japanese,content,1.25,2.0,0,0,0.6,6,0,0.0
2550,ページング方式を作ったのは誰 西鉄バスジャック事件の犯人の犯行動機は何だった 岸信介は第何代の首相ですか？,japanese,content,2.9310344827586206,4.0,1.0,3.0,0.4666666666666667,31,66.66666666666667,3.0
2551,ベクトル計算機を開発したのは誰？,japanese,content,2.3333333333333335,3.0,1.0,3.0,0.4,11,100.0,1.0
2552,ニューエイジはどこで発症した？,japanese,content,1.8333333333333333,2.0,0,2.0,0.2857142857142857,8,0.0,1.0
2553,有珠山に登ることは可能？ Engadgetの購読は無料？,japanese,content,1.8181818181818181,5.0,1.0,1.0,0.6666666666666666,14,100.0,1.0
2554,『ゲゲゲの鬼太郎』は、何年に創刊されましたか？,japanese,content,2.5833333333333335,3.0,0,3.0,0.3076923076923077,17,0.0,1.0
2555,イスパノアメリカ独立戦争の勝者は？,japanese,content,1.6666666666666667,2.0,0,0,0.7142857142857143,8,0,0.0
2556,バグラチオン作戦の指揮者は誰？,japanese,content,1.5,3.0,0,0,0.5714285714285714,8,0,0.0
2557,ギュータースローで一番高い山は？,japanese,content,1.3333333333333333,3.0,0,0,0.7142857142857143,8,0,0.0
2558,埼玉西武ライオンズはいつ設立した？,japanese,content,1.5714285714285714,2.0,0,2.0,0.5,9,0.0,1.0
2559,ハッテラス入り江砲台の戦いで北軍を率いたのは誰 燃える人の舞踏会の会場はどこでしたか？,japanese,content,2.423076923076923,5.0,1.0,3.0,0.48148148148148145,28,66.66666666666667,3.0
2560,米米CLUBのリーダーはだれ システィーナ礼拝堂が建設されたのはいつ 台湾人は中国発行のパスポートを取得する必要はない？,japanese,content,3.9655172413793105,5.0,1.0,2.5,0.5333333333333333,31,100.0,2.0
2561,2018年まで任天堂が販売しているゲーム機が何種類ありますか？,japanese,content,1.8235294117647058,4.0,1.0,2.0,0.5,19,66.66666666666667,3.0
2562,米国でグレーマーケットで一番流通が多い商品はなんですか？,japanese,content,2.230769230769231,4.0,0,0,0.5,15,0.0,1.0
2563,ニシュの主要産業は何？,japanese,content,1.6,3.0,0,0,0.5,7,0,0.0
2564,ロータス・カーズの創始者は誰？,japanese,content,1.5714285714285714,3.0,0,0,0.5,9,0,0.0
2565,リタリンの運動亢進作用の強度が一番強いのは何 劇作家ボーマルシェが最後に書いた作品は？,japanese,content,2.227272727272727,5.0,1.0,2.0,0.5652173913043478,24,100.0,1.0
2566,レース「ＣＡＲＴ］はいつから開催され始めた 起動輪を発明したのは誰？,japanese,content,3.5555555555555554,5.0,1.5,1.6666666666666667,0.3684210526315789,22,100.0,3.0
2567,3dfx Interactiveの創始者は誰？,japanese,content,1.5,3.0,0,0,0.5714285714285714,8,0,0.0
2568,キース・リチャーズはいつ生まれましたか？,japanese,content,1.75,2.0,0,3.0,0.3333333333333333,10,0.0,1.0
2569,篠塚 和典が最初に所属した球団はどこ バッドアート美術館 の入場料はいくら？,japanese,content,2.3684210526315788,4.0,1.0,2.0,0.6,21,100.0,1.0
2570,イギリスとヨーロッパ大陸での哲学の最大の違いは何？,japanese,content,1.8333333333333333,5.0,0,0,0.46153846153846156,14,0,0.0
2571,関西学院大学の宗教は何？,japanese,content,1.5,3.0,0,0,0.5714285714285714,8,0,0.0
2572,チャールズ・ラトウィッジ・ドジソンは何歳で死去した？,japanese,content,2.090909090909091,2.0,0,2.0,0.4166666666666667,13,0.0,1.0
