unique_id,text,language,avg_links_len,avg_subordinate_chain_len,avg_verb_edges,lexical_density,n_tokens,question_type,complexity_score
arabic_polar_421,هل الكحولية من أعراض متلازمة فيرنيك-كورساكوف ؟,ar,-0.291,0.0,0.0,0.429,2.303,1,2.441
arabic_polar_2064,هل كارل ماركس هو مؤسس الاشتراكية ؟,ar,0.375,0.0,0.0,0.333,2.079,1,2.787
finnish_polar_158,Voiko ukkosen ilma aiheuttaa päänsärkyä?,fi,-0.293,0.0,0.333,0.8,1.946,1,2.786
finnish_polar_0,Tarvitaanko neutroneja radioaktiivisten aineiden valmistamiseen?,fi,-0.043,0.0,0.333,1.0,1.946,1,3.236
arabic_content_5831,ما نظام الحكم في السويد ؟,ar,0.151,0.0,0.0,0.4,1.946,0,2.497
indonesian_content_6987,Kapan Kazimierz II lahir?,id,0.364,0.0,0.333,0.75,1.792,0,3.239
english_polar_191,Is Jor-El Superman's dad?,en,1.98,0.0,0.0,0.667,2.197,1,4.844
finnish_polar_1800,Onko Suomen presidentti puollustusvoimien päällikkö?,fi,0.207,0.0,0.0,0.8,1.946,1,2.953
finnish_content_4098,Kuinka ramansirontaa käytetään molekyylien tutkimiseen?,fi,-0.256,0.0,0.5,1.0,1.946,0,3.19
japanese_content_4080,コペルニクス的転回という言葉を作ったのは誰？,ja,0.307,1.0,0.25,0.417,2.639,0,4.613
arabic_content_7264,متى تم إبتكار الحاسوب المحمول ؟,ar,-0.349,0.0,0.333,0.8,1.946,0,2.73
arabic_polar_1611,هل تعد النسور من الكائنات المهددة بالانقراض؟,ar,-0.291,0.0,0.5,0.429,2.197,1,2.835
korean_polar_354,구이도 3세는 샤를마뉴의 먼 후손인가요?,ko,-0.33,0.0,0.75,0.8,1.946,1,3.166
russian_content_8372,Когда Дарвин выдвинул свою теорию происхождения человека?,ru,-0.244,0.0,0.5,0.857,2.197,0,3.31
korean_polar_74,용은 십이지 중 다섯 번째 동물이자 유일한 상상의 동물인가요?,ko,0.42,0.0,0.375,0.778,2.398,1,3.971
korean_content_3225,세상에서 가장 규모가 큰 연구소는 무엇인가?,ko,0.127,0.0,0.2,1.0,2.079,0,3.406
english_content_2912,Who decided the borders of countries in the Middle East?,en,-0.259,0.0,0.333,0.5,2.485,0,3.059
russian_content_2354,Когда был порстроен фуникулер в Тбилисси?,ru,0.022,0.0,0.667,0.667,2.079,0,3.435
finnish_content_12842,Mikä on Oulun asutuin kaupunginosa?,fi,-0.006,0.0,0.0,0.6,1.946,0,2.54
indonesian_polar_225,apakah bahasa Yunani adalah bahasa tertua di dunia?,id,0.209,0.0,0.0,0.667,2.398,1,3.274
russian_content_6676,Как назывался административный центр Забайка́льской о́бласти?,ru,-0.178,0.0,0.333,1.0,2.079,0,3.234
english_polar_588,Is emotional IQ the same as regular IQ?,en,-0.02,0.0,0.0,0.625,2.303,1,2.908
indonesian_content_5114,Kapan Guglielmo I lahir?,id,0.364,0.0,0.333,0.75,1.792,0,3.239
indonesian_polar_330,apakah Uni Soviet mengikuti perang dunia II?,id,-0.219,0.0,0.75,0.75,2.303,1,3.584
korean_content_7246,미이라를 처음 시작한 나라는 어디인가?,ko,-0.223,1.0,0.3,1.0,1.946,0,4.023
indonesian_content_8797,kapankah Kristen masuk di Indonesia?,id,-0.036,0.0,0.5,0.667,2.079,0,3.21
japanese_polar_1094,『ザ・シンプソンズ』は子供向けアニメ？,ja,0.218,0.0,0.0,0.714,2.398,1,3.33
japanese_content_831,オーストリア継承戦争が起きたきっかけは何,ja,-0.465,1.0,0.167,0.556,2.303,0,3.561
finnish_content_10686,Miten leinikkikasvi määritellään?,fi,-0.256,0.0,0.333,1.0,1.609,0,2.686
arabic_polar_1189,هل إستقت مليلة من حكم إسبانيا؟,ar,-0.225,0.0,0.333,0.5,2.079,1,2.687
finnish_polar_794,Onko venäläisellä kulttuurissa jälkiä butovon kulttuurista?,fi,-0.393,0.0,0.0,0.833,2.079,1,2.519
finnish_content_9987,Mikä on Amerikoiden korkein vuori?,fi,-0.006,0.0,0.0,0.6,1.946,0,2.54
japanese_content_1737,宮内省が設立されたのはいつ,ja,0.812,1.0,0.5,0.3,2.398,0,5.01
english_content_8853,Where does the Atlantic Ocean begin and end?,en,0.138,0.0,0.333,0.625,2.303,0,3.399
arabic_content_6366,متي ولدة أنغيلا دوروتيا ميركل ؟,ar,0.151,0.0,0.0,0.2,1.946,0,2.297
finnish_content_14331,Salatut elämät sarjaa?,fi,-0.756,0.0,0.167,1.0,1.609,0,2.02
arabic_content_5407,ما آخر مؤلفات باروخ سبينوزا ؟,ar,-0.099,0.0,0.0,0.4,1.946,0,2.247
arabic_polar_1821,هل تدخلت المملكة السعودية في الأزمة السورية ؟,ar,-0.125,0.0,0.333,0.714,2.197,1,3.119
korean_polar_162,다운 증후군은 유전병인가?,ko,-1.08,0.0,0.25,1.0,1.609,1,1.779
arabic_content_1489,من هو كلاشنكوف ؟,ar,0.151,0.0,0.0,0.0,1.609,0,1.76
russian_polar_277,Изначально компьютерная игра была популярна среди населения?,ru,-0.088,0.0,0.0,0.714,2.197,1,2.823
korean_content_2,로마 가톨릭교회 초대 추기경은 누구인가?,ko,-0.223,0.0,0.2,1.0,1.946,0,2.923
japanese_content_1716,ポーランドにマルクス思想が伝来したのはいつ,ja,0.59,1.0,0.667,0.3,2.398,0,4.955
russian_content_8610,В каком году произошел запуск «Аполло́н-17»?,ru,-0.078,0.0,0.333,0.571,2.485,0,3.311
indonesian_content_3090,Apa yang dimaksud dengan nama Kakawin?,id,-0.236,1.0,0.333,0.5,2.079,0,3.676
arabic_polar_907,هل يوجد الرخام في اليمن؟,ar,-0.125,0.0,0.5,0.6,1.946,1,2.921
finnish_content_3677,Milloin Nuorsuomalaiset ryhmittyivät itsenäiseksi puolueeksi?,fi,-0.256,0.0,0.5,1.0,1.946,0,3.19
arabic_polar_1495,هل يتكلم سكان مِيُونِخ أو مِيُونيخ اللغة الألمانية الفصحى؟,ar,0.125,0.0,0.333,0.667,2.398,1,3.523
finnish_content_12030,Milloin Nintendo Wii julkaistiin?,fi,0.244,0.0,0.333,1.0,1.792,0,3.369
russian_content_9940,Когда родилась Рины Зелёная?,ru,-0.578,0.0,0.333,1.0,1.792,0,2.547
english_polar_202,Can you die from an ulcer?,en,-0.22,0.0,0.4,0.333,2.079,1,2.592
indonesian_content_4579,Mengapa ajaran Setanisme menolak tuhan?,id,0.114,0.0,0.5,1.0,1.946,0,3.56
russian_content_8816,Когда был построен Карлов мост в Праге?,ru,-0.078,0.0,0.5,0.714,2.197,0,3.333
japanese_polar_1140,日本には歴史上、山賊はいますか？,ja,0.495,0.0,0.8,0.5,2.565,1,4.36
japanese_content_76,アルコール中毒が初めて診断されたのはいつ？,ja,0.671,1.0,0.667,0.417,2.639,0,5.394
english_content_8150,Who was costume designer for the first Star Wars movie?,en,0.741,0.0,0.0,0.6,2.485,0,3.826
korean_content_3118,이경규는 언제 데뷔했는가?,ko,0.027,0.0,0.4,1.0,1.609,0,3.036
russian_content_590,Кто был основателем Великого княжества Литовского?,ru,-0.178,0.0,0.0,0.667,2.079,0,2.568
russian_content_8526,Что такое знаки отличия в российской армии?,ru,0.256,0.0,0.0,0.571,2.197,0,3.024
english_polar_949,Did the CoRot space find anything?,en,-0.22,0.0,0.4,0.5,2.079,1,2.759
russian_polar_485,Поставлялись советские самолеты в Сирию в годы СССР?,ru,0.364,0.0,0.6,0.75,2.303,1,4.017
indonesian_content_5965,meneliti apakah percobaan Stern-Gerlach?,id,0.114,0.0,0.167,0.8,1.946,0,3.027
indonesian_content_6231,Berapakah jumlah surah dalam al-Qur'an?,id,-0.136,0.0,0.0,0.714,2.197,0,2.775
english_polar_536,Do Puerto Ricans have US citizenship?,en,-0.22,0.0,0.4,0.833,2.079,1,3.092
japanese_content_4079,ハッシュ関数を発見したのは誰？,ja,0.41,1.0,0.5,0.333,2.398,0,4.641
indonesian_content_5701,Kapan industri film muncul pertama kali ?,id,0.164,0.0,0.5,1.0,2.079,0,3.743
finnish_polar_1590,Onko Darren Shanin naimisissa?,fi,0.207,0.0,0.0,0.75,1.792,1,2.749
japanese_content_6630,マイクロカプセル化を初めて試みたのは誰,ja,0.035,1.0,0.667,0.444,2.303,0,4.449
arabic_content_14106,ما هي الميتافيزيقا؟,ar,0.151,0.0,0.0,0.0,1.609,0,1.76
indonesian_polar_107,Apakah K'tut Tantri seorang penulis buku?,id,0.352,0.0,0.0,0.75,2.398,1,3.5
english_polar_498,Did Dimetrodon have feathers?,en,-0.687,0.0,0.4,0.75,1.792,1,2.255
japanese_polar_1126,ロンドンに時計台はある？,ja,0.051,0.0,0.4,0.667,2.079,1,3.197
finnish_content_1913,Mistä Randall Flaggin nimi tulee?,fi,0.244,0.0,0.333,0.8,1.946,0,3.323
russian_content_9250,В каком году закончился первый период Би́твы за Москву́?,ru,-0.203,0.0,0.333,0.667,2.398,0,3.195
finnish_content_12956,Kuka perusti stoalaisuuden?,fi,-0.756,0.0,0.333,0.667,1.609,0,1.853
japanese_polar_391,『スター・ウォーズ』のジャバ・ザ・ハットは話すことが出来る？,ja,0.282,0.0,0.4,0.5,2.89,1,4.072
finnish_content_12914,Minä vuonna William Henry Fox Talbot on syntynyt?,fi,1.815,0.0,0.5,0.75,2.303,0,5.368
english_content_5775,In what book of the Bible does the story of David and Goliath happen?,en,0.852,0.0,0.333,0.429,2.773,0,4.387
finnish_polar_1824,Elääkö Suomen vesistöissä kaskelotteja?,fi,0.207,0.0,0.333,1.0,1.792,1,3.332
finnish_content_2027,Kuka kehitti Deadpool hahmon?,fi,-0.423,0.0,0.333,0.75,1.792,0,2.452
japanese_content_3081,ウクライナの国技は何？,ja,-0.465,0.0,0.0,0.4,1.946,0,1.881
finnish_content_8647,Milloin alkuperäinen Diesneyland perustettiin?,fi,-0.09,0.0,0.333,1.0,1.792,0,3.035
korean_content_219,야구를 처음 시작한 나라는 어디인가?,ko,-0.223,1.0,0.3,1.0,1.946,0,4.023
english_polar_391,Is there a dragon dance?,en,-0.02,0.0,0.4,0.6,1.946,1,2.926
japanese_content_35,ノヴィ・ベオグラードの主要産業は何？,ja,-0.394,0.0,0.0,0.5,2.303,0,2.409
english_content_7903,What country was the Pecheng army from?,en,0.185,0.0,0.0,0.429,2.197,0,2.811
english_polar_552,Is Hepatitis contagious?,en,-0.52,0.0,0.0,0.667,1.609,1,1.756
english_polar_336,Can you opt to not have your male baby circumcised?,en,0.091,2.0,0.4,0.5,2.485,1,5.476
finnish_content_742,Kuinka monessa maassa WWF toimii?,fi,0.244,0.0,0.5,0.8,1.946,0,3.49
russian_polar_24,Когда умер Ли Ха́рви О́свальд?,ru,-0.672,0.0,0.6,0.8,1.946,1,2.674
english_content_2119,How many indigenous people's are in Mexico?,en,-0.434,0.0,0.0,0.625,2.303,0,2.494
english_content_5675,How old is the Hindi language?,en,-0.348,0.0,0.0,0.667,2.079,0,2.398
korean_content_10742,북극성은 언제 처음 관측되었는가?,ko,0.527,0.0,0.4,1.0,1.792,0,3.719
english_polar_869,Do they speak Cantonese in Hong Kong?,en,-0.52,0.0,0.6,0.571,2.197,1,2.848
finnish_content_14192,Mikä oli Moskovan asukasluku vuonna 2018?,fi,0.244,0.0,0.0,0.5,2.079,0,2.823
arabic_polar_58,هل يتم استخدام الطاقة النووية في الامارات؟,ar,-0.125,0.0,0.167,0.714,2.197,1,2.953
arabic_polar_1820,هل يمكن استخدام البروفين كخافض للحرارة ؟,ar,-0.425,0.0,0.167,0.667,2.079,1,2.488
indonesian_content_976,kapankah Amalric meninggal?,id,0.03,0.0,0.333,0.75,1.792,0,2.905
finnish_content_9150,Mikä seura varasi Ludvig Rensfeldtin toisella kierroksella 35. pelaajana NHL:n varaustilaisuudessa 2010?,fi,0.789,0.0,0.667,0.833,2.639,0,4.928
indonesian_content_3985,berapakah episode dari anime Naruto?,id,-0.236,0.0,0.0,0.667,2.079,0,2.51
english_polar_250,Did more people died in ww1 or ww2?,en,-0.449,0.0,0.4,0.5,2.303,1,2.754
arabic_content_18772,كم يبلغ تعداد السكان اليهود في ألمانيا ؟,ar,0.317,0.0,0.5,0.571,2.197,0,3.585
finnish_polar_1709,Harjoittiko Joseph Smith moniavioisuutta Nauvoossa?,fi,-0.293,0.0,0.333,1.0,1.946,1,2.986
japanese_content_4698,ブリティッシュ・コロンビア州の州都はどこ,ja,-0.251,0.0,0.0,0.5,2.197,0,2.446
indonesian_content_6579,kapankah RPG diciptakan?,id,0.03,0.0,0.333,0.75,1.792,0,2.905
indonesian_content_3410,Siapa yang menciptakan Giroskop?,id,-0.303,1.0,0.333,0.5,1.792,0,3.322
japanese_content_6326,マサチューセッツ州の州都はどこ？,ja,-0.565,0.0,0.0,0.5,2.079,0,2.014
korean_polar_123,가톨릭교회의 지도는 성품성사를 받은 성직자들이 맡고 있나요?,ko,-0.58,1.0,0.375,0.857,2.197,1,3.849
english_polar_382,Was William O'Brien married?,en,-0.02,0.0,0.2,0.75,1.792,1,2.722
japanese_content_107,斎藤佑樹投手の出身校はどこ？,ja,-0.215,0.0,0.0,0.667,2.398,0,2.85
korean_content_10469,2018년 세상에서 가장 많은 태풍이 활동했던 나라는 어디인가?,ko,0.527,1.0,0.4,1.0,2.303,0,5.23
japanese_content_5611,新潟県で一番人口の少ない村は何,ja,0.035,0.0,0.0,0.6,2.398,0,3.033
english_polar_1071,"Does Danielle ""Dani"" Cage's have a super power?",en,1.23,0.0,0.6,0.667,2.565,1,5.062
indonesian_polar_35,Apakah Najelaa Shihab seorang dosen?,id,-0.191,0.0,0.0,0.667,2.079,1,2.555
english_polar_811,Have the Los Angeles Rams won a Super Bowl?,en,0.23,0.0,0.4,0.667,2.398,1,3.695
japanese_polar_550,ドイツにユダヤ人の血を引く首相が誕生したことはある？,ja,-0.082,1.0,0.267,0.562,2.89,1,4.637
english_content_8265,What is the largest rail yard in the New York City Subway system?,en,0.769,0.0,0.0,0.615,2.708,0,4.092
finnish_polar_2071,Onko Leipzigissä vanhaa kaupunkia?,fi,-0.46,0.0,0.0,0.75,1.792,1,2.082
finnish_content_5990,Mitkä olivat Ap Bacin tappiot?,fi,0.244,0.0,0.0,0.6,1.946,0,2.79
japanese_content_3177,マーベル・コミックのジュビリーの職業は何,ja,-0.465,0.0,0.0,0.444,2.303,0,2.282
russian_polar_1560,Исаак II Ангел был ослеплён?,ru,0.078,0.0,0.4,0.8,1.946,1,3.224
indonesian_polar_197,Apa nama candi terbesar di Indonesia?,id,-0.391,0.0,0.0,0.667,2.079,1,2.355
arabic_content_17574,متى تأسس فرع إدارة الغذاء والدواء في الولايات المتحدة ؟,ar,0.429,0.0,0.5,0.7,2.485,0,4.114
finnish_polar_1257,Elääkö enemmistö Yhdysvaltojen intiaaneista reservaateissa?,fi,0.207,0.0,0.333,1.0,1.946,1,3.486
japanese_polar_372,オンダンセトロンに副作用はある？,ja,0.051,0.0,0.4,0.667,2.079,1,3.197
english_content_5284,How far away is the North Star?,en,-0.481,0.0,0.0,0.714,2.197,0,2.43
english_polar_458,Is Mardi Gras a holiday?,en,0.23,0.0,0.0,0.6,1.946,1,2.776
finnish_content_13751,Mitä Jehovan todistajat korostavat uskonnossaan?,fi,-0.256,0.0,0.5,0.8,1.946,0,2.99
arabic_polar_977,هل يعتبر تخلخل العظام داء تنكسي؟,ar,-0.225,0.0,0.5,0.5,2.079,1,2.854
english_polar_674,Is there a major mountain range that goes through Chile?,en,-0.02,1.0,0.4,0.6,2.485,1,4.465
english_polar_134,Is Guam a US territory?,en,0.48,0.0,0.0,0.6,1.946,1,3.026
russian_polar_392,Участвовали ли большие противолодочные корабли проекта 1134-Б во Второй мировой войне?,ru,0.805,0.0,0.6,0.75,2.708,1,4.863
arabic_content_9734,متى تأسس الاتحاد الدولي للشطرنج؟,ar,0.051,0.0,0.333,0.667,2.079,0,3.13
indonesian_content_3218,Berapa luas Nigeria?,id,-0.636,0.0,0.0,1.0,1.609,0,1.973
english_polar_1122,Is the great horned owl endangered?,en,0.38,0.0,0.0,0.667,2.079,1,3.126
japanese_content_6407,バリー・ボイトが初めて訪れた火山は何,ja,-0.41,1.0,0.333,0.5,2.398,0,3.821
indonesian_content_5854,dimanakah letak Bioskop terbesar di Indoensia?,id,0.197,0.0,0.0,0.571,2.197,0,2.965
indonesian_polar_402,Apakah Perhimpunan Anak adalah nama sebuah organisasi ?,id,0.209,0.0,0.0,0.625,2.303,1,3.137
japanese_polar_136,エアロパーツ はロケットに使われる？,ja,-0.149,0.0,0.4,0.5,2.079,1,2.83
russian_content_10187,Что послужило причиной боев на Халхин-Голе в 1939 году?,ru,0.422,0.0,0.333,0.7,2.485,0,3.94
arabic_polar_149,هل يعد مرض الزهري من الأمراض المنقولة جنسياً؟,ar,-0.196,0.0,0.5,0.625,2.303,1,3.232
japanese_content_3308,セイコーエプソン社の創始者は誰,ja,-0.394,0.0,0.0,0.625,2.197,0,2.428
finnish_polar_2081,Onko kastemadolla selkäjänne?,fi,-0.793,0.0,0.0,0.667,1.609,1,1.483
japanese_content_4286,宇宙ゴミの問題が提唱され始めたのはいつ,ja,0.951,2.0,0.333,0.385,2.639,0,6.308
japanese_content_4328,鎌池和馬の出身はどこ,ja,-0.132,0.0,0.0,0.571,2.079,0,2.518
korean_polar_339,경국대전은 조선 최고의 법전인가요?,ko,-0.413,0.0,0.5,1.0,1.792,1,2.879
japanese_content_3052,ヴィーナの起源はいつ,ja,0.035,0.0,0.0,0.4,1.792,0,2.227
russian_content_11409,Когда начали изучать Биополитику в России?,ru,-0.178,1.0,0.333,0.833,2.079,0,4.067
english_content_8843,How much energy does the Three Gorges Dam generate?,en,0.227,0.0,0.333,0.778,2.398,0,3.736
korean_content_7433,인류 최초로 개발된 컴퓨터 프로그램은 무엇인가?,ko,-0.273,1.0,0.2,1.0,2.079,0,4.006
russian_polar_279,Является ли левшой Бе́кхэм?,ru,0.078,0.0,0.6,0.75,1.792,1,3.22
japanese_polar_989,脱法ドラッグとは、法律で規制されていない薬物？,ja,1.134,1.0,0.2,0.462,2.773,1,5.569
indonesian_polar_156,Apakah ada upacara untuk memperingati Hari Anzac?,id,-0.362,1.0,0.625,0.75,2.303,1,4.316
russian_content_1949,"При каких обстоятельствах город А́кко получил название ""Сен-Жан д’Акр""?",ru,0.2,0.0,0.5,0.8,2.708,0,4.208
english_polar_878,Is the small-block engine a combustion engine?,en,0.98,0.0,0.0,0.625,2.398,1,4.003
indonesian_polar_34,apakah presiden soeharto menjalankan sistem diktatur di saat menjabat?,id,-0.013,1.0,0.5,0.8,2.485,1,4.772
finnish_polar_342,Oliko Romania Saksan liittolainen toisessa maailmansodassa?,fi,0.007,0.0,0.0,0.833,2.079,1,2.919
korean_polar_379,사우스다코타는 대륙성 기후를 가지고 있나요?,ko,-0.58,0.0,0.5,0.8,1.946,1,2.666
finnish_content_13911,Milloin Charles Ponzi jäi kiinni pyramidi huijauksestaan?,fi,0.077,0.0,0.667,1.0,2.197,0,3.941
english_content_6168,How long does a degree in evolutionary psychology take?,en,0.977,0.0,0.333,0.667,2.398,0,4.375
korean_content_2938,2019년 5월 기준 하버드에 재학중인 한국인은 몇 명인가?,ko,-0.187,1.0,0.4,1.0,2.303,0,4.516
arabic_polar_1344,هل يتأثر إقتصاد المغرب العربي بإقتصاد إسبانيا ؟,ar,0.042,0.0,0.333,0.714,2.197,1,3.286
indonesian_content_2077,Siapa pendiri Sekolah Tinggi Agama Islam Nahdlatul Ulama Temanggung?,id,-0.386,0.0,0.0,0.889,2.398,0,2.901
japanese_polar_160,猫は雑食？,ja,-0.449,0.0,0.0,0.667,1.609,1,1.827
japanese_content_6158,赤穂事件のきっかけは何？,ja,-0.565,0.0,0.0,0.5,2.079,0,2.014
japanese_polar_1007,トゥルグート・レイス級装甲艦は現存する？,ja,0.426,0.0,0.2,0.667,2.398,1,3.691
english_polar_789,Is St. Joseph's Church in Fall River still an active church?,en,1.18,0.0,0.0,0.727,2.565,1,4.472
japanese_content_4739,ドンキーカルテットのデビュー曲は何？,ja,-0.465,0.0,0.0,0.571,2.197,0,2.303
arabic_content_16821,بماذا تختص دراسة علم ميكانيكا التربة ؟,ar,-0.349,0.0,0.333,0.571,2.197,0,2.752
korean_polar_116,기화식 가습기는 물을 가열하거나 끌여서 증기와 수분을 대기로 내보낸다.,ko,0.42,0.0,1.0,0.667,2.398,1,4.485
english_content_5412,Where was Meghan Markle born?,en,0.352,0.0,0.5,0.8,1.946,0,3.598
korean_content_3478,근대의 식민지는 어느 시대에 본격화 되었나요?,ko,0.327,0.0,0.6,0.833,2.079,0,3.839
japanese_polar_58,ヨーロッパにはまだ貴族院が存在する国はある？,ja,0.596,1.0,0.4,0.583,2.639,1,5.218
indonesian_polar_314,Adakah Pandemik sebuah virus?,id,-0.291,0.0,0.5,0.6,1.946,1,2.755
russian_polar_1032,Военная служба обязательна для мужчин в России?,ru,-0.255,0.0,0.0,0.714,2.197,1,2.656
english_content_2483,How much does Blizzard Entertainment make a year?,en,-0.291,0.0,0.5,0.75,2.303,0,3.262
japanese_polar_1238,『ダンジョンズ&ドラゴンズ』はスマホアプリ？,ja,0.051,0.0,0.0,0.667,2.303,1,3.021
arabic_content_14372,كيف يمكن الخوض في نقاش حضاري ؟,ar,-0.149,0.0,0.333,0.667,2.079,0,2.93
finnish_content_11512,Mikä on trigonometria?,fi,-0.256,0.0,0.0,0.333,1.609,0,1.686
finnish_content_6726,Miten kierteisgalaksi määritellään?,fi,-0.256,0.0,0.333,1.0,1.609,0,2.686
finnish_polar_1101,Omistaako Venäjä saaria?,fi,-0.293,0.0,0.333,1.0,1.609,1,2.649
indonesian_content_4649,berapakah luas Nikaragua?,id,-0.303,0.0,0.0,0.75,1.792,0,2.239
japanese_content_773,カルガリーの主要産業は何,ja,-0.365,0.0,0.0,0.5,1.946,0,2.081
arabic_polar_695,هل يمكن تجنب ورم الأرومة الغاذية ؟,ar,-0.625,0.0,0.167,0.833,2.079,1,2.454
english_content_256,Who were Petar II Petrović-Njegoš parents?,en,1.352,0.0,0.0,0.571,2.303,0,4.226
indonesian_content_10737,berapa lamakah Perjalanan Nabi Muhammad SAW ke Tai'f?,id,-0.065,0.0,0.0,0.875,2.303,0,3.113
japanese_content_166,アメリカ合衆国において一番多い人種は何？,ja,-0.265,1.0,0.0,0.636,2.565,0,3.936
finnish_polar_1336,"Onko totta, että S-bahn kulki myös Länsi-Berliiniin, Berliinin ollessa jaettu?",fi,0.429,2.0,0.5,0.7,2.639,1,6.268
korean_polar_290,바빌론은 고대 메소포타미아에 있는 고대 도시인가요?,ko,-0.08,0.0,0.75,1.0,2.079,1,3.749
finnish_polar_962,Onko Kytäjän kolmoissurman tekijä tuomittu?,fi,-0.043,0.0,0.333,0.8,1.946,1,3.036
japanese_polar_503,『キングダム ハーツ シリーズ』はアニメ化されたことはある？,ja,0.142,1.0,0.0,0.583,2.773,1,4.498
japanese_content_4520,違星 北斗の出身はどこ？,ja,-0.465,0.0,0.0,0.571,2.197,0,2.303
japanese_polar_1324,ノイシュヴァンシュタイン城の見学は可能ですか？,ja,-0.52,0.0,0.0,0.5,2.303,1,2.283
finnish_polar_607,Olivatko kaikki Suomen kaartiin kuuluvat sotilaat suomalaisia?,fi,0.54,1.0,0.167,0.714,2.197,1,4.618
english_content_4364,What is a jurist?,en,-0.481,0.0,0.0,0.25,1.792,0,1.561
arabic_content_13318,أين يقع متحف الإرميتاج؟,ar,-0.349,0.0,0.333,0.5,1.792,0,2.276
english_content_4130,What is the largest professional cricket organization?,en,0.685,0.0,0.0,0.571,2.197,0,3.453
indonesian_polar_387,Adakah Gilgames seorang Raja?,id,-0.291,0.0,0.5,0.6,1.946,1,2.755
japanese_content_6109,増田英彦の職業は何,ja,-0.565,0.0,0.0,0.5,1.946,0,1.881
english_polar_563,Are the Mung Chinese?,en,-0.02,0.0,0.0,0.5,1.792,1,2.272
japanese_content_231,アメリカン・モーターズ社が初めて販売した商品は何,ja,-0.147,1.0,0.333,0.5,2.565,0,4.251
indonesian_polar_317,Apakah Alamat IP versi 4 digunakan pada komputer?,id,0.459,0.0,0.75,0.667,2.398,1,4.274
indonesian_polar_452,Apakah biji wijen dapat dimakan manusia?,id,0.209,0.0,0.75,0.714,2.197,1,3.87
arabic_polar_961,هل بي بي مصر هي شركة حكومية؟,ar,0.709,0.0,0.0,0.429,2.197,1,3.335
korean_polar_324,한국의 제사상에는 붉은 팥을 올릴 수 있나요?,ko,-0.747,1.0,0.375,1.0,2.197,1,3.825
indonesian_content_5692,Siapakah Ridley Scott?,id,-0.303,0.0,0.0,0.5,1.792,0,1.989
korean_polar_173,인터넷은 통신 프로토콜을 이용해 정보를 주고받는 컴퓨터 네트워크인가요?,ko,0.063,1.0,0.625,0.875,2.303,1,4.866
korean_content_6583,세계 최초로 석유를 추출한 나라는 어디인가?,ko,-0.273,1.0,0.3,1.0,2.079,0,4.106
japanese_content_6255,キリスト教社会主義の先駆者はだれ？,ja,-0.215,0.0,0.0,0.667,2.398,0,2.85
english_polar_113,Do you need a degree to be an engineering technologist?,en,0.313,1.0,0.4,0.4,2.485,1,4.598
japanese_content_1110,マスプロ教育の先駆者は誰,ja,-0.465,0.0,0.0,0.571,2.079,0,2.185
japanese_content_6542,フランケンベルク (エーダー)の初代市長は誰？,ja,1.035,0.0,0.0,0.571,2.398,0,4.004
finnish_content_2654,Minä vuosina Sokrates oli elossa?,fi,0.744,0.0,0.0,0.6,1.946,0,3.29
english_polar_462,Can Deadpool die?,en,-0.52,0.0,0.2,0.667,1.609,1,1.956
korean_polar_9,양산시는 경상남도에 속해있나요?,ko,-0.58,0.0,0.5,1.0,1.609,1,2.529
indonesian_polar_310,"apakah Joseph Patrick ""Joe"" Kennedy mempunyai isteri?",id,1.781,0.0,0.75,0.875,2.485,1,5.891
english_polar_93,Did England participate in the Thirty Years War?,en,0.408,0.0,0.4,0.625,2.303,1,3.736
russian_content_2184,Какая протяженность Уральских гор?,ru,-0.244,0.0,0.0,0.75,1.792,0,2.298
finnish_polar_2104,Onko Japanissa tulivuoria?,fi,-0.793,0.0,0.0,0.667,1.609,1,1.483
russian_polar_519,Сохранилась ли крепость Баязет на 2019 год?,ru,0.245,0.0,0.6,0.714,2.197,1,3.756
arabic_content_18074,متي تم إكتشاف عنصر الكولومبيوم ؟,ar,-0.349,0.0,0.333,0.8,1.946,0,2.73
japanese_polar_1172,クローン人間を作ることは理論上可能？,ja,-0.449,1.0,0.2,0.778,2.398,1,3.927
indonesian_polar_112,apakah bluetooth termasuk teknologi berbagi berkas?,id,-0.457,1.0,0.5,0.857,2.197,1,4.097
japanese_content_398,日本で最も歴史のある旅行会社は何,ja,0.035,1.0,0.5,0.6,2.398,0,4.533
finnish_polar_1049,Onko Urkeš kukkula?,fi,-0.293,0.0,0.0,0.667,1.609,1,1.983
arabic_content_9069,من هو أول عالم فيزياء فاز بجائزة نوبل ؟,ar,-0.064,1.0,0.167,0.75,2.303,0,4.156
japanese_polar_78,ブドウの収穫は年間を通して行われますか？,ja,0.051,1.0,0.5,0.417,2.639,1,4.607
english_polar_427,Is there a cure for ALS?,en,-0.42,0.0,0.4,0.5,2.079,1,2.559
english_polar_329,Do any Chaldean buildings still exist?,en,0.18,0.0,0.4,0.667,2.079,1,3.326
english_polar_830,Was Richard Siegmund Lindzen born in the U.S.?,en,0.266,0.0,0.6,0.625,2.303,1,3.794
indonesian_content_11323,mata uang apakah yang digunakan di jepang?,id,0.221,1.0,0.333,0.5,2.303,0,4.357
korean_polar_117,약제가 든 흡입제를 증기에 추가하여 기침을 줄이는데 도움을 주나요?,ko,-0.705,1.0,0.375,0.778,2.398,1,3.846
finnish_polar_1074,Kuuluuko Dodekanesian saariryhmä Kreikalle?,fi,0.207,0.0,0.333,1.0,1.792,1,3.332
