unique_id,text,language,avg_links_len,avg_subordinate_chain_len,avg_verb_edges,lexical_density,n_tokens,question_type,complexity_score
russian_polar_21,"Получила ли Элизабет Тейлор ""Оскар"" за роль Клеопатры?",ru,0.793,0.0,0.8,0.75,2.485,1,4.828
finnish_content_8597,Miten korkotaso vaikuttaa asuntojen hintakehitykseen?,fi,-0.256,0.0,0.5,1.0,1.946,0,3.19
english_content_4879,How long did the Joel appear on Mystery Science Theater 3000?,en,-0.148,0.0,0.5,0.636,2.565,0,3.553
arabic_polar_735,هل يمكن أن يولد الجنين بلوني عينين مختلفين؟,ar,-0.339,1.0,0.333,0.625,2.303,1,3.922
korean_content_6776,2019년까지 한국의 광고 중에 가장 긴 광고는 무엇인가?,ko,0.527,0.0,0.4,1.0,2.303,0,4.23
indonesian_polar_30,apakah bakteri bisa hidup di luar angkasa?,id,0.209,0.0,0.75,0.625,2.303,1,3.887
indonesian_content_8395,berapa lamakah Kekaisaran Mongolia berkuasa?,id,0.864,0.0,0.5,1.0,1.946,0,4.31
russian_content_9160,Когда был создан Русский алфавит?,ru,-0.078,0.0,0.5,0.8,1.946,0,3.168
korean_content_537,2018년 가장 높은 수익을 올린 특허는 무엇인가?,ko,0.027,1.0,0.3,1.0,2.197,0,4.524
english_polar_560,Are red wolves endangered?,en,-0.353,0.0,0.0,0.75,1.792,1,2.189
finnish_content_5282,Milloin käytiin Narvikin taistelu?,fi,-0.423,0.0,0.333,1.0,1.792,0,2.702
arabic_polar_600,هل الألمانية من اللغات الرسمية في بولندا؟,ar,0.042,0.0,0.0,0.429,2.197,1,2.668
english_polar_590,Does the Air Force have their own boats?,en,-0.02,0.0,0.4,0.625,2.303,1,3.308
japanese_content_4970,お金の発祥地はどこ？,ja,-0.465,0.0,0.0,0.571,2.197,0,2.303
russian_polar_1207,Была ли Клеопатра женой своего брата?,ru,-0.122,0.0,0.0,0.5,2.079,1,2.457
japanese_polar_207,アーヴィング・ゴッフマンは社会学者？,ja,-0.349,0.0,0.0,0.667,2.079,1,2.397
english_polar_944,Can murderers be considered celebrities?,en,-0.27,0.0,0.6,0.6,1.946,1,2.876
korean_content_36,"2019년 5월 기준, 가장 많이 사용되고있는 소셜 미디어는 무엇인가?",ko,0.527,1.0,0.3,1.0,2.485,0,5.312
russian_content_6845,Руководителем какой организации был Гео́ргий Гапо́н?,ru,0.622,0.0,0.0,0.667,2.079,0,3.368
japanese_content_2399,グナエウス・ポンペイウス・マグヌスが生まれたのはいつ,ja,0.335,1.0,0.5,0.364,2.485,0,4.684
finnish_content_2878,Miten irtisanominen määritellään?,fi,-0.256,0.0,0.333,1.0,1.609,0,2.686
russian_polar_1594,Был ли Никола́й Евге́ньевич Ма́рков депутатом?,ru,1.078,0.0,0.0,0.667,2.079,1,3.824
indonesian_content_5210,kapankah Instagram didirikan?,id,0.03,0.0,0.333,0.75,1.792,0,2.905
japanese_content_3447,台湾の首都はどこ,ja,-0.465,0.0,0.0,0.4,1.792,0,1.727
indonesian_polar_175,Apakah Tuberkulosis dapat menular?,id,0.209,0.0,0.5,0.6,1.946,1,3.255
korean_polar_300,뇌와 척수는 연합 뉴런으로 이루어져 있나요?,ko,-0.48,0.0,0.5,0.667,2.079,1,2.766
korean_polar_40,현재의 영상을 부호화 하기 위하여 기존에 부호화 된 영상의 영역을 가져와서 예측을 하도록 하는 것이 주 목적인가요?,ko,-0.268,1.0,0.562,0.824,2.944,1,5.062
english_content_548,When was Gus Dur born?,en,0.352,0.0,0.5,0.8,1.946,0,3.598
finnish_polar_1926,Sopiiko lammas lemmikiksi?,fi,-0.293,0.0,0.333,1.0,1.609,1,2.649
arabic_content_1173,من هو أحمد حسين؟,ar,0.317,0.0,0.0,0.0,1.792,0,2.109
finnish_polar_429,Voiko liuos olla myös kaasua?,fi,0.707,0.0,0.0,0.6,1.946,1,3.253
japanese_content_4771,茶屋町MBS劇場のディレクターは誰？,ja,-0.251,0.0,0.0,0.625,2.303,0,2.677
english_content_2413,When did Matthew Shepherd die?,en,0.352,0.0,0.333,0.8,1.946,0,3.431
english_content_7452,What chemical compound has the longest name?,en,-0.481,0.0,0.333,0.714,2.197,0,2.763
korean_content_7581,한국의 불교는 언제 전해졌는가?,ko,-0.14,0.0,0.4,1.0,1.792,0,3.052
russian_polar_1311,Можно ли ускорить метаболизм человека?,ru,-0.672,1.0,0.3,0.8,1.946,1,3.374
indonesian_content_5871,berapakah jumlah surah dalam al-Qur'an?,id,-0.136,0.0,0.0,0.714,2.197,0,2.775
russian_polar_1652,"Страдают ли женщины от пограничного расстройства личности чаще, чем мужчины?",ru,0.634,0.0,0.8,0.7,2.565,1,4.699
russian_content_7425,Как зовут первую женщину капитана корабля в России?,ru,-0.149,0.0,0.333,0.875,2.303,0,3.362
japanese_polar_333,ソフトバンクはヤフーを買収した？,ja,-0.116,0.0,0.4,0.429,2.197,1,2.91
japanese_content_1344,スイス連邦の首都はどこ？,ja,-0.565,0.0,0.0,0.5,2.079,0,2.014
english_polar_583,Does benign essential tremors effect hand-eye coordination?,en,0.123,0.0,0.4,0.875,2.398,1,3.796
japanese_content_4951,最古のペルシア文学は何？,ja,-0.365,0.0,0.0,0.5,2.079,0,2.214
japanese_content_3017,世界最大の移動式クレーンは何？,ja,-0.251,0.0,0.0,0.625,2.303,0,2.677
finnish_polar_54,Onko tammiarkkuhauta tehty tammesta?,fi,-0.46,0.0,0.5,0.75,1.792,1,2.582
japanese_polar_387,スワヒリ語に形容詞はある？,ja,-0.116,0.0,0.4,0.714,2.197,1,3.195
arabic_polar_574,هل يمكن الإدمان على تدخين نبتة المارجوانا ؟,ar,-0.458,0.0,0.167,0.571,2.197,1,2.477
korean_polar_147,미국은 원자력을 가지고 있는가?,ko,-0.747,0.0,0.5,0.75,1.792,1,2.295
indonesian_content_4982,Dimana Uesugi Kenshin lahir?,id,0.364,0.0,0.333,1.0,1.792,0,3.489
japanese_polar_1146,飛騨川バス転落事故、災害警報は出ていた？,ja,-0.149,1.0,0.2,0.727,2.639,1,4.417
japanese_content_1731,第二次ディープボトムの戦いで北軍を指揮したのは誰,ja,0.32,0.0,0.833,0.4,2.773,0,4.326
english_polar_926,Did Hitler want to create a nuclear bomb?,en,-0.306,1.0,0.4,0.625,2.303,1,4.022
arabic_polar_881,هل إستوطن الفينيقيين في فلسطين؟,ar,-0.125,0.0,0.333,0.6,1.946,1,2.754
arabic_polar_2348,هل تم تمثيل احزاب الجنوب في مؤتمرالحوار الوطني الشامل في اليمن؟,ar,0.012,0.0,0.167,0.75,2.639,1,3.568
finnish_polar_502,Onko yhteiskunnalla sama uskonto?,fi,-0.46,0.0,0.0,0.5,1.792,1,1.832
russian_polar_1720,Умирают ли от пневмонии?,ru,-0.255,0.0,0.4,0.5,1.792,1,2.437
indonesian_polar_213,Apa Emosikon yang mengekspresikan kesedihan?,id,-0.541,1.0,0.5,0.6,1.946,1,3.505
finnish_content_12289,Milloin keksittiin tyhjiöpakkaaminen?,fi,-0.756,0.0,0.333,1.0,1.609,0,2.186
japanese_polar_616,アメリカ軍は原爆を保持する？,ja,-0.282,0.0,0.4,0.571,2.197,1,2.886
finnish_polar_1825,Onko yhtiöiden tuotoista pidetty kirjaa 1910-luvulla?,fi,-0.193,0.0,0.667,0.833,2.079,1,3.386
arabic_polar_2122,هل توجد حرية الإعتقاد في الأردن ؟,ar,-0.025,0.0,0.5,0.667,2.079,1,3.221
korean_polar_311,오행이라는 것은 목·화·토·금·수의 오원소를 말하나요?,ko,-0.58,1.0,0.25,1.0,1.946,1,3.616
japanese_content_5320,上野動物園の創設者はだれ,ja,-0.394,0.0,0.0,0.625,2.197,0,2.428
japanese_content_1020,ドイツ・バイエルン州の主要農産物は何？,ja,-0.076,0.0,0.0,0.6,2.485,0,3.009
english_polar_23,Does The Metropolitan Police Department have any awards?,en,0.123,0.0,0.4,0.625,2.303,1,3.451
japanese_content_1030,Activisionが初めて販売されたのはいつ,ja,0.924,1.0,0.667,0.3,2.398,0,5.289
arabic_polar_768,هل يشمل برنامج الأمم المتحدة الإنمائي محاربة المجاعة؟,ar,0.233,0.0,0.333,0.875,2.303,1,3.744
arabic_polar_1237,هل تتكاثر الحرباء بالبيوض؟,ar,-0.625,0.0,0.167,0.5,1.792,1,1.834
english_content_6206,How do you prevent traumatic brain injury?,en,-0.148,0.0,0.5,0.714,2.197,0,3.263
english_polar_873,Is Obsessive Compulsive Disorder an anxiety disorder?,en,0.48,0.0,0.0,0.714,2.197,1,3.391
finnish_polar_1512,Onko Lev Semjonovitš Vygotski kehittänyt lähikehityksen vyöhykkeen teorian?,fi,0.35,0.0,0.333,0.875,2.303,1,3.861
arabic_polar_1204,هل يحتوي قمر آيو على الماء ؟,ar,-0.025,0.0,0.333,0.5,2.079,1,2.887
arabic_content_16698,ماهو متوسط تكاليف السفرلمدة يوميين إلي المملكة الأردنية ؟,ar,0.794,0.0,0.0,0.75,2.303,0,3.847
finnish_content_2647,Mikä alykkyysosamäärä on imbesillin määritelmänä?,fi,-0.006,0.0,0.0,0.6,1.946,0,2.54
indonesian_content_3876,Berapa jenis variasi alat Dildo?,id,-0.636,0.0,0.0,1.0,1.946,0,2.31
arabic_polar_1050,هل يعتبر التهاب البروستات داء تنكسي؟,ar,-0.225,0.0,0.5,0.667,2.079,1,3.021
english_content_5036,What was the tax rate in ancient Rome?,en,-0.148,0.0,0.0,0.5,2.303,0,2.655
arabic_content_4307,ما هي ثورة الارز؟,ar,-0.016,0.0,0.0,0.5,1.792,0,2.276
english_polar_1158,Does Mary Hoffman have kids?,en,-0.27,0.0,0.4,0.8,1.946,1,2.876
english_content_369,How dangerous is orientia tsutsugamushi?,en,-0.648,0.0,0.0,0.8,1.946,0,2.098
russian_content_1072,"Когда была написана ""Песнь о полку игореве""?",ru,-0.078,0.0,0.5,0.714,2.398,0,3.534
korean_content_10076,프랑스 옷계열 유명 브랜드는 몇개인가?,ko,-0.223,0.0,0.2,1.0,1.946,0,2.923
japanese_polar_282,ゴリラはサル？,ja,-0.616,0.0,0.0,0.5,1.609,1,1.493
indonesian_content_3325,berapakah jumlah anak yang dimiliki Olybrius?,id,-0.136,1.0,0.333,0.714,2.197,0,4.108
english_polar_578,Is Eske Willerslev dead?,en,-0.02,0.0,0.0,0.75,1.792,1,2.522
english_polar_390,Is Michelle Obama's initiative still ongoing?,en,0.48,0.0,0.0,0.714,2.197,1,3.391
japanese_polar_1226,NHKラジオ第1放送ではニュース番組はある？,ja,0.351,0.0,0.4,0.636,2.565,1,3.952
indonesian_content_11406,siapakah yang menemukan Ötzi?,id,-0.136,1.0,0.333,0.4,1.946,0,3.543
russian_content_506,Парово́з Э участвовал в Первой мировой войне?,ru,0.589,0.0,0.333,0.857,2.197,0,3.976
english_content_7841,What genre of art did Van Gogh practice?,en,0.138,0.0,0.333,0.625,2.303,0,3.399
russian_polar_808,Принудительные меры медицинского характера прописаны в законодательстве России?,ru,-0.35,0.0,0.4,0.875,2.303,1,3.228
japanese_content_164,すがやみつるのデビュー作は何？,ja,0.32,0.0,0.0,0.375,2.303,0,2.998
korean_polar_10,"상시 4륜구동(full-time 4WD, 풀 타임 4WD)는 항상 4륜으로 주행하는 것으로 전/후륜의 동력비율을 가변적으로 조절하도록 되어 있는 방식인가요?",ko,0.809,1.0,0.5,0.684,3.135,1,6.128
finnish_polar_1972,Oliko salaisuuksien kammio basiliskin koti?,fi,0.207,0.0,0.0,0.8,1.946,1,2.953
english_polar_456,Is Fibromyalgia an acute disease?,en,0.48,0.0,0.0,0.6,1.946,1,3.026
english_content_7710,Where did Maria Sibylla Merian go to school?,en,0.423,0.0,0.5,0.75,2.303,0,3.976
russian_polar_428,Льва Толстого отлучили от Православной церкви?,ru,-0.122,0.0,0.4,0.833,2.079,1,3.19
finnish_polar_1035,Asuuko Arvo Aalto talvisin Portugalissa?,fi,0.457,0.0,0.5,1.0,1.946,1,3.903
finnish_content_15018,Mikä on Kuopion asukasluku?,fi,-0.09,0.0,0.0,0.5,1.792,0,2.202
russian_content_7888,Где происходит действие романа «Противостояние» Стивена Кинга?,ru,0.089,0.0,0.333,1.0,2.398,0,3.82
finnish_polar_1521,Auttoiko Saksa Suomea sisällissodan aikana?,fi,-0.043,0.0,0.333,1.0,1.946,1,3.236
japanese_content_4252,コロンブスブス・デーを制定したのは誰,ja,0.368,1.0,0.5,0.3,2.398,0,4.566
english_polar_917,Is New York City a compact city?,en,0.313,0.0,0.0,0.714,2.197,1,3.224
japanese_polar_1108,『トラ・トラ・トラ!』には日本人の俳優も出演しましたか？,ja,0.801,0.0,0.6,0.412,3.091,1,4.904
russian_polar_288,Есть ли центры А́гни-йо́ги в России в 2019 году?,ru,0.703,0.0,0.8,0.667,2.398,1,4.568
japanese_content_1374,セントルイス・カージナルスの初代監督は誰,ja,-0.394,0.0,0.0,0.5,2.197,0,2.303
russian_polar_694,Была ли успешной Экспедиция Франклина 1845—1847 годов или Пропавшая экспедиция Франклина?,ru,0.442,0.0,0.0,0.75,2.708,1,3.9
arabic_polar_68,هل خاضت مملكة اسبانيا حروب مع انجلترا؟,ar,-0.125,0.0,0.333,0.429,2.197,1,2.834
finnish_content_10811,Mikä on Malmin pinta-ala?,fi,-0.09,0.0,0.0,0.5,1.792,0,2.202
english_polar_144,Was USA a British colony?,en,0.48,0.0,0.0,0.6,1.946,1,3.026
japanese_content_2615,比叡山にある寺は何？,ja,-0.537,1.0,0.167,0.625,2.303,0,3.558
japanese_polar_859,ベンゾジアゼピンは睡眠薬として使われる？,ja,0.162,0.0,0.4,0.5,2.485,1,3.547
arabic_content_5229,من هو زوج سيمون بوليفار ؟,ar,0.151,0.0,0.0,0.2,1.946,0,2.297
japanese_content_5965,グリーンランドに初めて住み始めた人類は何？,ja,-0.299,2.0,0.25,0.6,2.485,0,5.036
finnish_polar_1790,Elääkö Norjan vesistöissä kaskelotteja?,fi,0.207,0.0,0.333,1.0,1.792,1,3.332
english_content_1228,Where was the first European Grand Prix race held?,en,0.727,1.0,0.0,0.778,2.398,0,4.903
indonesian_content_10286,Dimana letak Korintus ?,id,-0.636,0.0,0.0,0.667,1.609,0,1.64
english_content_884,Who created the name Killer Frost?,en,-0.748,0.0,0.333,0.667,2.079,0,2.331
japanese_polar_1313,古代ローマの通貨で金は使用された？,ja,-0.149,0.0,0.4,0.455,2.565,1,3.271
arabic_content_21660,ماهو تصلب الشرايين ؟,ar,-0.349,0.0,0.0,0.667,1.609,0,1.927
indonesian_content_4812,berapakah jumlah manga yang di buat Eiichiro Oda?,id,-0.136,1.0,0.5,0.667,2.398,0,4.429
japanese_polar_238,ケイルハウイアに顎はある？,ja,-0.149,0.0,0.4,0.667,2.079,1,2.997
japanese_content_3125,日本で一番発行部数の多いSF作品は何？,ja,0.535,0.0,0.0,0.636,2.565,0,3.736
japanese_content_6294,人類が服を着始めたのはいつ,ja,0.59,2.0,0.417,0.4,2.398,0,5.805
indonesian_polar_244,Apakah ambien bisa disembuhkan ?,id,0.209,0.0,0.5,0.6,1.946,1,3.255
indonesian_content_2606,Berapa populasi Roma tahun 2017?,id,-0.386,0.0,0.0,0.8,1.946,0,2.36
finnish_polar_450,Onko Indira Gandhi Intian ainoa naispääministeri?,fi,0.807,0.0,0.0,0.833,2.079,1,3.719
english_content_4840,How many drives are necessary for an array?,en,-0.577,0.0,0.0,0.625,2.303,0,2.351
japanese_polar_463,日本社会党は左派？,ja,-0.549,0.0,0.0,0.667,1.946,1,2.064
japanese_polar_297,アサヒはドライビールを販売する？,ja,-0.116,0.0,0.4,0.571,2.197,1,3.052
arabic_polar_601,هل يمكن إنتاج الفودكا من تخمير البطاطا؟,ar,-0.291,0.0,0.167,0.571,2.197,1,2.644
arabic_content_11079,من قام برسم لوحة عودة الولد الضال؟,ar,-0.206,0.0,0.333,0.75,2.303,0,3.18
english_content_4959,How old is Sir Michael Thomas Somare?,en,-0.315,0.0,0.0,0.857,2.197,0,2.739
english_content_8253,When was an amphibious vehicle first used in warfare?,en,0.352,0.0,0.833,0.667,2.398,0,4.25
russian_polar_1333,Растет осо́ка в Африке?,ru,-0.255,0.0,0.4,0.75,1.792,1,2.687
japanese_polar_799,アトラスはゲーム会社？,ja,-0.282,0.0,0.0,0.75,1.792,1,2.26
japanese_polar_936,武田信玄は戦死した？,ja,-0.549,0.0,0.2,0.5,2.079,1,2.23
indonesian_polar_248,pernahkah Israel diserang negara lain?,id,-0.391,0.0,0.75,0.833,2.079,1,3.271
indonesian_content_9052,Siapakah pemilik Microsoft ?,id,-0.303,0.0,0.0,0.5,1.792,0,1.989
japanese_polar_488,ゴリラは集団生活をする？,ja,0.051,0.0,0.4,0.667,2.079,1,3.197
russian_polar_391,Есть ли динофи́товые во́доросли в Черном море?,ru,0.412,0.0,0.6,0.714,2.197,1,3.923
arabic_polar_2286,هل الببر السومطري مهدد بلانقراض ؟,ar,0.125,0.0,0.0,0.8,1.946,1,2.871
japanese_polar_173,薬剤師は医薬品の開発をする？,ja,0.051,0.0,0.4,0.667,2.398,1,3.516
english_content_1965,How much does a shipping car weigh?,en,0.185,0.0,0.333,0.714,2.197,0,3.429
korean_polar_376,초신성 발견은 국제천문연맹(IAU)의 중앙천문전보국(CBAT)로 보고되나요?,ko,1.42,0.0,0.5,0.556,2.565,1,5.041
arabic_polar_1849,هل برنامج أوتوكاد هو برنامج هندسة التصنيع؟,ar,0.209,0.0,0.0,0.571,2.197,1,2.977
russian_polar_1584,Были ошибки в почтовых марках Италии?,ru,-0.322,0.0,0.2,0.833,2.079,1,2.79
russian_content_5353,Джейн Грей была блондинкой?,ru,0.089,0.0,0.0,0.75,1.792,0,2.631
arabic_content_2412,من هو صاحب كتاب الإسلام وأزمة الغرب؟,ar,0.151,0.0,0.0,0.714,2.197,0,3.062
indonesian_polar_81,apakah olahraga Kronum menggunakan Bola?,id,0.009,0.0,0.75,0.833,2.079,1,3.671
indonesian_polar_325,apakah Tubagus Alipan seorang anggota PKI?,id,-0.291,0.0,0.0,0.714,2.197,1,2.62
arabic_polar_179,هل توجد ادوية لمعالجة مرض التوحد؟,ar,-0.458,0.0,0.333,0.714,2.197,1,2.786
korean_content_11207,스위스에는 몇 개의 초등학교가 있나요?,ko,0.277,0.0,0.4,1.0,1.946,0,3.623
russian_content_11732,Что такое маршировка?,ru,-0.078,0.0,0.0,0.333,1.609,0,1.864
arabic_content_12514,ماهو تعداد سكان طرابلس اللبنانية ؟,ar,-0.099,0.0,0.0,0.8,1.946,0,2.647
finnish_polar_1618,Onko Kännykkä rekisteräity tuotemerkki?,fi,0.207,1.0,0.0,0.75,1.792,1,3.749
english_polar_582,Is education in China free?,en,0.48,0.0,0.0,0.6,1.946,1,3.026
japanese_polar_468,黄砂は健康被害をもたらしますか？,ja,-0.092,0.0,0.6,0.5,2.303,1,3.311
arabic_content_2075,ما هو الجنس الأمن؟,ar,-0.016,0.0,0.0,0.5,1.792,0,2.276
japanese_content_21,日本ボクシングコミッションが設立したのはいつ,ja,0.368,1.0,0.5,0.4,2.398,0,4.666
english_content_596,How did Philip Melanchthon die?,en,0.352,0.0,0.333,0.8,1.946,0,3.431
arabic_content_9728,من أدى صوت مهند في المسلسل التركي المدبلج نور ؟,ar,0.54,0.0,0.5,0.5,2.485,0,4.025
russian_content_2642,"Сколько человек, в процентах, в России страдает от мигрени на 2018?",ru,0.722,0.0,0.833,0.545,2.708,0,4.808
finnish_polar_44,Onko alumiininen putki yleinen varmistusväline?,fi,0.207,0.0,0.0,0.8,1.946,1,2.953
russian_polar_752,Ирландия - монархия?,ru,0.078,0.0,0.0,1.0,1.609,1,2.687
russian_polar_58,Принимают ли рубли в Белоруссии?,ru,0.078,0.0,0.6,0.6,1.946,1,3.224
japanese_polar_208,日本に徴用制度はありますか？,ja,-0.092,0.0,0.6,0.5,2.303,1,3.311
english_polar_1048,Did King Zhaoxiang of Qin have any sons?,en,0.408,0.0,0.4,0.625,2.303,1,3.736
english_polar_84,Is Death in Discworld?,en,-0.02,0.0,0.0,0.5,1.792,1,2.272
japanese_polar_298,犬は精神を持つ？,ja,0.051,0.0,0.4,0.6,1.946,1,2.997
indonesian_polar_284,Apakah eceng termasuk tumbuhan perusak ?,id,-0.391,0.0,0.75,0.833,2.079,1,3.271
finnish_content_9757,Miten inkerinsuomalaiset määritellään?,fi,-0.256,0.0,0.333,1.0,1.609,0,2.686
finnish_content_7718,Milloin Andy Murray voitti olympiakultaa?,fi,-0.006,0.0,0.5,1.0,1.946,0,3.44
finnish_polar_1945,Onko Simpsonit sarja sopiva lapsille?,fi,-0.043,0.0,0.0,0.8,1.946,1,2.703
english_content_3021,Which countries besides France have French as an official language?,en,-0.037,0.0,0.5,0.6,2.485,0,3.548
japanese_polar_1270,『ダウントン・アビー』は日本でテレビ放映されましたか？,ja,0.634,0.0,0.8,0.385,2.833,1,4.652
japanese_content_5840,朝鮮共産党の初代党首は誰？,ja,-0.215,0.0,0.0,0.667,2.398,0,2.85
japanese_content_1732,三輪自動車が初めて開発されたのはいつ,ja,0.701,1.0,0.667,0.385,2.639,0,5.392
english_content_6438,Who took part in The Battle of Lesnaya?,en,-0.434,0.0,0.5,0.5,2.303,0,2.869
japanese_content_3987,ブロムベルク で一番大きな病院は何,ja,-0.108,0.0,0.0,0.625,2.197,0,2.714
russian_content_6569,В каком году был снят первый фильм Властелин Колец?,ru,-0.203,0.0,0.5,0.667,2.398,0,3.362
english_polar_1,Does plastic decompose at all?,en,-0.52,0.0,0.4,0.4,1.946,1,2.226
indonesian_content_11618,Siapakah ketua Mahkamah Konstitusi Republik Indonesia yang pertama?,id,0.114,0.0,0.0,0.667,2.398,0,3.179
finnish_content_6538,Kuinka monta maata kuuluu Eurooppaan?,fi,-0.756,0.0,0.333,0.8,1.946,0,2.323
english_content_1574,How many branches were there in the Confederate States armed forces?,en,0.252,0.0,0.0,0.636,2.565,0,3.453
russian_polar_1412,Есть в Респу́блике Нау́ру столица?,ru,0.078,0.0,0.4,0.8,1.946,1,3.224
finnish_content_4113,Kuinka monessa maassa Metsä Group -konserni toimii?,fi,0.077,0.0,0.333,0.857,2.197,0,3.464
arabic_polar_239,هل كان أبراهام لينكون من أتباع الحزب الجمهوري؟,ar,-0.053,0.0,0.333,0.5,2.303,1,3.083
arabic_content_9642,كم يبلغ عدد الموانئ العمانية؟,ar,-0.349,0.0,0.333,0.8,1.946,0,2.73
arabic_polar_1479,هل الصرع هو مرض وراثي؟,ar,0.125,0.0,0.0,0.6,1.946,1,2.671
arabic_polar_2194,هل كانت المجر متحالفة مع دول المحور في الحرب العالمية الثانية؟,ar,0.275,0.0,0.0,0.636,2.565,1,3.476
english_content_4849,What is the largest crop produced by the US?,en,-0.273,1.0,0.167,0.444,2.398,0,3.736
japanese_content_6724,ニューヨーク最大のマフィア組織は何？,ja,-0.465,0.0,0.0,0.571,2.197,0,2.303
japanese_polar_1141,大学入試問題ネット投稿事件で投稿者は特定された？,ja,0.436,0.0,0.4,0.643,2.773,1,4.252
russian_content_1270,С какого года женщины могут носить брюки?,ru,-0.244,1.0,0.333,0.714,2.197,0,4.0
arabic_polar_2342,هل يتكلم باللغة الإيطالية في ليبيا ؟,ar,-0.025,0.0,0.333,0.5,2.079,1,2.887
indonesian_content_11190,dimanakah pusat Kerajaan Bourgogne?,id,-0.386,0.0,0.0,0.8,1.946,0,2.36
russian_content_8188,Сколько жен мог иметь халиф?,ru,-0.078,1.0,0.25,0.8,1.946,0,3.918
english_content_8465,How much copper was used to make the Statue of Liberty?,en,-0.748,1.0,0.417,0.636,2.565,0,3.87
arabic_content_4125,كم وصلت اقصى سرعة لإعصار باتريسيا؟,ar,-0.349,0.0,0.333,0.5,2.079,0,2.563
finnish_content_14042,Milloin Ferdowsi kuoli?,fi,-0.256,0.0,0.333,1.0,1.609,0,2.686
english_polar_769,Has there ever been a break in production of Scooby-Doo?,en,0.08,0.0,0.6,0.545,2.639,1,3.864
korean_polar_54,렘 수면의 양은 나이와 관련되나요?,ko,-0.83,0.0,0.25,0.8,1.946,1,2.166
russian_content_8923,При каком короле Швеции велась Северная война?,ru,-0.078,0.0,0.333,0.714,2.197,0,3.166
finnish_polar_152,Onko Unelmien talli -kirjasarjan kirjoissa yhteinen juoni?,fi,-0.127,1.0,0.0,0.857,2.197,1,3.927
japanese_polar_452,GHQ民政局長のコートニー・ホイットニーは、軍人ですか？,ja,-0.149,0.0,0.0,0.545,2.639,1,3.035
russian_polar_319,Есть ли женская тюрьма в Гонконге?,ru,-0.322,0.0,0.4,0.667,2.079,1,2.824
russian_polar_906,Были ли женщины руководителями Триад Гонконга?,ru,-0.322,0.0,0.0,0.667,2.079,1,2.424
arabic_polar_1279,هل تم تطوير لقاح للوقاية من فيروس سارس؟,ar,-0.375,0.0,0.167,0.556,2.398,1,2.746
japanese_polar_833,横浜スタジアムの芝は人工芝？,ja,-0.616,0.0,0.0,0.571,2.079,1,2.034
korean_content_10213,데니스 키스 로드먼의 생일은 언제인가요?,ko,0.277,0.0,0.2,1.0,1.946,0,3.423
russian_polar_135,Нужна ли русским туристам виза в Абхазию?,ru,0.078,0.0,0.0,0.714,2.197,1,2.989
finnish_content_10744,Milloin pajatso keksittiin?,fi,-0.256,0.0,0.333,1.0,1.609,0,2.686
finnish_polar_950,Onko Kellon Lyönti -seurassa mahdollista harrastaa salibandya?,fi,-0.127,1.0,0.167,0.857,2.197,1,4.094
finnish_content_14906,Mikä on Oulun ja Rovaniemen välinen etäisyys linnuntietä pitkin?,fi,0.244,0.0,0.0,0.556,2.398,0,3.198
english_content_3986,What does Yên Bái mean?,en,0.352,0.0,0.333,0.6,1.946,0,3.231
indonesian_content_5334,Siapakah tokoh utama dalam serial The Simpsons ?,id,-0.208,0.0,0.0,0.625,2.303,0,2.72
russian_polar_1488,Возможно ли вылечить ВИЧ?,ru,-0.588,1.0,0.2,0.75,1.792,1,3.154
japanese_content_2742,メアリー・フェアファックス・サマヴィルの宗教は何,ja,0.368,0.0,0.0,0.5,2.398,0,3.266
indonesian_polar_313,Apakah agama Children of God diterima di Indonesia?,id,0.334,0.0,0.75,0.778,2.398,1,4.26
japanese_content_5403,ジョージ・ウォルトン・ルーカのス・ジュニアの処女作は何,ja,0.265,0.0,0.0,0.5,2.708,0,3.473
japanese_content_3090,フランス革命のターニングポイントは何？,ja,-0.465,0.0,0.0,0.571,2.197,0,2.303
arabic_content_7053,متي تأسست شركة والت ديزني ؟,ar,-0.349,0.0,0.333,0.4,1.946,0,2.33
finnish_content_13351,Mikä on Japanin valtiomuoto?,fi,-0.09,0.0,0.0,0.5,1.792,0,2.202
indonesian_polar_119,apakah Cirebon mempunyai pelabuhan?,id,-0.291,0.0,0.75,0.8,1.946,1,3.205
english_polar_1101,Is Daydream Software still an active company?,en,0.813,0.0,0.0,0.714,2.197,1,3.724
russian_content_6799,Как звали Архиепи́скопа Гаврии́ла при рождении?,ru,0.022,0.0,0.5,0.833,2.079,0,3.434
russian_polar_723,Ви́ктор Ива́нович Пе́трик был осужден?,ru,0.078,0.0,0.4,0.8,1.946,1,3.224
korean_content_2779,나무의 수명을 어떻게 계산하는가?,ko,-0.14,0.0,0.4,0.75,1.792,0,2.802
