unique_id,text,language,avg_links_len,avg_subordinate_chain_len,avg_verb_edges,lexical_density,n_tokens,question_type,complexity_score
finnish_polar_281,Onko Miles ”Tails” Prower 8-vuotias?,fi,-0.043,0.0,0.0,0.8,2.197,1,2.954
japanese_polar_641,牛久保城は現存する？,ja,-0.549,0.0,0.2,0.667,2.079,1,2.397
korean_polar_94,그리스어는 2019년에도 사용하는 나라가 있는가?,ko,-0.33,1.0,0.25,1.0,1.946,1,3.866
russian_content_12514,Как называется самая известная пьеса Сэ́мюэля Бáркли Бе́ккета?,ru,-0.149,0.0,0.333,0.875,2.303,0,3.362
indonesian_polar_390,apakah kerajaan Persia terletak di negara Iran?,id,-0.076,0.0,0.75,0.75,2.303,1,3.727
arabic_content_5411,من هو بلقين بن زيري؟,ar,0.151,0.0,0.0,0.2,1.946,0,2.297
finnish_polar_1928,Onko kultaisella taljalla taikavoimia?,fi,-0.46,0.0,0.0,0.75,1.792,1,2.082
english_content_6010,When was Major General Douglas born?,en,0.452,0.0,0.5,0.833,2.079,0,3.864
indonesian_polar_29,Apakah lagenda Robin Hood berasal dari Nottingham?,id,0.209,0.0,0.75,0.75,2.303,1,4.012
arabic_content_2118,متى ولد المغني جيمس براون؟,ar,-0.099,0.0,0.333,0.4,1.946,0,2.58
japanese_content_1233,ライフガードの起源はいつ,ja,-0.465,0.0,0.0,0.4,1.792,0,1.727
arabic_content_11203,ماهي وظيفة الطبلة في الاذن ؟,ar,0.151,0.0,0.0,0.6,1.946,0,2.697
japanese_polar_245,ペナン島は植民地化された？,ja,-0.235,1.0,0.2,0.5,2.303,1,3.768
indonesian_content_1409,Adakah Rusia Negara yang berbatasan dengan Laut Hitam?,id,-0.136,1.0,0.333,0.667,2.398,0,4.262
japanese_polar_632,ＪＦケネディーの暗殺の犯人は逮捕されましたか？,ja,0.301,0.0,0.4,0.385,2.708,1,3.794
indonesian_polar_53,Apakah Kalsium hipoklorit berbahay jika tertelan manusia ?,id,-0.076,1.0,0.625,0.75,2.303,1,4.602
arabic_content_17705,أين تقع مدينة سطيف؟,ar,-0.349,0.0,0.333,0.5,1.792,0,2.276
arabic_polar_594,هل يباع الكودين في الولايات المتحدة الأمريكية؟,ar,-0.125,0.0,0.5,0.714,2.197,1,3.286
korean_polar_347,김대중 납치한 사건은 미제사건인가?,ko,-1.08,1.0,0.25,1.0,1.792,1,2.962
english_content_6581,Where do Sun Bears live?,en,0.102,0.0,0.333,0.8,1.946,0,3.181
english_content_7111,What are the symptoms of anaphylaxis?,en,-0.548,0.0,0.0,0.333,2.079,0,1.864
indonesian_polar_464,Apakah Prostitusi legal di Yunani Kuno ?,id,-0.291,0.0,0.0,0.571,2.197,1,2.477
korean_polar_369,목탁수구리는 점토질 지형을 좋아하나요?,ko,-0.413,0.0,0.5,1.0,1.792,1,2.879
korean_content_5755,세상에서 가장 큰 규모의 쿠테타는 무엇인가?,ko,-0.273,0.0,0.2,1.0,2.079,0,3.006
indonesian_content_5794,"dimanakah Christopher Scott ""Chris"" Kyle ditugaskan semasa dia hidup?",id,1.697,1.0,0.417,0.7,2.639,0,6.453
english_polar_709,Is there a term limit for the German presidency?,en,0.23,0.0,0.4,0.556,2.398,1,3.584
russian_polar_1376,Город Славянск в составе Украины на март 2019?,ru,0.078,0.0,0.0,0.75,2.303,1,3.131
russian_polar_1415,Есть ли метро в Минске?,ru,0.078,0.0,0.6,0.6,1.946,1,3.224
arabic_content_3998,من هي الملكة عليسة ؟,ar,-0.349,0.0,0.0,0.25,1.792,0,1.693
finnish_polar_1142,Onko Lummenne osa Päijännettä?,fi,-0.46,0.0,0.0,0.75,1.792,1,2.082
japanese_polar_94,梅酒はフルーツワイン？,ja,-0.282,0.0,0.0,0.75,1.792,1,2.26
english_polar_16,Did Lindsay Wagner audition for her role in The Bionic Woman?,en,0.18,0.0,0.4,0.545,2.565,1,3.69
english_polar_585,Is Japanese derived from Chinese?,en,-0.52,0.0,0.6,0.6,1.946,1,2.626
indonesian_polar_366,apakah David Émile Durkheim masih hidup?,id,-0.124,0.0,0.5,0.857,2.197,1,3.43
english_content_3487,How many Native Americans were killed?,en,-0.748,0.0,0.333,0.833,2.079,0,2.497
english_content_6562,What currency is accepted in Malaysia?,en,-0.748,0.0,0.5,0.5,2.079,0,2.331
japanese_content_3255,人類が武器を使い始めたのはいつ,ja,0.59,2.0,0.417,0.4,2.398,0,5.805
russian_polar_1493,Граф Влади́мир Алекса́ндрович Соллогу́б писал водевили?,ru,-0.122,0.0,0.4,1.0,2.079,1,3.357
finnish_content_10451,Missä Sarah Michelle Gellar on syntynyt?,fi,0.844,0.0,0.333,0.667,2.079,0,3.923
english_content_3226,Where is Muy Thai practiced?,en,0.352,0.0,0.667,0.8,1.946,0,3.765
arabic_polar_1791,هل يختلف شكل وحجم انثى الدب عن الذكر؟,ar,0.5,0.0,0.333,0.556,2.398,1,3.787
japanese_polar_1305,議論学は哲学の分野？,ja,-0.149,0.0,0.0,0.667,2.079,1,2.597
indonesian_polar_383,apakah fosil bisa dijadikan energi terbaharui?,id,-0.124,1.0,0.375,0.714,2.197,1,4.162
indonesian_content_11619,Kapan Pieter Willem Botha menjabat sebagai perdana menteri ?,id,0.506,0.0,0.5,0.875,2.303,0,4.184
arabic_content_1911,كم يكلف إجراء إختبار الحمض النووى في النمسا ؟,ar,0.222,0.0,0.333,0.625,2.303,0,3.483
english_content_7798,Why did Napoleon empire fall?,en,0.102,0.0,0.333,0.8,1.946,0,3.181
arabic_polar_1305,هل تعيش الذئاب في الاماكن شديدة البرودة ؟,ar,-0.291,0.0,0.333,0.714,2.197,1,2.953
finnish_polar_709,Onko Atlus japanilainen yhtiö?,fi,0.207,0.0,0.0,0.75,1.792,1,2.749
finnish_content_7063,Milloin Dustin James Boyd pelasi Barys Astanassa ensimmäisen kautensa?,fi,0.369,0.0,0.667,1.0,2.398,0,4.434
english_polar_833,Is coping a plea bargain admitting to guilt of a crime?,en,0.38,1.0,0.3,0.545,2.565,1,4.79
english_content_3328,How fast is a horse fly?,en,-0.148,0.0,0.0,0.667,2.079,0,2.598
english_polar_770,Does the Jewel of Seven Stars have a movie?,en,0.48,0.0,0.4,0.444,2.398,1,3.722
japanese_polar_258,ムハンマド風刺漫画掲載問題で作者は謝罪をした？,ja,0.415,0.0,0.6,0.667,2.639,1,4.321
russian_polar_914,Ира́кский Курдиста́н имеет свой парламент на март 2019?,ru,-0.35,0.0,0.6,0.75,2.303,1,3.303
korean_content_1802,한국의 박정희 대통령은 언제 죽었나요?,ko,0.027,0.0,0.4,1.0,1.946,0,3.373
finnish_content_13691,Mikä on Filippiinien kansallisruoka?,fi,-0.09,0.0,0.0,0.5,1.792,0,2.202
arabic_content_1645,ما هو الكونغرس الأمريكي؟,ar,-0.016,0.0,0.0,0.25,1.792,0,2.026
arabic_polar_725,هل الأخدر نوع من الأنواع القريبة من خطر الانقراض؟,ar,-0.375,0.0,0.0,0.667,2.398,1,2.69
english_content_6524,What is the race demographics of Santa Barbara?,en,-0.434,0.0,0.0,0.5,2.303,0,2.369
indonesian_polar_6,Apaakh kaset menggunakan pita magnetik?,id,-0.541,0.0,0.75,1.0,1.946,1,3.155
finnish_polar_961,Asuttivatko intiaanit Yhdysvaltoja ensin?,fi,0.207,0.0,0.5,1.0,1.792,1,3.499
finnish_polar_323,Onko Jämijärvi rehevä järvi?,fi,0.207,0.0,0.0,0.75,1.792,1,2.749
arabic_content_5486,ماهى عاصمة إسبانيا ؟,ar,-0.349,0.0,0.0,0.333,1.609,0,1.593
korean_content_2669,나치 강제수용소에 수용된 사람은 몇 명인가?,ko,-0.273,1.0,0.3,1.0,2.079,0,4.106
arabic_content_4253,في أي عام تأسست جامعة كامبرج؟,ar,-0.149,0.0,0.333,0.667,2.079,0,2.93
indonesian_polar_412,apakah paus balin mamalia?,id,-0.291,0.0,0.0,0.6,1.946,1,2.255
indonesian_content_6782,Dimana letak daerah Jepara ?,id,-0.636,0.0,0.0,0.75,1.792,0,1.906
english_polar_748,Can you grow tobacco in Tennessee?,en,-0.42,0.0,0.6,0.5,2.079,1,2.759
indonesian_content_10246,Berapa lama Belanda menjajah Indonesia?,id,0.114,0.0,0.667,1.0,1.946,0,3.727
arabic_content_20173,ما هي البروستات؟,ar,0.151,0.0,0.0,0.333,1.609,0,2.093
japanese_polar_1086,元禄文化の時代に、戦争はありましたか？,ja,-0.049,0.0,0.6,0.455,2.639,1,3.645
korean_content_4627,한국에서 가장 큰 장미축제는 무엇인가?,ko,-0.223,0.0,0.2,1.0,1.946,0,2.923
korean_polar_169,척추동물의 두뇌 진화는 대뇌를 포함한 전뇌의 부피증가가 특징적인가요?,ko,-0.223,1.0,0.375,1.0,2.303,1,4.455
japanese_polar_1229,ロンドンに地下鉄はある？,ja,0.051,0.0,0.4,0.667,2.079,1,3.197
english_polar_460,Was the bible ever written in Aramaic?,en,-0.187,0.0,0.8,0.571,2.197,1,3.381
japanese_content_4688,日本で高等教育が始まったのはいつ,ja,0.257,1.0,0.667,0.4,2.398,0,4.722
arabic_content_10770,متى حدثت الحرب الفرنسية البروسية؟,ar,-0.099,0.0,0.333,0.8,1.946,0,2.98
indonesian_content_386,Dimana kekaisaran Jepang dibentuk?,id,0.364,0.0,0.333,1.0,1.792,0,3.489
japanese_content_3627,久保帯人のデビュー作は何？,ja,-0.394,0.0,0.0,0.625,2.303,0,2.534
english_content_3077,Who had the largest army in the Battle of Nájera?,en,-0.037,0.0,0.5,0.5,2.485,0,3.448
arabic_content_6448,ما هي المزوية؟,ar,0.151,0.0,0.0,0.333,1.609,0,2.093
russian_content_2814,Какая высота самой высокой пирамиды майя?,ru,-0.178,0.0,0.0,0.667,2.079,0,2.568
korean_polar_158,단종은 현덕왕후의 아들인가요?,ko,-0.58,0.0,0.5,1.0,1.609,1,2.529
indonesian_polar_39,apakah dr.,id,-0.291,0.0,0.0,0.667,1.609,1,1.985
english_polar_1094,Is there tomato in mutter paneer?,en,-0.22,0.0,0.4,0.667,2.079,1,2.926
russian_content_9768,Как звали жену Курта Кобейна?,ru,-0.578,0.0,0.333,1.0,1.946,0,2.701
russian_polar_451,Лечит ли лаванда от бессонницы?,ru,0.078,0.0,0.6,0.6,1.946,1,3.224
finnish_polar_1145,Tarkoittaako symboli kirjainta?,fi,-0.293,0.0,0.333,1.0,1.609,1,2.649
arabic_polar_1001,هل هاجر الرسول محمد للحبشة؟,ar,-0.375,0.0,0.167,0.4,1.946,1,2.138
japanese_polar_154,日本でライフセービングに資格はある？,ja,0.551,0.0,0.6,0.571,2.197,1,3.919
finnish_polar_2227,Onko Suomessa koskaan uskottu luonnon taruolentoihin?,fi,0.007,0.0,0.667,0.833,2.079,1,3.586
arabic_content_3996,من كم حلقة يتألف مسلسل شرلوك هولمز؟,ar,-0.183,1.0,0.167,0.429,2.197,0,3.61
arabic_content_19389,من هو رئيس الجزائر ؟,ar,-0.016,0.0,0.0,0.5,1.792,0,2.276
japanese_content_3461,『スターゲイト アトランティス』の脚本担当はだれ,ja,-0.108,0.0,0.0,0.625,2.398,0,2.915
arabic_polar_1259,هل يسمح تملك الاراضي للاجانب في الجزائر؟,ar,0.375,0.0,0.5,0.625,2.303,1,3.803
english_content_7998,What is the tallest building in Bogota?,en,-0.315,0.0,0.0,0.429,2.197,0,2.311
korean_polar_228,스베티츠호벨리 대성당의 내부 벽에는 프레스코화들이 그려져 있나요?,ko,-0.747,0.0,0.5,0.857,2.197,1,2.807
english_content_7595,What is the oldest football club in Germany?,en,-0.005,0.0,0.0,0.5,2.303,0,2.798
indonesian_polar_279,apakah Garuda Indonesia mempunyai kerja sama dengan Airbus S.A.S?,id,-0.013,0.0,1.0,0.8,2.485,1,4.272
english_content_6443,Who did Rupert murder?,en,-0.148,0.0,0.333,0.5,1.792,0,2.477
indonesian_content_6467,Kapan ilmu anatomi ditemukan ?,id,0.364,0.0,0.333,1.0,1.792,0,3.489
finnish_polar_974,Onko OTP pelannut Veikkausliigassa?,fi,-0.46,0.0,0.333,0.75,1.792,1,2.415
japanese_polar_122,NHKは国営放送ですか？,ja,-0.349,0.0,0.0,0.5,2.079,1,2.23
japanese_polar_872,スキューバダイビングを行うには資格が必要ですか？,ja,-0.06,1.0,0.6,0.4,2.485,1,4.425
korean_content_3101,러시아의 첫번째 대통령은 누구인가요?,ko,-0.14,0.0,0.2,1.0,1.792,0,2.852
korean_content_11058,제주도에는 총 몇 개의 돌하르방이 있는가?,ko,0.527,0.0,0.0,1.0,2.079,0,3.606
japanese_polar_321,運動能力向上薬物は合法ですか？,ja,-0.235,0.0,0.0,0.625,2.303,1,2.693
finnish_polar_1845,Sisältävätkö hyönteiset paljon proteiinia?,fi,-0.127,0.0,0.333,1.0,1.792,1,2.998
english_polar_844,Are IP addresses based on location?,en,-0.42,0.0,0.6,0.667,2.079,1,2.926
english_polar_1143,Do the Aborigines have a verbal culture?,en,-0.187,0.0,0.4,0.571,2.197,1,2.981
indonesian_polar_134,apakah kerajaan tertua di kepulauan maluku?,id,-0.291,0.0,0.0,0.571,2.197,1,2.477
arabic_content_13228,"مامعنى ""السكران"" إصطلاحاً ؟",ar,1.651,0.0,0.0,1.0,1.946,0,4.597
japanese_content_1910,慕容 翰の父親の職業は何？,ja,-0.251,0.0,0.0,0.5,2.303,0,2.552
russian_polar_1235,Может Папа Римский отречься от престола?,ru,-0.322,1.0,0.3,0.833,2.079,1,3.89
arabic_content_15885,أين تقع منطقة نينغشيا؟,ar,-0.349,0.0,0.333,0.5,1.792,0,2.276
russian_polar_1104,Была ли Анастаси́я Алекса́ндровна Верти́нская женой Никиты Михалкова?,ru,0.078,0.0,0.0,0.75,2.303,1,3.131
japanese_content_3886,発見された中で、太陽系で一番小さい惑星は何,ja,0.265,1.0,0.0,0.5,2.773,0,4.538
english_polar_746,Is The Thick of It on-going?,en,0.98,0.0,0.4,0.429,2.303,1,4.112
russian_polar_84,Герма́нское гражда́нское уложе́ние повлияло на частное право в России?,ru,-0.297,0.0,0.4,0.778,2.398,1,3.279
korean_polar_368,ROM 이미지는 임베디드 컴퓨터용인가요?,ko,-0.747,0.0,0.5,0.75,1.792,1,2.295
arabic_content_1608,في أي عام تأسست الإمبراطورية البريطانية؟,ar,-0.149,0.0,0.333,0.833,2.079,0,3.096
indonesian_content_856,Berapa jumlah sungai yang berada di wilayah DKI Jakarta ?,id,-0.261,1.0,0.333,0.778,2.398,0,4.248
russian_polar_675,Был ли взломан код Пентагона?,ru,-0.672,0.0,0.6,0.6,1.946,1,2.474
russian_polar_505,Эксплуатируют ли НК-12 в 2019 году?,ru,0.245,0.0,0.6,0.571,2.197,1,3.613
korean_content_613,일본에서 가장 긴 지하철은 무엇인가?,ko,-0.223,0.0,0.2,1.0,1.946,0,2.923
english_polar_63,Is Karate a sport in the Olympics?,en,-0.02,0.0,0.0,0.429,2.197,1,2.606
russian_content_8243,Когда был основан город Ки́мры?,ru,-0.328,0.0,0.5,0.8,1.946,0,2.918
japanese_polar_1012,岡山市では路面電車が走っていますか？,ja,0.142,1.0,0.4,0.5,2.639,1,4.681
finnish_polar_2158,Periytyykö pituus vanhemmilta lapsille?,fi,-0.127,0.0,0.333,1.0,1.792,1,2.998
arabic_polar_682,هل يعيش دوري أوراسي في أوروبا؟,ar,-0.025,0.0,0.333,0.5,2.079,1,2.887
finnish_content_13053,Missä ensimmäinen Eurovision järjestettiin?,fi,-0.09,0.0,0.333,0.75,1.792,0,2.785
arabic_content_10603,من هو أندرياس فيزاليوس ؟,ar,-0.016,0.0,0.0,0.0,1.792,0,1.776
arabic_polar_721,هل الكتابات على الجواز الجزائري فرنسية ؟,ar,-0.225,0.0,0.0,0.667,2.079,1,2.521
indonesian_polar_50,apakah Clair Cameron Patterson masih hidup?,id,0.543,0.0,0.75,0.857,2.197,1,4.347
english_polar_518,Did Jews build the pyramids?,en,-0.52,0.0,0.4,0.6,1.946,1,2.426
korean_polar_252,근육에 자극을 가하면 먼저 근섬유 막에 흥분이 생기나요?,ko,0.206,0.0,1.0,0.875,2.303,1,4.384
russian_polar_1688,До́миник Га́шек занимается благотворительностью?,ru,-0.588,0.0,0.4,1.0,1.792,1,2.604
indonesian_content_2743,Apa yang dimaksud dengan Zaman Batu ?,id,-0.236,1.0,0.333,0.5,2.079,0,3.676
finnish_polar_2134,Oliko Mantineia useiden taisteluiden paikka?,fi,0.457,0.0,0.0,0.8,1.946,1,3.203
arabic_polar_1560,هل تتم ممارسة الصيام في الديانة الهندوسية؟,ar,-0.291,0.0,0.167,0.714,2.197,1,2.787
korean_polar_103,오픈스택은 우분투와 레드햇 배포판에 포함되어 있나요?,ko,0.12,0.0,0.5,0.667,2.079,1,3.366
indonesian_polar_356,apakah ada populasi manusia di Pulau Selaru?,id,-0.362,0.0,0.5,0.75,2.303,1,3.191
indonesian_content_4892,berapa lamakh proses pembuatan drama seri Heroes?,id,-0.636,0.0,0.0,1.0,2.197,0,2.561
arabic_content_4448,متى عاش هاري سانت جون بريدجر فيلبي؟,ar,0.936,0.0,0.417,0.25,2.303,0,3.906
japanese_content_5034,チェンバロが初めて日本に来たのはいつ,ja,0.479,1.0,0.833,0.4,2.398,0,5.11
indonesian_polar_280,apakah Hidayat Martaatmaja pernah menikah?,id,0.409,0.0,0.75,0.833,2.079,1,4.071
finnish_content_7959,Milloin stoalaisuutta harjoitettiin?,fi,-0.256,0.0,0.333,1.0,1.609,0,2.686
japanese_polar_822,スペインにはプロのサッカーリーグがありますか？,ja,0.251,0.0,0.6,0.455,2.565,1,3.871
russian_polar_1217,Бывали ли Creedence Clearwater Revival с концертом в России?,ru,0.078,0.0,0.6,0.333,2.398,1,3.409
japanese_content_4978,リンパ球を発見したのは誰,ja,0.41,1.0,0.5,0.333,2.303,0,4.546
finnish_polar_2206,Onko Tukholmaa pommitettu sotien aikaan?,fi,-0.293,0.0,0.5,0.8,1.946,1,2.953
finnish_content_7568,Missä puolueessa Mario Scelba oli?,fi,-0.256,0.0,0.0,0.6,1.946,0,2.29
english_polar_223,Is percutaneous coronary intervention safe?,en,-0.02,0.0,0.0,0.8,1.946,1,2.726
russian_content_2412,Что добывают в Солика́мске?,ru,-0.244,0.0,0.333,0.5,1.792,0,2.381
arabic_polar_248,هل تحالفت الحكومة السورية مع السعودية لقمع المظاهرات؟,ar,0.375,0.0,0.5,0.625,2.303,1,3.803
russian_polar_978,Был ли «Звёздные врата SG-1» переведен на русский язык?,ru,1.078,0.0,0.8,0.556,2.565,1,4.999
english_content_8862,How many people died during the Second Seminole War?,en,0.102,0.0,0.333,0.778,2.398,0,3.611
japanese_polar_869,日本でもワインの生産は行われていますか？,ja,0.468,1.0,0.4,0.385,2.708,1,4.961
finnish_polar_1373,Onko Blastaar superroisto Marvel-kustantamon sarjakuvissa?,fi,-0.293,0.0,0.0,0.8,1.946,1,2.453
arabic_content_8975,متى تاسست مؤسسة الاتصالات السورية؟,ar,-0.099,0.0,0.333,0.8,1.946,0,2.98
finnish_polar_1551,Monesko Yhdysvaltain presidentti Jimmy Carter oli?,fi,-0.393,0.0,0.0,0.667,2.079,1,2.353
japanese_polar_544,ロシア革命後、ロマノフ一族の財産は全て没収されましたか？,ja,0.551,0.0,0.8,0.533,2.89,1,4.774
russian_polar_1739,Был ли Пётр Конашевич-Сагайда́чный меценатом православных школ?,ru,0.364,1.0,0.0,0.75,2.398,1,4.512
korean_content_6634,양성평등이 의미하는 것은 무엇인가?,ko,-0.473,1.0,0.2,1.0,1.792,0,3.519
japanese_polar_585,シモン・ボリバルは革命家？,ja,-0.349,0.0,0.0,0.667,2.079,1,2.397
arabic_content_18523,أين تقع بلدة المزيريب؟,ar,-0.349,0.0,0.333,0.75,1.792,0,2.526
english_content_4645,How expensive is it to live in Lithuania?,en,-0.434,1.0,0.667,0.5,2.303,0,4.036
finnish_content_5258,Missä päin Ruotsia Strömma sijaitsee?,fi,0.244,0.0,0.5,0.6,1.946,0,3.29
indonesian_polar_382,Apakah tumor bisa diobati ?,id,0.209,0.0,0.5,0.6,1.946,1,3.255
arabic_content_13688,متى يحدث الانهمار النيزكي كوادرانتيدس؟,ar,-0.099,0.0,0.333,0.2,1.946,0,2.38
japanese_content_6014,雲仙岳が噴火した最古の記録はいつ,ja,-0.165,1.0,0.167,0.455,2.485,0,3.942
indonesian_content_8431,berapakah wilayah kekuasaan Kesultanan Demak?,id,-0.436,0.0,0.0,0.833,2.079,0,2.476
arabic_polar_1264,هل يبدأ أسبوع الآلام بيوم أحد الشعانين؟,ar,-0.196,0.0,0.333,0.75,2.303,1,3.19
japanese_polar_267,コンピュータゲームに依存性はある？,ja,-0.116,0.0,0.4,0.714,2.197,1,3.195
russian_content_9198,Почему была создана «Армия Андерса»?,ru,-0.078,0.0,0.5,0.8,2.197,0,3.419
indonesian_polar_300,Apakah jamu secara medik adalah minuman yang sehat?,id,0.459,0.0,0.0,0.556,2.398,1,3.413
arabic_polar_66,هل سائل العصارة الصفرواية مر الطعم؟,ar,-0.225,0.0,0.0,0.833,2.079,1,2.687
japanese_content_4505,みどりの券売機に愛称を付けたのは誰,ja,0.135,0.0,0.833,0.364,2.485,0,3.817
japanese_polar_536,テニス、ウィンブルドン選手権はリーグ戦？,ja,-0.092,0.0,0.0,0.75,2.303,1,2.961
korean_content_5026,"크리스토퍼 놀란의 영화에서, 하비덴트의 직업은 무엇인가?",ko,0.327,0.0,0.4,1.0,2.197,0,3.924
finnish_polar_1723,Onko Suomen laivastolla saattuetukialusta?,fi,-0.46,0.0,0.0,0.75,1.792,1,2.082
arabic_content_9776,متى تأسست الوكالة العالمية لمكافحة المنشطات؟,ar,-0.016,0.0,0.333,0.714,2.197,0,3.228
korean_polar_349,동예는 제천 행사인가요?,ko,-0.58,0.0,0.5,1.0,1.609,1,2.529
russian_content_1713,Сколько входило стран в состав Содружества Независимых Государств в момент его создания?,ru,0.513,0.0,0.5,0.667,2.639,0,4.319
russian_polar_1701,Сын Алиеноры Аквитанской стал королём?,ru,-0.422,0.0,0.4,1.0,1.946,1,2.924
indonesian_content_914,berapakah jumlah pesantren didunia?,id,0.364,0.0,0.333,0.8,1.946,0,3.443
indonesian_content_10064,Siapa itu Tu Di Gong ?,id,-0.136,0.0,0.0,0.4,1.946,0,2.21
russian_content_5717,Когда был построен Иерусалимский собор?,ru,-0.078,0.0,0.5,0.8,1.946,0,3.168
japanese_content_1933,第一回ワールド・ベースボール・クラシックの優勝国はどこ,ja,1.573,0.0,0.0,0.571,2.708,0,4.852
japanese_polar_170,ジャック・ニコルソンはアカデミー賞を受賞したことがある？,ja,-0.116,1.0,0.3,0.538,2.708,1,4.43
russian_content_2595,Сколько университетов есть в Самаре на март 2019?,ru,-0.006,0.0,0.0,0.5,2.303,0,2.797
finnish_content_3514,Mikä on laiton uhkaus?,fi,-0.09,0.0,0.0,0.5,1.792,0,2.202
korean_content_10795,2019년까지 가장 많은 프로야구선수를 배출한 일본의 고등학교는 어디인가?,ko,0.098,1.0,0.3,1.0,2.303,0,4.701
english_polar_859,Did Christopher William Clayton Hutton have kids?,en,0.647,0.0,0.4,0.857,2.197,1,4.101
russian_polar_523,Есть атмосфера на Меркурие?,ru,-0.588,0.0,0.2,0.75,1.792,1,2.154
korean_polar_325,모노프탈모스는 애꾸눈이란 뜻인가요?,ko,-0.58,1.0,0.25,1.0,1.609,1,3.279
indonesian_content_9577,siapakah karakter utama dalam serial anime Mobile Suit Gundam?,id,-0.192,0.0,0.0,0.7,2.485,0,2.993
arabic_polar_551,هل كان ديكارت من أنصار نظرية أنه ليس للحيوانات أرواح؟,ar,-0.079,1.0,0.333,0.5,2.639,1,4.393
arabic_content_5183,من هي العائلة التي وحدة الصين بعد حقبة الممالك المتحاربة ؟,ar,0.095,0.0,0.0,0.6,2.485,0,3.18
indonesian_content_3174,siapakah pencipta Phineas dan Ferb?,id,-0.236,0.0,0.0,0.5,2.079,0,2.343
english_content_2948,How much does the secretary of health and human services make?,en,1.252,0.0,0.333,0.636,2.565,0,4.786
russian_content_881,Когда состоялась Рижская наступательная операция?,ru,0.172,0.0,0.333,1.0,1.946,0,3.451
russian_polar_358,Теодо́р Джон Кази́нски сидел в тюрьме?,ru,-0.122,0.0,0.4,0.833,2.079,1,3.19
indonesian_content_6746,Berapa populasi Sichuan?,id,-0.636,0.0,0.0,1.0,1.609,0,1.973
indonesian_content_2168,berapakah anggota Raelian tahun 2015?,id,-0.236,0.0,0.0,0.667,2.079,0,2.51
arabic_polar_236,هل المدينة القديمة في ليون مصنفة ضمن مواقع التراث العالمي؟,ar,0.487,0.0,0.0,0.6,2.485,1,3.572
russian_polar_655,Был ли Гай Саллю́стий Крисп членом римского сената?,ru,0.65,0.0,0.0,0.75,2.303,1,3.703
finnish_polar_385,Voiko Bangkokissa ostaa asunnon?,fi,-0.46,0.0,0.333,0.75,1.792,1,2.415
russian_content_11922,В скольких войнах участвовал Никий?,ru,-0.328,0.0,0.333,0.8,1.946,0,2.751
finnish_polar_525,Oliko Iasonin puoliso Medeia?,fi,-0.127,0.0,0.0,0.75,1.792,1,2.415
russian_polar_1680,Бывает ли изжога у беременных?,ru,0.078,0.0,0.6,0.6,1.946,1,3.224
finnish_content_1704,Missä Suomessa aloitettiin käyttämään valokuitua ensimmäisenä?,fi,-0.556,1.0,0.333,0.833,2.079,0,3.689
indonesian_polar_337,apakah Bioskop Metropole adalah bioskop tertua di Indonesia?,id,0.209,0.0,0.0,0.667,2.398,1,3.274
indonesian_polar_350,Apakah Ya’juj dan Ma’juj manusia?,id,-0.391,0.0,0.0,0.667,2.079,1,2.355
english_polar_430,Did Romania have monarchy?,en,-0.687,0.0,0.4,0.75,1.792,1,2.255
arabic_content_6695,ما هي اللغة الحميرية؟,ar,-0.016,0.0,0.0,0.5,1.792,0,2.276
indonesian_polar_188,apakah Slamet Gundono masih hidup?,id,0.409,0.0,0.75,0.833,2.079,1,4.071
korean_content_10182,세상에서 가장 긴 철도는 무엇인가?,ko,-0.223,0.0,0.2,1.0,1.946,0,2.923
indonesian_content_11958,berapakah jumlah kecamatan di Nusa Tenggara Timur?,id,-0.208,0.0,0.0,0.75,2.303,0,2.845
indonesian_content_4364,bahasa apakah yang digunakan di Bourgogne?,id,0.03,1.0,0.333,0.429,2.197,0,3.989
japanese_content_4622,サジェストペディア を提唱したのは誰,ja,0.606,0.0,0.667,0.25,2.197,0,3.72
korean_polar_312,노브고로드 공화국 입법은 베체 체제인가요?,ko,-0.83,0.0,0.5,1.0,1.946,1,2.616
korean_content_8869,중국에서 가장 큰 다리는 무엇인가?,ko,-0.223,0.0,0.2,1.0,1.946,0,2.923
arabic_polar_1894,هل أحد طرق انتقال مرض (التهاب الكبد الوبائي أ) عن طريق تناول الطعام غير المطهي؟,ar,0.804,0.0,0.0,0.8,2.944,1,4.548
arabic_polar_1688,هل أسس أسامة بن لادن تنظيم طالبان؟,ar,0.042,0.0,0.333,0.571,2.197,1,3.143
english_polar_592,Do all males have to enlist in the Korean Aarmy?,en,-0.02,1.0,0.4,0.5,2.485,1,4.365
korean_polar_284,용수철이란 이름은 탄성체의 복원력을 빗대어 붙여진 이름인가요?,ko,-0.413,1.0,0.25,0.857,2.197,1,3.891
japanese_polar_133,マンモス は毛に覆われていた？,ja,-0.235,1.0,0.2,0.5,2.303,1,3.768
korean_polar_160,미토콘드리아에는 호흡 사슬이 있나요?,ko,-0.413,0.0,0.5,1.0,1.792,1,2.879
english_polar_599,Were the Japanese put in internment camps in the USA?,en,-0.131,0.0,0.6,0.5,2.485,1,3.454
