unique_id,text,language,type,avg_links_len,avg_max_depth,avg_subordinate_chain_len,avg_verb_edges,lexical_density,n_tokens,subordinate_proposition_dist,verbal_head_per_sent
ru_polar_137,Есть ли автоматические кормилки-поилки для животных?,russian,polar,-0.50,4.00,0.00,0.40,0.71,2.30,0.00,1.00
ru_polar_138,Нужны ли в жизни школьные отметки?,russian,polar,0.04,2.00,0.00,0.00,0.67,2.08,0.00,0.00
ru_polar_139,И можно ли это излечить?,russian,polar,-0.66,2.00,1.00,0.40,0.40,1.95,3.93,2.00
ru_polar_140,Вопрос такой: можно ли с ней не гулять?,russian,polar,-0.16,4.00,1.00,0.40,0.38,2.40,4.62,2.00
ru_polar_141,"Но из инструментов есть только шуруповерт, достаточно ли его будет?",russian,polar,-0.16,4.00,0.00,0.60,0.40,2.56,0.00,1.00
ru_polar_142,"И правилен ли перевод предложения ""Я бегу на помощь подруге""?",russian,polar,-0.16,3.00,0.00,0.60,0.60,2.64,0.00,1.00
ru_polar_143,Пойдут ли трещины дальше или можно не переживать по этому поводу?,russian,polar,-0.06,4.00,1.00,0.53,0.55,2.56,3.93,3.00
ru_polar_144,Будет ли это работать?,russian,polar,-0.16,1.00,0.00,0.40,0.25,1.79,0.00,1.00
ru_polar_145,"Продолжать ли делать такие ""процедуры"", или их уже никак?",russian,polar,0.46,3.00,1.00,0.40,0.56,2.64,3.93,2.00
ru_polar_146,Есть Ли Нефть В Атырау?,russian,polar,-0.16,2.00,0.00,0.60,0.60,1.95,0.00,1.00
ru_polar_147,Приятно ли вам?,russian,polar,-0.66,1.00,0.00,0.00,0.33,1.61,0.00,0.00
ru_polar_148,Возможно ли записать НА МАГНИТОФОН с компьютера ?,russian,polar,-0.33,3.00,1.00,0.40,0.57,2.20,4.62,1.00
ru_polar_149,"Если я нанесу капли воды на листок, получит ли он эту воду?",russian,polar,0.02,3.00,0.00,0.80,0.50,2.71,0.00,2.00
ru_polar_150,"А есть ли ещё русские названия животных родственные английским словам, например серна / horn (по аналогии с сердце heart, солома haulm, сему him, семья home с / h соответствие)?",russian,polar,0.69,9.00,0.00,0.80,0.54,3.61,0.00,1.00
ru_polar_151,"Может ли быть пролог первой главой в фэнтези книге или сначала должен идти пролог, а потом главы?",russian,polar,0.65,3.00,1.00,0.40,0.71,3.00,4.21,3.00
ru_polar_152,Что ей писать и стоит ли вообще?,russian,polar,-0.66,2.00,0.00,0.60,0.43,2.20,0.00,2.00
ru_polar_153,"Мне сказали что от корма сухого, у вислоухих шотландцев развивается мочекаменная болезнь, поэтому решил узнать, правда ли это и чем тогда кормить кошку?",russian,polar,0.88,5.00,1.00,0.56,0.65,3.33,4.21,5.00
ru_polar_154,"Я хочу полететь в другой город на 6 дней, смогу ли я потом взять билет обратно?",russian,polar,0.37,4.00,1.00,0.55,0.56,2.94,4.21,4.00
ru_polar_155,Не нужно ли мне будет сидеть потом 2х недельный карантин дома?,russian,polar,0.24,3.00,1.00,0.60,0.55,2.56,3.93,2.00
ru_polar_156,Нормально ли такое поведение женщины?,russian,polar,-0.91,3.00,0.00,0.00,0.60,1.95,0.00,0.00
ru_polar_157,Пустят ли меня если мне нет данного возраста?,russian,polar,-0.16,3.00,1.00,0.60,0.50,2.30,3.93,2.00
ru_polar_158,Можно ли убрать эти щелчки без заземления?,russian,polar,-0.33,3.00,1.00,0.40,0.57,2.20,3.93,2.00
ru_polar_159,"Но стоя просто на поверхности Земли, нас ни туда, ни сюда не уносит, значит ли это, что у Земли четко фиксированная линейная скорость вращения?",russian,polar,1.44,4.00,1.00,0.55,0.54,3.40,4.33,4.00
ru_polar_160,Может ли такое напряжение навредить другим электроприборам?,russian,polar,-0.16,3.00,1.00,0.40,0.57,2.20,3.93,2.00
ru_polar_161,Есть ли какие либо ИНЫЕ способы прочесть эту кассету?,russian,polar,-0.29,4.00,1.00,0.30,0.44,2.40,3.93,2.00
ru_polar_162,"Подскажите, у кошки болит лапа, хромает, есть ли на снимке отклонения?",russian,polar,0.24,4.00,0.00,0.40,0.73,2.77,0.00,4.00
ru_polar_163,"У нас есть проблема: мы не можем решить, может ли пешка пропустить врага и пойти вперёд, или он обязан съесть фигуру?",russian,polar,0.09,6.00,1.00,0.43,0.62,3.26,4.33,7.00
ru_polar_164,"Если мне будет мастурбировать чувак, пока я буду смотреть на нюдесы его девушки, будет ли он считаться куколдом?",russian,polar,0.37,3.00,1.00,0.80,0.39,3.09,3.93,3.00
ru_polar_165,Нужно ли сохранять такие цветы на зиму или выбрасывать?,russian,polar,0.09,3.00,1.00,0.40,0.56,2.40,4.62,2.00
ru_polar_166,Стоит ли расставаться после долгих отношений?,russian,polar,-0.36,3.00,1.00,0.30,0.67,2.08,3.93,2.00
ru_polar_167,Можно ли прийти в турагентство и спросить набирают ли они группу для такого полета?,russian,polar,-0.09,5.00,1.00,0.50,0.50,2.77,4.21,4.00
ru_polar_168,"1.Заменить другим типом. диодом к примеру, 2.так ли нужен R3 во второй схеме, 3.номиналы резисторов на обеих схемах критичны к изменению?",russian,polar,1.53,4.00,0.00,0.80,0.54,3.47,0.00,1.00
ru_polar_169,"Чувствовали ли вы, что на вас все смотрят?",russian,polar,0.55,3.00,1.00,0.60,0.25,2.40,3.93,2.00
ru_polar_170,Это нормально ли?,russian,polar,-1.16,1.00,0.00,0.00,0.33,1.61,0.00,0.00
ru_polar_171,"К примеру, получаешь ее на дом 12 числа, если переводишь на банковскую карту [счёт] то должен ли остаться то же число получения?",russian,polar,0.69,4.00,1.00,0.47,0.59,3.33,4.21,3.00
ru_polar_172,Обычно его говорили со значением хорошо сделанной работы (ладно сшитая одежда) Использовалось ли оно тогда как ответ на просьбу?,russian,polar,0.28,4.00,1.00,0.45,0.63,3.14,3.93,4.00
ru_polar_173,"Правда ли то, что если мужчина не готов бесцельно тратить свои жизненные силы и ресурсы на паразитов, женщинам для отношений он будет не интересен?",russian,polar,2.40,7.00,1.00,0.60,0.50,3.33,4.62,2.00
ru_polar_174,Правильно ли сформулировано?,russian,polar,-0.66,2.00,0.00,0.20,0.67,1.61,0.00,1.00
ru_polar_175,Где можно найти и скачать этюд ли минор Зектинг?,russian,polar,-0.54,4.00,1.00,0.33,0.89,2.40,3.93,3.00
ru_polar_176,И можно ли обучиться на переводчика заочно?,russian,polar,-0.50,3.00,1.00,0.50,0.57,2.20,3.93,2.00
ru_polar_177,"Что это за песня, можно ли где-то прочитать её текст и перевод?",russian,polar,-0.44,5.00,1.00,0.40,0.50,2.71,4.62,2.00
ru_polar_178,Так ли это?,russian,polar,-0.66,1.00,0.00,0.00,0.33,1.61,0.00,0.00
ru_polar_179,"Могут ли привлечь к ответственности, если написать слово задом наперед слово ""Дурак""?",russian,polar,-0.16,4.00,2.00,0.53,0.75,2.83,4.21,3.00
ru_polar_180,"Могут ли посадить за то, что человек занимается перепродажей собак?",russian,polar,-0.50,5.00,1.00,0.40,0.60,2.56,4.21,3.00
ru_polar_181,Я имею ввиду. могут ли сейчас взять кредит на человека только по фото паспорта?,russian,polar,-0.16,6.00,2.00,0.47,0.64,2.83,4.21,3.00
ru_polar_182,Будет ли счастье в семье разлучницы или разлучника?,russian,polar,-0.16,3.00,0.00,0.00,0.50,2.30,0.00,1.00
ru_polar_183,"Поможет ли это снизить уровень преступности, не приведёт ли это к большим проблемам?",russian,polar,0.17,3.00,1.00,0.60,0.54,2.77,3.93,3.00
ru_polar_184,Имел ли кто-нибудь такое оружие (пусть даже травматическое)?,russian,polar,0.55,2.00,0.00,0.80,0.38,2.48,0.00,1.00
ru_polar_185,"Можно ли утверждать, что во всех инерциальных системах отсчёта уравнения движения тела записываются одинаково?",russian,polar,0.84,7.00,2.00,0.40,0.71,2.83,4.21,3.00
ru_polar_186,"И если задумались сейчас, хочется ли вам остановиться спонсировать этих людей?",russian,polar,-0.16,4.00,1.50,0.45,0.55,2.64,4.33,4.00
ru_polar_187,Выпарится ли влага из всего этого при включении кабеля?,russian,polar,0.34,2.00,0.00,0.80,0.44,2.40,0.00,1.00
ru_polar_188,И есть ли у вас знакомые?,russian,polar,-0.16,2.00,0.00,0.80,0.33,2.08,0.00,1.00
ru_polar_189,"И ещё Как долго остаётся в памяти прочитанное, можете ли вы вспомнить о чем книга спустя полгода или месяц?",russian,polar,-0.11,6.00,1.00,0.45,0.55,3.14,4.62,4.00
ru_polar_190,"Есть ли в США подобие ЦУМа, и можно ли заказывать вещи из московского цума за границу?",russian,polar,0.30,4.00,1.00,0.67,0.62,2.94,3.93,3.00
ru_polar_191,Будем ли мы вместе несмотря на запрет?,russian,polar,-0.16,3.00,0.00,0.00,0.43,2.20,0.00,1.00
ru_polar_192,Добьётся ли такой политик каких-то высот и сможет ли за счёт своего положения раскрутить свою партию?,russian,polar,0.17,5.00,1.00,0.60,0.50,2.89,3.93,3.00
ru_polar_193,"'Правда ли, что можно умереть от дистиллированной воды?' и 'Умрёт ли человек если выпьет её 7-8 литров за день? '",russian,polar,0.41,6.00,1.50,0.36,0.50,3.37,4.62,5.00
ru_polar_194,Можно ли поехать детям 13-ти лет в москву без родителей ?,russian,polar,-0.39,4.00,1.00,0.40,0.60,2.48,3.93,2.00
ru_polar_195,Похожи ли спальни в квартире и гостинице?,russian,polar,-0.33,3.00,0.00,0.00,0.57,2.20,0.00,0.00
ru_polar_196,велик ли улов? --,russian,polar,-0.66,1.00,0.00,0.00,0.67,1.79,0.00,0.00
ru_polar_197,так здесь же святой тропарь Армия ворон прилетела на бронислава они чинят башмак шьют портки завязывают часы сидел грозный сыч снял капор кивал ли он на врагов?,russian,polar,0.68,4.00,0.00,0.43,0.78,3.37,0.00,7.00
ru_polar_198,ты кудесник мне ответь сон ли это?,russian,polar,-0.50,2.00,0.00,0.80,0.43,2.20,0.00,1.00
