unique_id,text,language,avg_links_len,avg_max_depth,avg_subordinate_chain_len,avg_verb_edges,lexical_density,n_tokens,question_type,complexity_score
russian_content_2694,Какая императрица ввела в России моду ставить ёлку на Рождество?,ru,0.124,0.375,0.333,0.417,0.7,0.171,0,2.12
russian_polar_1211,Юрий Сергеевич Саве́нко противник использования психиатрии в политических целях?,ru,0.35,0.4,0.0,0.0,0.889,0.333,1,1.972
russian_content_48,Как звали последнего короля Греции?,ru,0.056,0.125,0.0,0.333,1.0,0.049,0,1.563
russian_polar_1161,Был Тит Фла́вий Домициа́н женат?,ru,0.6,0.2,0.0,0.0,0.8,0.111,1,1.711
russian_polar_399,Было ли радио в дореволюционной России?,ru,0.48,0.2,0.0,0.6,0.667,0.167,1,2.113
russian_polar_279,Является ли левшой Бе́кхэм?,ru,0.4,0.0,0.0,0.6,0.75,0.056,1,1.806
russian_content_8165,Сколько типов склонения есть в русском языке?,ru,0.149,0.125,0.0,0.0,0.571,0.098,0,0.943
russian_polar_788,Были у Карла О́сиповича Оде́-де-Сио́н крепостные?,ru,0.333,0.2,0.0,0.0,0.714,0.222,1,1.47
russian_polar_1572,Есть ли слоны в России?,ru,0.4,0.2,0.0,0.6,0.6,0.111,1,1.911
russian_content_12718,Какая власть была в Харькове до того как пришла советская власть во время гражданской войны?,ru,0.208,0.5,0.333,0.5,0.533,0.293,0,2.367
russian_content_1205,Кому была присуждена первая Нобелевская премия?,ru,0.179,0.125,0.0,0.5,0.667,0.073,0,1.544
russian_content_587,От какого лица игра The Walking Dead: The Game?,ru,0.252,0.25,0.0,0.0,0.222,0.171,0,0.895
russian_content_2177,Когда появился Лобби́зм в Росси́и?,ru,0.112,0.125,0.0,0.5,0.8,0.049,0,1.586
russian_polar_1665,Есть ли в России уличные бои?,ru,0.48,0.2,0.0,0.6,0.667,0.167,1,2.113
russian_polar_689,Был Царь Сау́л женат?,ru,0.4,0.2,0.0,0.0,0.75,0.056,1,1.406
russian_content_1873,Какой язык является самым древним?,ru,0.056,0.125,0.0,0.333,0.6,0.049,0,1.163
russian_content_7751,Когда Финляндия объявила войну нацистской Германии?,ru,0.134,0.125,0.0,0.667,0.833,0.073,0,1.832
russian_polar_872,Преподавал ли Илья Фаддеевич Цион в Санкт-Петербургском университете?,ru,0.514,0.2,0.0,0.6,0.75,0.278,1,2.342
russian_polar_1321,Принимали в битве за Баку участие русские военные?,ru,0.686,0.4,0.0,0.6,0.75,0.278,1,2.713
russian_content_648,"Как звали ""Мать Драконов"" по роману «Игра престолов»?",ru,0.224,0.25,0.0,0.5,0.875,0.22,0,2.068
russian_content_11542,За какую команду выступал Валентино Росси?,ru,0.045,0.125,0.0,0.333,0.667,0.073,0,1.243
russian_content_4521,Какая столица Конго?,ru,0.0,0.0,0.0,0.0,0.667,0.0,0,0.667
russian_content_7132,Сколько золотых медалей завоевала Россия на летних Олимпийских играх 2016?,ru,0.199,0.125,0.0,0.5,0.8,0.171,0,1.795
russian_polar_300,Joy Division распалась?,ru,0.2,0.2,0.0,0.2,0.333,0.0,1,0.933
russian_polar_1262,Линкор «Айова» воевал в войне в Персидском заливе?,ru,0.457,0.4,0.0,0.4,0.75,0.389,1,2.396
russian_polar_774,"Был ли экранизирован роман ""Истазия""?",ru,0.2,0.2,0.0,0.6,0.6,0.222,1,1.822
russian_content_6161,В каком году вышел сериал «Дружба — это чудо»?,ru,0.224,0.25,0.0,0.333,0.625,0.195,0,1.627
russian_content_2501,В какой стране исламского мира женщины получили право голосовать первыми?,ru,0.124,0.25,0.333,0.333,0.8,0.171,0,2.012
russian_polar_372,Есть ли море в Дагеста́не?,ru,0.4,0.2,0.0,0.6,0.6,0.111,1,1.911
russian_content_4912,Сколько видов животных есть в Иерусалимском библейском зоопарке на 1 января 2019?,ru,0.183,0.25,0.0,0.0,0.667,0.22,0,1.319
russian_polar_971,Изучали Средневеко́вую историогра́фию в вузах России в 2018?,ru,0.571,0.2,0.0,0.6,0.75,0.278,1,2.399
russian_content_11462,Какой бюджет был у «Неудержимые 2»?,ru,0.403,0.125,0.0,0.0,0.333,0.122,0,0.983
russian_content_7677,Сколько архитектурных сооружений создал Константи́н Степа́нович Ме́льников?,ru,0.075,0.125,0.0,0.333,0.857,0.098,0,1.488
russian_polar_775,Христо́дулос Цига́нтес - национальный герой Греции?,ru,0.3,0.2,0.0,0.0,1.0,0.167,1,1.667
russian_content_5826,Чем протестантизм отличается от лютеранства?,ru,0.112,0.125,0.0,0.5,0.6,0.049,0,1.386
russian_polar_1125,Является ли армянский язык самым древним в мире?,ru,0.4,0.4,0.0,0.6,0.625,0.278,1,2.303
russian_polar_897,Царь Сау́л - реальное историческое лицо?,ru,0.5,0.2,0.0,0.0,1.0,0.167,1,1.867
russian_polar_170,У еврея национальность определяется по матери?,ru,0.16,0.2,0.0,0.6,0.667,0.167,1,1.793
russian_content_11409,Когда начали изучать Биополитику в России?,ru,0.09,0.25,0.333,0.333,0.833,0.073,0,1.913
russian_content_3539,Почему индусы не едят говядину?,ru,0.168,0.0,0.0,0.667,0.8,0.049,0,1.683
russian_polar_1291,Был Марк Антоний женат?,ru,0.4,0.2,0.0,0.0,0.75,0.056,1,1.406
russian_polar_1160,Есть ли в Монреале метро?,ru,0.5,0.2,0.0,0.6,0.6,0.111,1,2.011
russian_content_9185,Когда был выпушен «Доктор Стрэндж»?,ru,0.112,0.125,0.0,0.5,0.8,0.098,0,1.635
russian_polar_1421,Предпосылки Февральской революции 1917 года в России были сформулированы до Первой Мировой войны?,ru,0.533,0.6,0.0,0.8,0.769,0.556,1,3.258
russian_content_4357,Сколько евреев проживало в Москве в 2018?,ru,0.149,0.125,0.0,0.5,0.571,0.098,0,1.443
russian_content_6845,Руководителем какой организации был Гео́ргий Гапо́н?,ru,0.269,0.125,0.0,0.0,0.667,0.073,0,1.133
russian_polar_1146,Имеет ли Ю́жно-Африка́нская Респу́блика ядерное оружие?,ru,0.48,0.2,0.0,0.6,0.833,0.167,1,2.28
russian_content_7932,Через сколько областей России протекает Волга?,ru,0.09,0.125,0.0,0.333,0.667,0.073,0,1.288
russian_content_10815,Сколько песен записано Ка́нье Ома́ри Уэ́стом на сегодняшний день?,ru,0.196,0.125,0.0,0.5,0.778,0.146,0,1.745
russian_polar_1295,Ло́ндонский метрополите́н служил бомбоубежищем в годы войны?,ru,0.133,0.2,0.0,0.6,0.857,0.222,1,2.013
russian_polar_499,Т-37А принимал участие в годы Второй Мировой войны?,ru,0.229,0.6,0.0,0.4,0.875,0.278,1,2.381
russian_polar_1117,Есть вампиры в преданиях древней Азии?,ru,0.24,0.4,0.0,0.4,0.833,0.167,1,2.04
russian_polar_392,Участвовали ли большие противолодочные корабли проекта 1134-Б во Второй мировой войне?,ru,0.691,0.6,0.0,0.6,0.75,0.556,1,3.196
russian_polar_1498,Получил Оскар «Чужой» Ридли Скотта?,ru,0.2,0.6,0.0,0.2,1.0,0.222,1,2.222
russian_polar_1032,Военная служба обязательна для мужчин в России?,ru,0.267,0.2,0.0,0.0,0.714,0.222,1,1.403
russian_content_11710,В каком году состоялся Гянджинский мятеж?,ru,0.09,0.125,0.0,0.333,0.667,0.073,0,1.288
russian_content_1302,Кому подчиняется КГБ?,ru,0.0,0.0,0.0,0.333,0.667,0.0,0,1.0
russian_content_7919,Сколько всего астероидов в По́ясе астеро́идов на март 2019?,ru,0.112,0.375,0.0,0.0,0.556,0.146,0,1.189
russian_content_2362,Сколько «Первый мститель» Джо Джонстона собрал в прокате в России всего?,ru,0.313,0.25,0.0,0.667,0.636,0.244,0,2.11
russian_content_6749,"Когда была основана команда ""Челси""?",ru,0.112,0.125,0.0,0.5,0.8,0.098,0,1.635
russian_content_6236,Как называется столица Республики Дагестан?,ru,0.0,0.25,0.0,0.333,1.0,0.049,0,1.632
russian_polar_734,Можно полностью излечить гипертони́ю?,ru,0.133,0.2,0.5,0.3,1.0,0.056,1,2.189
russian_polar_540,При Алексе́е I Комни́н было возрождение Византийской империи?,ru,0.4,0.4,0.0,0.0,0.75,0.278,1,1.828
russian_content_11731,Сколько есть видов патронов по назначению?,ru,0.134,0.25,0.0,0.167,0.667,0.073,0,1.291
russian_content_4343,Сколько лет прожил Пу́блий Корне́лий Та́цит?,ru,0.045,0.125,0.0,0.333,0.833,0.073,0,1.41
russian_polar_1732,Есть ли у Та́йсон Лю́к Фью́ри двоюродный брат-боксёр?,ru,0.629,0.2,0.0,0.8,0.75,0.278,1,2.656
russian_content_7726,Какой дворец на берегу Невы был подарен Екатериной Второй графу Орлову?,ru,0.157,0.25,0.0,0.667,0.727,0.195,0,1.996
russian_content_10367,"Почему Ка́спара Ха́узера называли ""Дитя Европы""?",ru,0.179,0.125,0.0,0.5,1.0,0.122,0,1.926
russian_content_2818,Где проходила битва за Москву в 1941-1942 гг.?,ru,0.224,0.25,0.0,0.5,0.75,0.122,0,1.846
russian_content_622,Сколько школ в селе Боровское в 2019 году?,ru,0.16,0.375,0.0,0.0,0.625,0.122,0,1.282
russian_content_6930,Когда было первое упоминание о Москве в хрониках?,ru,0.192,0.25,0.0,0.0,0.625,0.122,0,1.189
russian_content_10855,Гегель посещал Россию?,ru,0.0,0.0,0.0,0.333,1.0,0.0,0,1.333
russian_content_10401,Когда была написана легенда о Вильгельме Телле?,ru,0.075,0.25,0.0,0.5,0.714,0.098,0,1.636
russian_polar_1042,Алекса́ндр Васи́льевич Колча́к был руководителем Белого движения в России?,ru,0.4,0.2,0.0,0.0,0.778,0.333,1,1.711
russian_polar_1388,Брала ли Шарапова Большой шлем?,ru,0.4,0.2,0.0,0.6,0.8,0.111,1,2.111
russian_polar_1113,Смерть Митрополи́та Никола́я была естественной?,ru,0.3,0.4,0.0,0.0,0.8,0.111,1,1.611
russian_content_7538,Какой университет окончил Эдуард Китович Тхакушинов?,ru,0.045,0.125,0.0,0.333,0.833,0.073,0,1.41
russian_content_397,Что означает цвет орнамента на килте?,ru,0.09,0.25,0.0,0.333,0.667,0.073,0,1.413
russian_polar_97,У Рапануйцев была своя письменность?,ru,0.2,0.2,0.0,0.0,0.4,0.111,1,0.911
russian_polar_526,Лантано́иды применяют в медицине?,ru,0.133,0.2,0.0,0.4,0.75,0.056,1,1.539
russian_content_6074,Когда родился Ма́ксвелл?,ru,0.0,0.0,0.0,0.333,1.0,0.0,0,1.333
russian_content_23,Где находится штаб-квартира ЛГБТ-движения России?,ru,0.045,0.25,0.0,0.333,1.0,0.073,0,1.701
russian_content_6754,Как назывался первый шведский танк?,ru,0.168,0.125,0.0,0.333,1.0,0.049,0,1.675
russian_content_2718,В скольких полярных экспедициях участвовал Ре́джинальд Кётлиц?,ru,0.112,0.125,0.0,0.333,0.857,0.098,0,1.525
russian_content_2841,Когда в России появился первый маммограф?,ru,0.134,0.125,0.0,0.5,0.667,0.073,0,1.499
russian_polar_240,О жизни Го́вард Ро́бард Хьюз был снят фильм?,ru,0.286,0.4,0.0,0.6,0.75,0.278,1,2.313
russian_polar_1227,Отмечают день Святого Патрика в России?,ru,0.32,0.4,0.0,0.2,0.833,0.167,1,1.92
russian_polar_1452,Были ли случаи столкновения с другими судами у «Оли́мпика»?,ru,0.5,0.6,0.0,0.0,0.444,0.444,1,1.989
russian_polar_1594,Был ли Никола́й Евге́ньевич Ма́рков депутатом?,ru,0.8,0.2,0.0,0.0,0.667,0.167,1,1.833
russian_content_11887,Сколько существует экранизаций фантастической повести братьев А. и Б.,ru,0.084,0.625,0.0,0.167,0.778,0.122,0,1.775
russian_content_6530,Когда был заложен Бугульминский Казанско-Богородицкий монастырь?,ru,0.261,0.125,0.0,0.5,0.857,0.098,0,1.841
russian_content_6965,Какое образование полусил Евге́ний Алексе́евич Фёдоров?,ru,0.045,0.125,0.0,0.333,0.833,0.073,0,1.41
russian_content_6799,Как звали Архиепи́скопа Гаврии́ла при рождении?,ru,0.134,0.125,0.0,0.5,0.833,0.073,0,1.666
russian_polar_1329,Используют осоку в фармакологии?,ru,0.267,0.2,0.0,0.4,0.75,0.056,1,1.672
russian_content_3416,Сколько больших противолодочных кораблей проекта 1134-А находится на вооружении России на апрель 2019?,ru,0.205,0.25,0.0,0.5,0.692,0.268,0,1.916
russian_polar_288,Есть ли центры А́гни-йо́ги в России в 2019 году?,ru,0.65,0.2,0.0,0.8,0.667,0.333,1,2.65
russian_polar_228,Живут меннониты в России?,ru,0.267,0.2,0.0,0.4,0.75,0.056,1,1.672
russian_content_3528,Какое уголовное наказание за фальшивомонетничество в России на сегодняшний день?,ru,0.299,0.125,0.0,0.0,0.6,0.171,0,1.194
russian_content_1279,Сколько покушений было совершено на Александра II?,ru,0.075,0.125,0.0,0.5,0.571,0.098,0,1.369
russian_content_5297,"Сколько лет было Михаилу Козакову, когда он снял фильм ""Покровские ворота""?",ru,0.179,0.625,0.333,0.5,0.636,0.268,0,2.542
russian_content_1401,Когда родился Андре́й Вале́рьевич Орло́вский?,ru,0.056,0.125,0.0,0.333,1.0,0.049,0,1.563
russian_content_8654,Какой был девиз 1-ой тáнковой диви́зии СС «Лейбштандáрт СС Адо́льф Ги́тлер»?,ru,0.224,0.375,0.0,0.0,0.818,0.244,0,1.661
russian_content_8747,Против какой армии была,ru,0.075,0.0,0.0,0.0,0.25,0.0,0,0.325
russian_polar_837,Принимают ли евро в Америке?,ru,0.4,0.2,0.0,0.6,0.6,0.111,1,1.911
russian_content_2239,Какой диаметр самого крупного бука в России?,ru,0.112,0.375,0.0,0.0,0.571,0.098,0,1.156
russian_content_12682,С какого года начали выпускаться почтовые марки в Германии?,ru,0.112,0.25,0.333,0.25,0.667,0.146,0,1.758
russian_polar_1378,Был Лев Троцкий военным корреспондентом?,ru,0.5,0.2,0.0,0.0,0.8,0.111,1,1.611
russian_polar_68,Опасна ли болезнь Монтгомери для человека?,ru,0.4,0.2,0.0,0.0,0.667,0.167,1,1.433
russian_polar_386,Есть ли тоталитарное государство в Африке по данным 2018?,ru,0.45,0.4,0.0,0.6,0.667,0.333,1,2.45
russian_content_3864,В каком возрасте Каспаров начал играть в шахматы?,ru,0.096,0.25,0.333,0.333,0.625,0.122,0,1.76
russian_content_5111,Как называется первый фильм художественный про Парапсихоло́гию?,ru,0.112,0.25,0.0,0.333,0.857,0.098,0,1.65
russian_polar_1739,Был ли Пётр Конашевич-Сагайда́чный меценатом православных школ?,ru,0.514,0.4,0.5,0.0,0.75,0.333,1,2.498
russian_content_4268,Сколько видов йоги существует?,ru,0.075,0.125,0.0,0.167,0.75,0.024,0,1.141
russian_polar_1508,Можно ли оплатить билет на метро банковской картой в Москве?,ru,0.311,0.6,0.5,0.4,0.7,0.389,1,2.9
russian_polar_1105,Граф Фёдор Васильевич Ридигер был наместником,ru,0.4,0.4,0.0,0.0,0.833,0.111,1,1.744
russian_polar_1553,Преподавал ли Альфре́д Ве́бер в Гейдельбергском университете?,ru,0.467,0.2,0.0,0.6,0.714,0.222,1,2.203
russian_content_7554,Сколько людей поженились в Лас-Вегасе в 2018 году?,ru,0.192,0.125,0.0,0.5,0.625,0.122,0,1.564
russian_polar_686,Получала ли группа The Strokes премию Грэмми?,ru,0.333,0.4,0.0,0.6,0.571,0.222,1,2.127
russian_content_5058,Кто является мультипликатором «Финес и Ферб»?,ru,0.09,0.375,0.0,0.333,0.667,0.122,0,1.587
russian_polar_813,Жили ли черепахи во времена динозавров?,ru,0.32,0.2,0.0,0.6,0.667,0.167,1,1.953
russian_content_2642,"Сколько человек, в процентах, в России страдает от мигрени на 2018?",ru,0.291,0.125,0.0,0.833,0.545,0.244,0,2.039
russian_polar_887,Chevrolet Camaro поставлялся в Россию за годы выпуска?,ru,0.286,0.2,0.0,0.6,0.5,0.278,1,1.863
russian_content_1590,Какая книга описывает примордиа́льную тради́цию?,ru,0.056,0.125,0.0,0.333,0.8,0.049,0,1.363
russian_content_3641,Что является главной целью практики раджа-йоги Брахма Кумарис?,ru,0.032,0.5,0.0,0.333,0.875,0.122,0,1.862
russian_content_4436,Сколько длилась оборона Севастополя?,ru,0.0,0.125,0.0,0.333,0.75,0.024,0,1.233
russian_polar_462,Преследуется ли гомосексуализм в России уголовным правом в 2018 году?,ru,0.8,0.2,0.0,1.0,0.7,0.389,1,3.089
russian_content_7926,Кто победил в Северной войне?,ru,0.168,0.125,0.0,0.333,0.6,0.049,0,1.275
russian_content_11035,Какая основная религия в Чеченской Республике на март 2019?,ru,0.224,0.125,0.0,0.0,0.667,0.146,0,1.162
russian_content_9402,На каком расстоянии от Москвы расположена Тро́ице-Се́ргиева ла́вра?,ru,0.16,0.25,0.0,0.0,0.625,0.122,0,1.157
russian_content_3359,Кто командовал Ленинградско-Новгородской операцией со стороны Красной Армии?,ru,0.224,0.375,0.0,0.333,0.778,0.146,0,1.856
russian_content_1510,Кто был предшественником Ю́рия Андро́пова на должности Генерального секретаря ЦК КПСС?,ru,0.112,0.375,0.0,0.0,0.727,0.195,0,1.409
russian_polar_1013,Сидел ли когда-нибудь Гитлер в тюрьме?,ru,0.56,0.2,0.0,0.8,0.667,0.167,1,2.393
russian_polar_612,Есть ли музей Ферна́ндо Анто́нио Ноге́йра Пессо́а в его родном городе?,ru,0.56,0.4,0.0,0.4,0.727,0.444,1,2.532
russian_content_4025,Как зовут главного героя в Diablo III?,ru,0.149,0.125,0.0,0.5,0.714,0.098,0,1.586
russian_polar_1147,Участвовал S35 в годы Второй Мировой войны?,ru,0.333,0.4,0.0,0.4,0.714,0.222,1,2.07
russian_content_5489,Сколько лет правила императрица,ru,0.0,0.125,0.0,0.333,0.75,0.0,0,1.208
russian_polar_502,Производят ли гранатомёт «Ва́йпер» в 2019 году?,ru,0.667,0.2,0.0,0.6,0.714,0.333,1,2.514
russian_content_3248,"Кто написал ""Повесть Временных лет""?",ru,0.112,0.25,0.0,0.333,0.8,0.098,0,1.593
russian_content_12676,Когда был написан Ветхий завет?,ru,0.112,0.125,0.0,0.5,0.8,0.049,0,1.586
russian_content_11962,Кто был режиссёром фильма «Алекса́ндр Не́вский»?,ru,0.09,0.25,0.0,0.0,0.667,0.122,0,1.128
russian_content_3601,Кто стоит во главе Доне́цкой Наро́дной Респу́блики в 2019 году?,ru,0.299,0.25,0.0,0.5,0.7,0.171,0,1.919
russian_content_9996,Где происходит действие первой серии пятого сезона телесериала «Доктор Кто»?,ru,0.075,0.625,0.0,0.333,0.9,0.22,0,2.152
russian_polar_766,Есть в Которе горы?,ru,0.4,0.2,0.0,0.4,0.75,0.056,1,1.806
russian_content_5098,Какая длина Хитро́вской площади?,ru,0.075,0.125,0.0,0.0,0.75,0.024,0,0.974
russian_polar_421,Есть ли у Казахстана выход к морю?,ru,0.4,0.4,0.0,0.6,0.571,0.222,1,2.194
russian_content_8418,Какой священный символ император Константин нанес на щиты войнов?,ru,0.14,0.125,0.0,0.5,0.778,0.146,0,1.689
russian_content_4903,Когда родился Кли́нтон Ри́чард До́кинз?,ru,0.056,0.125,0.0,0.333,1.0,0.049,0,1.563
russian_content_6446,Сколько было выпущено Ford Ranchero за годы производства?,ru,0.128,0.125,0.0,0.667,0.375,0.122,0,1.417
russian_content_9238,Когда начала проводится Украиниза́ция в УССР?,ru,0.134,0.25,0.333,0.333,0.833,0.073,0,1.957
russian_content_2412,Что добывают в Солика́мске?,ru,0.075,0.125,0.0,0.333,0.5,0.024,0,1.057
russian_content_6373,На каком языке пишет Вера Камши?,ru,0.045,0.125,0.0,0.333,0.667,0.073,0,1.243
russian_polar_450,Есть ли дошедший до наших времен автопортрет Никола́ Пуссе́н?,ru,0.55,0.6,0.5,0.3,0.667,0.333,1,2.95
russian_content_5478,Кто такой младенец?,ru,0.112,0.125,0.0,0.0,0.333,0.0,0,0.57
russian_content_2814,Какая высота самой высокой пирамиды майя?,ru,0.09,0.25,0.0,0.0,0.667,0.073,0,1.079
russian_polar_322,Се́рая ца́пля обитает в России?,ru,0.1,0.2,0.0,0.4,0.8,0.111,1,1.611
russian_content_6456,Когда был построен Сестроре́цкий Разли́в?,ru,0.112,0.125,0.0,0.5,0.8,0.049,0,1.586
russian_polar_176,Признали Ходжали́нскую резню геноцидом?,ru,0.4,0.2,0.0,0.4,1.0,0.056,1,2.056
russian_polar_534,Есть ли классы изучения урду в Санкт-Петербурге?,ru,0.2,0.6,0.0,0.4,0.714,0.222,1,2.137
russian_polar_1010,Джефферсон Финис Дэвис был женат?,ru,0.4,0.2,0.0,0.0,0.8,0.111,1,1.511
russian_content_10019,Что закончил Гай Ильи́ч Севери́н?,ru,0.056,0.125,0.0,0.333,0.8,0.049,0,1.363
russian_polar_1020,Излечима ли атаксия телеангиэктазия?,ru,0.4,0.0,0.0,0.0,0.75,0.056,1,1.206
russian_content_6432,Сколько стран признали однополые браки на 2019 год?,ru,0.192,0.125,0.0,0.5,0.75,0.122,0,1.689
russian_polar_1027,Обязательна ли военная служба в Израиле для женщин?,ru,0.514,0.4,0.0,0.0,0.625,0.278,1,1.817
russian_polar_304,Евге́ний Дми́триевич Полива́нов создал русскую транскрипцию для японского языка?,ru,0.35,0.4,0.0,0.4,0.889,0.333,1,2.372
russian_content_12209,Что значит парастэзия?,ru,0.0,0.0,0.0,0.333,0.667,0.0,0,1.0
russian_polar_894,Зависят ли предпочтения в еде от группы крови?,ru,0.514,0.2,0.0,0.8,0.625,0.278,1,2.417
russian_content_6816,За сколько часов можно доехать из Москвы в Ки́нешму на машине?,ru,0.246,0.25,0.333,0.417,0.545,0.195,0,1.987
russian_polar_665,Бензодиазепи́ны используют для лечения эпилепсии?,ru,0.1,0.2,0.0,0.4,0.8,0.111,1,1.611
russian_content_2219,Сколько последователей зороастри́зма было в России в 2018?,ru,0.16,0.125,0.0,0.0,0.5,0.122,0,0.907
russian_polar_1462,Излечим ли злокачественный нейролептический синдром?,ru,0.4,0.2,0.0,0.4,0.8,0.111,1,1.911
russian_content_8128,Каких морских птиц больше всего в мире по данным на 2019 год?,ru,0.204,0.25,0.0,0.0,0.5,0.22,0,1.173
russian_polar_18,Разновидность Паровоза О звали овечкой?,ru,0.2,0.2,0.0,0.6,0.8,0.111,1,1.911
